4803,Far and Away,"A young man leaves Ireland with his landlord's daughter after some trouble with her father, and they dream of owning land at the big giveaway in Oklahoma ca. 1893. When they get to the new land, they find jobs and begin saving money. The man becomes a local barehands boxer, and rides in glory until he is beaten, then his employers steal all the couple's money and they must fight off starvation in the winter, and try to keep their dream of owning land alive. Meanwhile, the woman's parents find out where she has gone and have come to America to find her and take her back.",1992-05-22,6.7,1049,en,18.168
4804,No Man of God,The complicated relationship that formed between the FBI analyst Bill Hagmaier and serial killer Ted Bundy during Bundy's final years on death row.,2021-08-19,6.7,209,en,18.463
4829,Free State of Jones,"In 1863, Mississippi farmer Newt Knight serves as a medic for the Confederate Army. Opposed to slavery, Knight would rather help the wounded than fight the Union. After his nephew dies in battle, Newt returns home to Jones County to safeguard his family but is soon branded an outlaw deserter. Forced to flee, he finds refuge with a group of runaway slaves hiding out in the swamps. Forging an alliance with the slaves and other farmers, Knight leads a rebellion that would forever change history.",2016-06-24,6.7,1309,en,19.13
4830,Escape Plan,"Ray Breslin is the world's foremost authority on structural security. After analyzing every high security prison and learning a vast array of survival skills so he can design escape-proof prisons, his skills are put to the test. He's framed and incarcerated in a master prison he designed himself. He needs to escape and find the person who put him behind bars.",2013-10-09,6.7,4594,en,25.257
4831,Dog Soldiers,"A squad of British soldiers on training in the lonesome Scottish wilderness find a wounded Special Forces captain and the remains of his team. As they encounter zoologist Megan, it turns out that werewolves are active in the region. They have to prepare for some action as there will be a full moon tonight...",2002-05-10,6.7,710,en,10.369
4837,The Freshmen,"Antoine is about to start his first year of medical school… for the third time. Benjamin, just out of high school, will make his first try. He soon realizes it's not exactly a walk in the park. In a fiercely competitive environment, with nights dedicated to hard studying rather than hard partying, the two freshmen will have to adapt and find a middle ground between despair for the present and hope for the future.",2018-09-12,6.7,632,fr,8.331
4857,Practical Magic,"Sally and Gillian Owens, born into a magical family, have mostly avoided witchcraft themselves. But when Gillian's vicious boyfriend, Jimmy Angelov, dies unexpectedly, the Owens sisters give themselves a crash course in hard magic. With policeman Gary Hallet growing suspicious, the girls struggle to resurrect Angelov -- and unwittingly inject his corpse with an evil spirit that threatens to end their family line.",1998-10-16,6.7,1251,en,16.772
4860,Fractured,"Driving cross-country, Ray and his wife and daughter stop at a highway rest area where his daughter falls and breaks her arm. After a frantic rush to the hospital and a clash with the check-in nurse, Ray is finally able to get her to a doctor. While the wife and daughter go downstairs for an MRI, Ray, exhausted, passes out in a chair in the lobby. Upon waking up, they have no record or knowledge of Ray's family ever being checked in.",2019-09-22,6.7,2051,en,38.307
4868,Mansfield Park,"When spirited young woman, Fanny Price is sent away to live on the great country estate of her rich cousins, she's meant to learn the ways of proper society. But while Fanny learns 'their' ways, she also enlightens them with a wit and sparkle all her own.",1999-11-12,6.7,270,en,11.736
4872,Haunt,"\"On Halloween, a group of friends encounter an \"\"extreme\"\" haunted house that promises to feed on their darkest fears. The night turns deadly as they come to the horrifying realization that some nightmares are real.\"",2019-09-13,6.7,956,en,14.404
4876,Piglet's Big Movie,"When the gang from the Hundred Acre Wood begin a honey harvest, young Piglet is excluded and told that he is too small to help. Feeling inferior, Piglet disappears and his pals Eeyore, Rabbit, Tigger, Roo and Winnie the Pooh must use Piglet's scrapbook as a map to find him. In the process they discover that this very small animal has been a big hero in a lot of ways.",2003-03-16,6.7,299,en,16.523
4888,All Eyez on Me,"All Eyez on Me chronicles the life and legacy of Tupac Shakur, including his rise to superstardom as a hip-hop artist, actor, poet and activist, as well as his imprisonment and prolific, controversial time at Death Row Records. Against insurmountable odds, Tupac rose to become a cultural icon whose career and persona both continue to grow long after his passing.",2017-06-12,6.7,1074,en,18.412
4900,Don Juan DeMarco,"John Arnold DeMarco is a man who believes he is Don Juan, the greatest lover in the world. Clad in a cape and mask, DeMarco undergoes psychiatric treatment with Dr. Jack Mickler to cure him of his apparent delusion. But the psychiatric sessions have an unexpected effect on the psychiatric staff and, most profoundly, Dr Mickler, who rekindles the romance in his complacent marriage.",1994-10-12,6.7,651,en,11.228
4903,Murder on the Orient Express,Genius Belgian detective Hercule Poirot investigates the murder of an American tycoon aboard the Orient Express train.,2017-11-03,6.7,8894,en,28.004
4906,Benedetta,A 17th-century nun becomes entangled in a forbidden lesbian affair with a novice. But it is Benedetta's shocking religious visions that threaten to shake the Church to its core.,2021-07-09,6.7,747,fr,28.77
4932,Rabbit Hole,Life for a happy couple is turned upside down after their young son dies in an accident.,2010-12-16,6.7,507,en,12.044
5018,Green Room,"A punk rock band becomes trapped in a secluded venue after finding a scene of violence. For what they saw, the band themselves become targets of violence from a gang of white power skinheads, who want to eliminate all evidence of the crime.",2015-09-25,6.7,2367,en,13.442
5019,Serial (Bad) Weddings,A catholic French couple sees their life upside down when their four daughters get married to men of different religion and origins.,2014-04-16,6.7,3171,fr,14.661
5038,Around the World in Eighty Days,"Based on the famous book by Jules Verne the movie follows Phileas Fogg on his journey around the world. Which has to be completed within 80 days, a very short period for those days.",1956-10-17,6.7,406,en,14.776
5042,Summertime,"In 1971, a young woman moves from the French countryside to Paris and begins a passionate love affair with a feminist leader.",2015-08-19,6.7,299,fr,17.041
5047,Kursk,"Barents Sea, August 12th, 2000. During a Russian naval exercise, and after suffering a serious accident, the K-141 Kursk submarine sinks with 118 crew members on board. While the few sailors who are still alive barely manage to survive, their families push for accurate information and a British officer struggles to obtain from the Russian government a permit to attempt a rescue before it is late. But general incompetence are against all their efforts.",2018-11-07,6.7,480,en,14.712
5058,Jurassic World,"Twenty-two years after the events of Jurassic Park, Isla Nublar now features a fully functioning dinosaur theme park, Jurassic World, as originally envisioned by John Hammond.",2015-06-12,6.7,18854,en,110.976
5079,Populaire,"Rose Pamphyle lives with her widowed father and is destined to marry a son of the local mechanic. When she travels out of town and applies for a secretarial job with an insurance agency run by Louis Échard, he learns that Rose can type with extraordinary speed - using only two fingers. He tells her to compete in a speed-typing competition if she wants the job.",2012-11-27,6.7,495,fr,9.715
5082,Antichrist,"A grieving couple retreats to their cabin 'Eden' in the woods, hoping to repair their broken hearts and troubled marriage. But nature takes its course and things go from bad to worse.",2009-05-20,6.7,2225,en,18.49
5086,Heaven Is for Real,"The true story of the 4-year old son of a small-town pastor who, during emergency surgery, slips from consciousness and enters heaven. When he awakes, he recounts his experiences on the other side.",2014-04-16,6.7,670,en,28.727
5100,Just Go with It,"A plastic surgeon, romancing a much younger schoolteacher, enlists his loyal assistant to pretend to be his soon to be ex-wife, in order to cover up a careless lie. When more lies backfire, the assistant's kids become involved, and everyone heads off for a weekend in Hawaii that will change all their lives.  A remake of Cactus Flower (1969).",2011-02-10,6.7,5015,en,60.998
5105,Charlie Bartlett,"Awkward teenager Charlie Bartlett has trouble fitting in at a new high school. Charlie needs some friends fast, and decides that the best way to find them is to appoint himself the resident psychiatrist. He becomes one of the most popular guys in school by doling out advice and, occasionally, medication, to the student body.",2007-05-01,6.7,548,en,8.501
5106,Meet the Parents,"Greg Focker is ready to marry his girlfriend, Pam, but before he pops the question, he must win over her formidable father, humorless former CIA agent Jack Byrnes, at the wedding of Pam's sister. As Greg bends over backward to make a good impression, his visit to the Byrnes home turns into a hilarious series of disasters, and everything that can go wrong does, all under Jack's critical, hawklike gaze.",2000-10-06,6.7,5287,en,19.002
5119,Help! I'm a Fish,"Three children accidentally get turned into fish after drinking a potion made by an eccentric scientist. The kids end up in the sea, with one problem. They must find and drink the antidote within 48 hours, or forever remain as fish.",2000-10-06,6.7,345,da,18.001
5127,Go!,"Jack is a charismatic larrikin who has just discovered the one thing he's really good at — go-kart racing. With the support of his mentor, Patrick, an old race car driver with a secret past, and his best mates Colin and Mandy, Jack must learn to control his recklessness if he is to defeat the best drivers in Australia, including the ruthless champion Dean, and win the National title.",2020-01-16,6.7,226,en,8.32
5134,Megamind: The Button of Doom,"\"For their first day on the job as the new protectors of Metro City, Megamind and Minion are selling off the gadgets from their evil lair. But when one seemingly harmless \"\"button\"\" unleashes the gigantic robot MEGA-MEGAmind","the duo will have to resort to their old tricks to restore order.\"",2011-02-25,6.7,204,en
5139,Dead Presidents,On the streets they call cash dead presidents. And that's just what a Vietnam veteran is after when he returns home from the war only to find himself drawn into a life of crime. With the aid of his fellow vets he plans the ultimate heist -- a daring robbery of an armored car filled with unmarked U.S. currency!,1995-10-06,6.7,239,en,9.1
5143,Keep an Eye Out,Police officers at a station must solve a murder case.,2018-07-04,6.7,521,fr,7.072
5158,Cloverfield,"Five young New Yorkers throw their friend a going-away party the night that a monster the size of a skyscraper descends upon the city. Told from the point of view of their video camera, the film is a document of their attempt to survive the most surreal, horrifying event of their lives.",2008-01-15,6.7,6261,en,31.937
5171,You've Got Mail,"Book superstore magnate, Joe Fox and independent book shop owner, Kathleen Kelly fall in love in the anonymity of the Internet—both blissfully unaware that he's trying to put her out of business.",1998-02-26,6.7,2827,en,18.856
5172,Monster House,"Monsters under the bed are scary enough, but what happens when an entire house is out to get you? Three teens aim to find out when they go up against a decrepit neighboring home and unlock its frightening secrets.",2006-06-30,6.7,3445,en,31.967
5181,Black '47,"In 1847, when Ireland is in the grip of the Great Famine that has ravaged the country for two long years, Feeney, a hardened Irish Ranger who has been fighting for the British Army abroad, returns home to reunite with his estranged family, only to discover the cruelest reality, a black land where death reigns.",2018-09-05,6.7,252,en,8.51
5220,Princess Protection Program,"When her nation is invaded, a young princess is taken into the Princess Protection Program. She is relocated to Louisiana, where she stays with a covert agent and his tomboyish daughter, and must learn how to behave like an ordinary teenager.",2009-05-20,6.6,1561,en,22.242
5222,Half Nelson,"Despite his dedication to the junior-high students who fill his classroom, idealistic teacher Dan Dunne leads a secret life of addiction that the majority of his students will never know. But things change when a troubled student Drey makes a startling discovery of his secret life, causing a tenuous bond between the two that could either end disastrously or provide a catalyst of hope.",2006-08-11,6.6,743,en,9.492
5228,Geek Charming,"Film geek Josh is looking for the subject of his new documentary when a chance meeting puts the perfect star in his sights—Dylan, his school's most popular junior. But Dylan's hopes of using the film to become Blossom Queen don't quite match with Josh's goal to make a hard-hitting exposé about popularity. Will Josh shoot the film as planned, or show Dylan as the truly interesting person she is?",2011-11-11,6.6,697,en,9.576
5232,Underdogs,"In the small village where Amadeo lives there is no one good enough to challenge his skills at Table Football. But, while Amadeo may be a genius as a table football player in real life he's a loser. He's in love with Lara, his childhood friend, but he's so shy that he can't bring himself to confess his love for her. So he just hangs out in his quaint, timeless village. When Amadeo beats the village bully Flash at Table Football. The scene is set for an epic rivalry. Consumed with anger Flash vows to get even and 10 years later he returns as an International Superstar, a Football Icon and Galatico determined to wreak his revenge.",2013-07-18,6.6,384,es,32.44
5234,Heartbreaker,Alex and his sister run a business designed to break up relationships. They are hired by a rich man to break up the wedding of his daughter. The only problem is that they only have one week to do so.,2010-03-17,6.6,1197,fr,9.072
5250,Attraction,"After an alien ship crash lands in a Russian city, many who see the inside and the occupants start to question their own existence while others demand the aliens leave Earth.",2017-01-26,6.6,687,ru,18.155
5267,Happy Death Day,"Caught in a bizarre and terrifying time warp, college student Tree finds herself repeatedly reliving the day of her murder, ultimately realizing that she must identify the killer and the reason for her death before her chances of survival run out.",2017-10-12,6.6,5513,en,21.927
5292,Society,A Beverly Hills teen discovers his parents are part of a gruesome orgy cult for the social elite.,1989-05-13,6.6,421,en,10.23
5295,Alpha Dog,"Johnny Truelove likes to see himself as tough. He's the son of an underworld figure and a drug dealer. Johnny also likes to get tough when things don't go his way. When Jake Mazursky fails to pay up for Johnny, things get worse for the Mazursky family, as Johnny and his 'gang' kidnap Jake's 15 year old brother and holds him hostage. Problem now is what to do with 'stolen boy?'",2006-01-27,6.6,1198,en,13.144
5301,Rambo,"When governments fail to act on behalf of captive missionaries, ex-Green Beret John James Rambo sets aside his peaceful existence along the Salween River in a war-torn region of Thailand to take action.  Although he's still haunted by violent memories of his time as a U.S. soldier during the Vietnam War, Rambo can hardly turn his back on the aid workers who so desperately need his help.",2008-01-24,6.6,3344,en,61.709
5328,Unfaithful,"Connie is a wife and mother whose 11-year marriage to Edward has lost its sexual spark. When Connie literally runs into handsome book collector Paul, he sweeps her into an all-consuming affair. But Edward soon becomes suspicious and decides to confront the other man.",2002-05-10,6.6,1297,en,29.832
5337,Calendar Girls,Members of a Yorkshire branch of the Women's Institute cause controversy when they pose nude for a charity calendar.,2003-09-02,6.6,332,en,7.927
5340,The Protégé,"Rescued as a child by the legendary assassin Moody and trained in the family business, Anna is the world’s most skilled contract killer. When Moody, the man who was like a father to her and taught her everything she needs to know about trust and survival, is brutally killed, Anna vows revenge. As she becomes entangled with an enigmatic killer whose attraction to her goes way beyond cat and mouse, their confrontation turns deadly and the loose ends of a life spent killing will weave themselves ever tighter.",2021-08-19,6.6,760,en,44.881
5342,The Guest,"A soldier introduces himself to the Peterson family, claiming to be a friend of their son who died in action. After the young man is welcomed into their home, a series of accidental deaths seem to be connected to his presence.",2014-09-05,6.6,1682,en,16.534
5364,Shinjuku Incident,"Steelhead is a Chinese labourer who comes to Japan hoping for a better life. Unable to find honest work and bullied into the shadows with his fellow Chinese illegal immigrants, he soon finds himself ascending as the boss of a black market mob. After providing a deadly service to a powerful Yakuza crime boss, Steelhead’s rise to mafia power spirals rapidly out of control as he’s given reign over the dangerous and lucrative Shinjuku district.",2009-03-22,6.6,217,cn,13.221
5367,Tigerland,"A group of recruits go through Advanced Infantry Training at Fort Polk, Louisiana's infamous Tigerland, last stop before Vietnam for tens of thousands of young men in 1971.",2000-10-06,6.6,477,en,9.017
5381,Tinker Tailor Soldier Spy,"In the bleak days of the Cold War, espionage veteran George Smiley is forced from semi-retirement to uncover a Soviet mole within his former colleagues at the heart of MI6.",2011-09-16,6.6,2276,en,13.619
5391,Away We Go,"Verona and Burt have moved to Colorado to be close to Burt's parents but, with Veronica expecting their first child, Burt's parents decide to move to Belgium, now leaving them in a place they hate and without a support structure in place. They set off on a whirlwind tour of of disparate locations where they have friends or relatives, sampling not only different cities and climates but also different families. Along the way they realize that the journey is less about discovering where they want to live and more about figuring out what type of parents they want to be.",2009-06-05,6.6,492,en,9.394
5395,Beavis and Butt-Head Do America,"Slacker duo Beavis and Butt-Head wake to discover their TV has been stolen. Their search for a new one takes them on a clueless adventure across America, during which they manage to accidentally become America's most wanted.",1996-12-15,6.6,563,en,12.399
5407,You're Next,"When the Davison family comes under attack during their wedding anniversary getaway, the gang of mysterious killers soon learns that one of their victims harbors a secret talent for fighting back.",2011-09-10,6.6,2179,en,14.938
5409,Oblivion,"Jack Harper is one of the last few drone repairmen stationed on Earth. Part of a massive operation to extract vital resources after decades of war with a terrifying threat known as the Scavs, Jack’s mission is nearly complete. His existence is brought crashing down when he rescues a beautiful  stranger from a downed spacecraft. Her arrival triggers a chain of events that  forces him to question everything he knows and puts the fate of humanity in his hands.",2013-04-10,6.6,9705,en,36.415
5433,Kika,"Kika, a cute cosmetologist, prepares Ramon for funeral when he revives. He proposes to the much older Kika who has his dad as lover. Did Ramon's dad murder his mom? What about the escaped rapist and the Psychologist video reporter.",1993-10-29,6.6,235,es,9.069
5436,A Most Violent Year,"A thriller set in New York City during the winter of 1981, statistically one of the most violent years in the city's history, and centered on the lives of an immigrant and his family trying to expand their business and capitalize on opportunities as the rampant violence, decay, and corruption of the day drag them in and threaten to destroy all they have built.",2014-12-31,6.6,1264,en,18.176
5454,Man of Steel,"A young boy learns that he has extraordinary powers and is not of this earth. As a young man, he journeys to discover where he came from and what he was sent here to do. But the hero in him must emerge if he is to save the world from annihilation and become the symbol of hope for all mankind.",2013-06-12,6.6,13814,en,64.21
5508,Lady Macbeth,"Rural England, 1865. Katherine, suffocated by her loveless marriage to a bitter man and restrained by his father's tyranny, unleashes an irresistible force within her, so powerful that she will stop at nothing to get what she wants.",2017-04-28,6.6,649,en,13.255
5523,Road House,"The Double Deuce is the meanest, loudest and rowdiest bar south of the Mason-Dixon Line, and Dalton has been hired to clean it up. He might not look like much, but the Ph.D.-educated bouncer proves he's more than capable -- busting the heads of troublemakers and turning the roadhouse into a jumping hot-spot. But Dalton's romance with the gorgeous Dr. Clay puts him on the bad side of cutthroat local big shot Brad Wesley.",1989-05-19,6.6,891,en,10.193
5526,Caught by a Wave,A summer fling born under the Sicilian sun quickly develops into a heartbreaking love story that forces a boy and girl to grow up too quickly.,2021-03-25,6.6,218,it,25.869
5543,Chennai Express,"Rahul embarks on a journey to a small town in Tamil Nadu to fulfill the last wish of his grandfather: to have his ashes immersed in the Holy water of Rameshwaram. En route, he meets a woman hailing from a unique family down South. As they find love through this journey in the exuberant lands of South India, an unanticipated drive awaits them.",2013-08-08,6.6,275,hi,8.272
5569,Lethal Weapon 4,"In the combustible action franchise's final installment, maverick detectives Martin Riggs and Roger Murtaugh square off against Asian mobster Wah Sing Ku, who's up to his neck in slave trading and counterfeit currency. With help from gumshoe Leo Getz and smart-aleck rookie cop Lee Butters, Riggs and Murtaugh aim to take down Ku and his gang.",1998-07-10,6.6,2273,en,21.271
5575,Caterina in the Big City,"When her social-climbing father is relocated from small-town North to his native Rome, 12-year-old Caterina enrolls to his old school, finding herself in an completely different environment where students rigidly divide themselves in subcultures based on social class and their parents' political affiliation.",2003-10-24,6.6,224,it,5.959
5583,Super,"After his wife falls under the influence of a drug dealer, an everyday guy transforms himself into Crimson Bolt, a superhero with the best intentions, though he lacks for heroic skills.",2010-11-26,6.6,1290,en,14.771
5587,Annapolis,"Jake Huard, from a shipbuilders family, promised his dying mother he'ld make it to Anapolis Naval Academy. Thanks to tenaciously bugging a Congressman, he's selected despite dubious grades. Once inside, Jake soon proves sub-standard academically. Constantly challenged to his limits, repeatedly made the 'over-cocky' reason for the entire class to suffer, Jake nearly quits, but after facing his utterly un-supportive father's gloating returns just in time. Stubborn Jake finds support withs mates as well as Senor Ali, his lover-to-be, and a discipline he may excel in: the 'brigade' boxing tournament, open to all ranks.",2006-01-27,6.6,393,en,34.197
5591,Thirteen,"Tracy is a normal 13-year-old trying to make it in school. After befriending the most popular girl at school, Evie, Tracy's world is turned upside down when Evie introduces her to a world of sex, drugs and cash. But it isn't long before Tracy's new world and attitude finally takes a toll on her, her family, and old friends.",2003-08-20,6.6,1378,en,20.468
5615,Cry-Baby,A prim and proper schoolgirl goes against her grandmother's wishes when she dates a motorcycle-riding juvenile delinquent.,1990-04-05,6.6,1350,en,12.317
5626,The Lion King 1½,Timon the meerkat and Pumbaa the warthog are best pals and the unsung heroes of the African savanna. This prequel to the smash Disney animated adventure takes you back -- way back -- before Simba's adventure began. You'll find out all about Timon and Pumbaa and tag along as they search for the perfect home and attempt to raise a rambunctious lion cub.,2004-02-06,6.6,2670,en,46.396
5632,Silver Bullet,"The small city of Tarker's Mill is startled by a series of sadistic murders. The population fears that this is the work of a maniac. During a search a mysterious, hairy creature is observed. This strange appearance is noticed once a month. People lock themselves up at night, but there's one boy who's still outside, he's preparing the barbecue.",1985-10-10,6.6,477,en,18.529
