2,Cuando Sea Joven,"\"70-year-old Malena gets a second chance at life when she magically turns into her 22-year-old self. Now, posing as \"\"Maria\"\" to hide her true identity",she becomes the lead singer of her grandson's band and tries to recover her dream of singing,"which she had to give up at some point.\"",2022-09-14,8.7,208
7,Spirited Away,"A young girl, Chihiro, becomes trapped in a strange new world of spirits. When her parents undergo a mysterious transformation, she must call upon the courage she never knew she had to free her family.",2002-09-20,8.5,14006,ja,77.678
9,Your Name.,"High schoolers Mitsuha and Taki are complete strangers living separate lives. But one night, they suddenly switch places. Mitsuha wakes up in Taki’s body, and he in hers. This bizarre occurrence continues to happen randomly, and the two must adjust their lives around each other.",2016-08-26,8.5,9555,ja,94.443
27,Grave of the Fireflies,"In the final months of World War II, 14-year-old Seita and his sister Setsuko are orphaned when their mother is killed during an air raid in Kobe, Japan. After a falling out with their aunt, they move into an abandoned bomb shelter. With no surviving relatives and their emergency rations depleted, Seita and Setsuko struggle to survive.",1988-04-16,8.4,4526,ja,0.6
50,Neon Genesis Evangelion: The End of Evangelion,"The second of two theatrically released follow-ups to the Neon Genesis Evangelion series. Comprising of two alternate episodes which were first intended to take the place of episodes 25 and 26, this finale answers many of the questions surrounding the series, while also opening up some new possibilities.",1997-07-19,8.4,1245,ja,32.277
56,Ikiru,"Kanji Watanabe is a middle-aged man who has worked in the same monotonous bureaucratic position for decades. Learning he has cancer, he starts to look for the meaning of his life.",1952-10-09,8.4,885,ja,13.863
59,The Silence of the Lambs,"Clarice Starling is a top student at the FBI's training academy.  Jack Crawford wants Clarice to interview Dr. Hannibal Lecter, a brilliant psychiatrist who is also a violent psychopath, serving life behind bars for various acts of murder and cannibalism.  Crawford believes that Lecter may have insight into a case and that Starling, as an attractive young woman, may be just the bait to draw him out.",1991-02-14,8.3,14276,en,11.494
80,Demon Slayer -Kimetsu no Yaiba- The Movie: Mugen Train,"Tanjirō Kamado, joined with Inosuke Hashibira, a boy raised by boars who wears a boar's head, and Zenitsu Agatsuma, a scared boy who reveals his true power when he sleeps, boards the Infinity Train on a new mission with the Fire Hashira, Kyōjurō Rengoku, to defeat a demon who has been tormenting the people and killing the demon slayers who oppose it!",2020-10-16,8.3,2956,ja,324.898
83,Apocalypse Now,"\"At the height of the Vietnam war, Captain Benjamin Willard is sent on a dangerous mission that, officially, \"\"does not exist","nor will it ever exist.\"\" His goal is to locate - and eliminate - a mysterious Green Beret Colonel named Walter Kurtz","who has been leading his personal army on illegal guerrilla missions into enemy territory.\"",1979-08-15,8.3,7074
109,Rascal Does Not Dream of a Dreaming Girl,"In Fujisawa, Sakuta Azusagawa is in his second year of high school. Blissful days with his girlfriend and upperclassman, Mai Sakurajima, are interrupted by the appearance of his first crush, Shoko Makinohara.",2019-06-15,8.2,431,ja,29.44
130,Star Wars,Princess Leia is captured and held hostage by the evil Imperial forces in their effort to take over the galactic Empire. Venturesome Luke Skywalker and dashing captain Han Solo team together with the loveable robot duo R2-D2 and C-3PO to rescue the beautiful princess and restore peace and justice in the Empire.,1977-05-25,8.2,18309,en,65.139
154,Abraham Lincoln Vampire Hunter: The Great Calamity,"A motion comic follow-up to a chapter from Abraham Lincoln Vampire Hunter novel where Abe's friend, Edgar Allan Poe, tells him the tale of historical Hungarian countess Elizabeth Bathory, often tied to vampire legends due to her brutality.",2012-10-23,8.2,206,en,4.919
158,KonoSuba: God's Blessing on this Wonderful World! Legend of Crimson,"It is not strange that the Demon Lord's forces fear the Crimson Demons, the clan from which Megumin and Yunyun originate. Even if the Demon Lord's generals attack their village, the Crimson Demons can just easily brush them off with their supreme mastery of advanced and overpowered magic.  When Yunyun receives a seemingly serious letter regarding a potential disaster coming to her hometown, she immediately informs Kazuma Satou and the rest of his party. After a series of wacky misunderstandings, it turns out to be a mere prank by her fellow demon who wants to be an author. Even so, Megumin becomes worried about her family and sets out toward the Crimson Demons' village with the gang.  There, Kazuma and the others decide to sightsee the wonders of Megumin's birthplace. However, they soon come to realize that the nonsense threat they received might have been more than just a joke.",2019-08-30,8.2,434,ja,39.698
159,Capernaum,"Zain, a 12-year-old boy scrambling to survive on the streets of Beirut, sues his parents for having brought him into such an unjust world, where being a refugee with no documents means that your rights can easily be denied.",2018-09-20,8.2,1417,ar,19.279
163,The Departed,"To take down South Boston's Irish Mafia, the police send in one of their own to infiltrate the underworld, not realizing the syndicate has done likewise. While an undercover cop curries favor with the mob kingpin, a career criminal rises through the police ranks. But both sides soon discover there's a mole among them.",2006-10-04,8.2,13181,en,36.299
170,Django Unchained,"With the help of a German bounty hunter, a freed slave sets out to rescue his wife from a brutal Mississippi plantation owner.",2012-12-25,8.2,23738,en,67.235
185,Full Metal Jacket,A pragmatic U.S. Marine observes the dehumanizing effects the U.S.-Vietnam War has on his fellow recruits from their brutal boot camp training to the bloody street fighting in Hue.,1987-06-26,8.1,9208,en,44.392
196,Some Like It Hot,"Two musicians witness a mob hit and struggle to find a way out of the city before they are found by the gangsters. Their only opportunity is to join an all-girl band as they leave on a tour. To make their getaway they must first disguise themselves as women, then keep their identities secret and deal with the problems this brings - such as an attractive bandmate and a very determined suitor.",1959-03-19,8.1,2972,en,24.325
201,Harry Potter and the Deathly Hallows: Part 2,"Harry, Ron and Hermione continue their quest to vanquish the evil Voldemort once and for all. Just as things begin to look hopeless for the young wizards, Harry discovers a trio of magical objects that endow him with powers to rival Voldemort's formidable skills.",2011-07-07,8.1,18436,en,164.952
202,In the Mood for Love,"Hong Kong, 1962: Chow Mo-Wan and Su Li-Zhen move into neighboring apartments on the same day. Their encounters are formal and polite—until a discovery about their spouses creates an intimate bond between them.",2000-09-29,8.1,2135,cn,25.211
240,My Neighbor Totoro,"Two sisters move to the country with their father in order to be closer to their hospitalized mother, and discover the surrounding trees are inhabited by Totoros, magical spirits of the forest. When the youngest runs away from home, the older sister seeks help from the spirits to find her.",1988-04-16,8.1,6686,ja,45.358
257,El mesero,A waiter pretends to be an important businessman in order to reach the upper class through his entrepreneurial dreams.,2021-07-15,8.1,329,es,13.908
265,Palmer,"After 12 years in prison, former high school football star Eddie Palmer returns home to put his life back together—and forms an unlikely bond with Sam, an outcast boy from a troubled home. But Eddie's past threatens to ruin his new life and family.",2021-01-29,8.0,949,en,52.801
266,The Lives of Others,A tragic love story set in East Berlin with the backdrop of an undercover Stasi controlled culture. Stasi captain Wieler is ordered to follow author Dreyman and plunges deeper and deeper into his life until he reaches the threshold of doubting the system.,2006-03-15,8.0,3153,de,14.924
289,Citizen Kane,"Newspaper magnate, Charles Foster Kane is taken from his mother as a boy and made the ward of a rich industrialist. As a result, every well-meaning, tyrannical or self-destructive move he makes for the rest of his life appears in some way to be a reaction to that deeply wounding event.",1941-04-17,8.0,4774,en,19.9
291,Harry Potter and the Prisoner of Azkaban,"Year three at Hogwarts means new fun and challenges as Harry learns the delicate art of approaching a Hippogriff, transforming shape-shifting Boggarts into hilarity and even turning back time. But the term also brings danger: soul-sucking Dementors hover over the school, an ally of the accursed He-Who-Cannot-Be-Named lurks within the castle walls, and fearsome wizard Sirius Black escapes Azkaban. And Harry will confront them all.",2004-05-31,8.0,19161,en,194.807
293,The Sting,A novice con man teams up with an acknowledged master to avenge the murder of a mutual friend by pulling off the ultimate big con and swindling a fortune from a big-time mobster.,1973-12-25,8.0,2185,en,17.951
296,Death Note Relight 1: Visions of a God,"\"Yagami Light is an ace student with great prospects, who's bored out of his mind. One day he finds the \"\"Death Note\"\": a notebook from the realm of the Death Gods",with the power to kill people in any way he desires. With the Death Note in hand,Light decides to create his perfect world,without crime or criminals. However,when criminals start dropping dead one by one,the authorites send the legendary detective L to track down the killer
301,Scooby-Doo! Camp Scare,Scooby and the gang experience outdoor fun as they go back to Fred's old summer camp.,2010-09-14,8.0,242,en,17.234
329,Pink Floyd: The Wall,A troubled rock star descends into madness in the midst of his physical and social isolation from everyone.,1982-07-14,8.0,1275,en,12.335
367,Kill Bill: The Whole Bloody Affair,"An assassin is shot and almost killed by her ruthless employer, Bill, and other members of their assassination circle – but she lives to plot her vengeance.  Kill Bill: The Whole Bloody Affair is a complete edit of the two-part martial arts action films Kill Bill: Vol. 1 and Kill Bill: Vol. 2. The film was originally scheduled to be released as one part. However, due to the film's over 4 hour running time, it was split into two parts.",2011-03-27,8.0,847,en,18.505
368,Cries and Whispers,"As Agnes slowly dies of cancer, her sisters are so deeply immersed in their own psychic pains that they can't offer her the support she needs. Maria is wracked with guilt at her husband's attempted suicide, caused by his discovery of her extramarital affair. The self-loathing, suicidal Karin seems to regard her sister with revulsion. Only Anna, the deeply religious maid who lost her young child, seems able to offer Agnes solace and empathy.",1972-12-21,8.0,586,sv,11.088
372,Dangal,"Dangal is an extraordinary true story based on the life of Mahavir Singh and his two daughters, Geeta and Babita Phogat. The film traces the inspirational journey of a father who trains his daughters to become world class wrestlers.",2016-12-21,8.0,801,hi,15.153
385,Straight Outta Nowhere: Scooby-Doo! Meets Courage the Cowardly Dog,"With Mystery, Inc. on the tail of a strange object in Nowhere, Kansas, the strange hometown of Eustice, Muriel, and Courage, the gang soon find themselves contending with a giant cicada monster and her winged warriors.",2021-09-14,8.0,339,en,44.921
391,Akira,A secret military project endangers Neo-Tokyo when it turns a biker gang member into a rampaging psychic psychopath that only two teenagers and a group of psychics can stop.,1988-07-16,7.9,3451,ja,38.062
392,La Notte,A day in the life of an unfaithful married couple and their steadily deteriorating relationship in Milan.,1961-01-24,7.9,542,it,12.837
393,The Postman,Simple Italian postman learns to love poetry while delivering mail to a famous poet; he uses this to woo local beauty Beatrice.,1994-04-07,7.9,1005,it,8.342
401,The Boy Who Harnessed the Wind,"Against all the odds, a thirteen year old boy in Malawi invents an unconventional way to save his family and village from famine.",2019-02-14,7.9,1406,en,34.69
402,What Ever Happened to Baby Jane?,A former child star torments her paraplegic sister in their decaying Hollywood mansion.,1962-10-12,7.9,879,en,12.023
411,Luck,"Suddenly finding herself in the never-before-seen Land of Luck, the unluckiest person in the world must unite with the magical creatures there to turn her luck around.",2022-08-05,7.9,1153,en,208.985
427,Ne Zha,"The Primus extracts a Mixed Yuan Bead into a Spirit Seed and a Demon Pill. The Spirit Seed can be reincarnated as a human to help King Zhou establish a new dynasty, whereas the Demon Pill will create a devil threatening humanity. Ne Zha is the one who is destined to be the hero, but instead he becomes a devil incarnate, because the Spirit Seed and a Demon Pill are switched.",2019-07-26,7.9,318,zh,13.99
434,Young Frankenstein,"A young neurosurgeon inherits the castle of his grandfather, the famous Dr. Victor von Frankenstein. In the castle he finds a funny hunchback, a pretty lab assistant and the elderly housekeeper. Young Frankenstein believes that the work of his grandfather was delusional, but when he discovers the book where the mad doctor described his reanimation experiment, he suddenly changes his mind.",1974-12-15,7.9,2734,en,20.239
480,Invisible Life,"Rio de Janeiro, Brazil, 1950. In the conservative home of the Gusmão family, Eurídice and Guida are two inseparable sisters who support each other. While Guida can share with her younger sister the details of her romantic adventures, Eurídice finds in her older sister the encouragement she needs to pursue her dream of becoming a professional pianist.",2019-08-30,7.9,260,pt,7.879
486,Gone Girl,"With his wife's disappearance having become the focus of an intense media circus, a man sees the spotlight turned on him when it's suspected that he may not be innocent.",2014-10-01,7.9,16722,en,51.765
491,The Summit of the Gods,A photojournalist’s obsessive quest for the truth about the first expedition to Mt. Everest leads him to search for an esteemed climber who went missing.,2021-09-22,7.9,261,fr,9.892
507,Kill Bill: Vol. 2,"The Bride unwaveringly continues on her roaring rampage of revenge against the band of assassins who had tried to kill her and her unborn child. She visits each of her former associates one-by-one, checking off the victims on her Death List Five until there's nothing left to do … but kill Bill.",2004-04-16,7.9,12409,en,30.947
508,Nostalgia,A Russian poet and his interpreter travel to Italy to research the life of an 18th-century composer.,1983-05-01,7.9,424,ru,9.204
516,A Street Cat Named Bob,"James Bowen, a homeless busker and recovering drug addict, has his life transformed when he meets a stray ginger cat.",2016-11-04,7.9,1195,en,15.331
534,Her,"In the not so distant future, Theodore, a lonely writer, purchases a newly developed operating system designed to meet the user's every need. To Theodore's surprise, a romantic relationship develops between him and his operating system. This unconventional love story blends science fiction and romance in a sweet tale that explores the nature of love and the ways that technology isolates and connects us all.",2013-12-18,7.9,12876,en,35.011
548,Knives Out,"When renowned crime novelist Harlan Thrombey is found dead at his estate just after his 85th birthday, the inquisitive and debonair Detective Benoit Blanc is mysteriously enlisted to investigate. From Harlan's dysfunctional family to his devoted staff, Blanc sifts through a web of red herrings and self-serving lies to uncover the truth behind Harlan's untimely death.",2019-11-27,7.9,10399,en,57.564
549,Papillon,"A man befriends a fellow criminal as the two of them begin serving their sentence on a dreadful prison island, which inspires the man to plot his escape.",1973-12-13,7.9,1622,en,18.128
562,Kiki's Delivery Service,"A young witch, on her mandatory year of independent life, finds fitting into a new community difficult while she supports herself by running an air courier service.",1989-07-29,7.8,3314,ja,34.934
569,Regular Show: The Movie,"To save the universe, and their friendship, Mordecai and Rigby must defeat an evil volleyball coach.",2015-09-01,7.8,303,en,19.294
579,We Bare Bears: The Movie,"When Grizz, Panda, and Ice Bear's love of food trucks and viral videos get out of hand, the brothers are now chased away from their home and embark on a trip to Canada, where they can live in peace.",2020-06-30,7.8,749,en,35.12
581,Polisse,"Paris, France. Fred and his colleagues, members of the BPM, the Police Child Protection Unit, dedicated to pursuing all sorts of offenses committed against the weakest, must endure the scrutiny of Melissa, a photographer commissioned to graphically document the daily routine of the team.",2011-10-06,7.8,1051,fr,7.488
588,The Phantom Carriage,"It's New Year's Eve. Three drunkards evoke a legend. The legend tells that the last person to die in a year, if he is a great sinner, will have to drive during the whole year the Phantom Chariot, that picks up the souls of the dead.",1921-01-01,7.8,253,sv,8.259
609,A Moment to Remember,A young couple's love is tested when Sun-jin is diagnosed with a rare form of Alzheimer's disease.,2004-11-05,7.8,258,ko,10.524
612,Spotlight,"The true story of how the Boston Globe uncovered the massive scandal of child molestation and cover-up within the local Catholic Archdiocese, shaking the entire Catholic Church to its core.",2015-11-06,7.8,7524,en,17.779
618,Into the Wild,"After graduating from Emory University in 1992, top student and athlete Christopher McCandless abandons his possessions, gives his entire $24,000 savings account to charity, and hitchhikes to Alaska to live in the wilderness.",2007-09-11,7.8,8708,en,61.744
622,Aftersun,Sophie reflects on the shared joy and private melancholy of a holiday she took with her father twenty years earlier. Memories real and imagined fill the gaps between miniDV footage as she tries to reconcile the father she knew with the man she didn't.,2022-10-21,7.8,459,en,78.049
630,Fanny and Alexander,"As children in the loving Ekdahl family, Fanny and Alexander enjoy a happy life with their parents, who run a theater company. After their father dies unexpectedly, however, the siblings end up in a joyless home when their mother, Emilie, marries a stern bishop. The bleak situation gradually grows worse as the bishop becomes more controlling, but dedicated relatives make a valiant attempt to aid Emilie, Fanny and Alexander.",1982-12-17,7.8,651,sv,11.174
638,Gifted Hands: The Ben Carson Story,Gifted Hands: The Ben Carson Story is a movie based on the life story of world-renowned neurosurgeon Ben Carson from 1961 to 1987.,2009-02-07,7.8,508,en,28.316
648,Ernest & Celestine,"Celestine is a little mouse trying to avoid a dental career while Ernest is a big bear craving an artistic outlet. When Celestine meets Ernest, they overcome their natural enmity by forging a life of crime together.",2012-12-12,7.8,512,fr,9.582
658,Toy Story 3,"Woody, Buzz, and the rest of Andy's toys haven't been played with in years. With Andy about to go to college, the gang find themselves accidentally left at a nefarious day care center. The toys must band together to escape and return home to Andy.",2010-06-16,7.8,13247,en,74.141
659,Lisbela and the Prisoner,"Lisbela is a young woman who loves going to the movies. Leléu is a con man, going from town to town selling all sort of things and performing as master of ceremonies for some cheesy numbers, such as the woman who gets transformed into a gorilla. He gets involved with Linaura, a sexy and beautiful woman who happens to be the wife of the most frightening hitman of the place. The hitman finds out his wife's affair and goes after Leléu, who has to leave in a hurry. In another town, he meets and falls instantly in love with Lisbela, who is engaged to Douglas, a hillbilly who tries hard to pass for a cosmopolitan Rio de Janeiro dweller.",2003-08-22,7.8,353,pt,0.983
660,A Short Film About Love,"19-year-old Tomek whiles away his lonely life by spying on his opposite neighbour Magda through binoculars. She's an artist in her mid-thirties, and appears to have everything - not least a constant stream of men at her beck and call. But when the two finally meet, they discover that they have a lot more in common than appeared at first sight...",1988-08-21,7.8,298,pl,10.338
672,Drishyam,"A simple, street-smart man tries to protect his family from a tough cop looking for his missing son.",2015-07-30,7.8,315,hi,11.317
676,The Ox-Bow Incident,"Gil Carter and Art Croft ride into a small Nevada town plagued by cattle thieves. Initially suspected of being the rustlers themselves, Carter and Croft eventually join a posse out to get the criminals, who also may be involved in a recent shooting. When the posse closes in on a group that could be the fugitives, they must decide on a course of action, with numerous lives hanging in the balance.",1942-12-04,7.8,302,en,9.689
686,Tod@s Caen,A pair of seducers try to prove who has the best techniques while trying not to fall in love with each other.,2019-08-30,7.8,452,es,12.675
697,Angel's Egg,"In a desolate and dark world full of shadows, lives one little girl who seems to do nothing but collect water in jars and protect a large egg she carries everywhere. A mysterious man enters her life... and they discuss the world around them.",1985-12-22,7.8,309,ja,9.813
705,The Dinner Game,"For Pierre Brochant and his friends, Wednesday is “Idiots' Day”. The idea is simple: each person has to bring along an idiot. The one who brings the most spectacular idiot wins the prize. Tonight, Brochant is ecstatic. He has found a gem. The ultimate idiot, “A world champion idiot!”. What Brochant doesn’t know is that Pignon is a real jinx, a past master in the art of bringing on catastrophes...",1998-04-15,7.8,1643,fr,10.24
724,Nine Queens,"\"Two con artists try to swindle a stamp collector by selling him a sheet of counterfeit rare stamps (the \"\"nine queens\"\").\"",2000-08-31,7.8,583,es,9.247
725,Rain Man,"When car dealer Charlie Babbitt learns that his estranged father has died, he returns home to Cincinnati, where he discovers that he has a savant older brother named Raymond and that his father's $3 million fortune is being left to the mental institution in which Raymond lives. Motivated by his father's money, Charlie checks Raymond out of the facility in order to return with him to Los Angeles. The brothers' cross-country trip ends up changing both their lives.",1988-12-11,7.8,5502,en,19.943
742,Doctor Who: Last Christmas,"The Doctor and Clara face their Last Christmas. Trapped on an Arctic base, under attack from terrifying creatures, who are you going to call? Santa Claus!",2014-12-25,7.7,213,en,6.054
751,The Greatest Beer Run Ever,"Chickie wants to support his friends fighting in Vietnam, so he does something wild—personally bring them American beer. What starts as a well-meaning journey quickly changes Chickie’s life and perspective. Based on a true story.",2022-09-30,7.7,448,en,43.213
773,The Trial of the Chicago 7,What was supposed to be a peaceful protest turned into a violent clash with the police. What followed was one of the most notorious trials in history.,2020-09-25,7.7,2601,en,14.798
774,Divines,"In a ghetto where religion and drug trafficking rub shoulders, Dounia has a lust for power and success. Supported by Maimouna, her best friend, she decides to follow in the footsteps of Rebecca, a respected dealer. But her encounter with Djigui, a young, disturbingly sensual dancer, throws her off course.",2016-08-31,7.7,605,fr,7.403
776,An Egg-celent movie,"A small egg named Toto decides that he wants to fulfill his purpose in life and become a chicken instead of dying in a frying pan; so he starts a quest to return to the farms along with his new friend, the noisy egg Willy and a crazy bacon stripe. The three friends will face lot of obstacles in their quest.",2006-04-21,7.7,265,es,22.601
779,Silver Skates,"1899, the Christmas-time St.Petersburg. Ice-covered rivers and canals of the capital seethe with festive activities. On the eve of the new century those who should not be destined to meet, come together. They are people from different worlds: Matvey, the son of a lamplighter, whose only treasure is his silver-plated skates; Alice is the daughter of a high-ranking official dreaming of science. Each of them has his own difficult life-story, but having accidentally met they rush forward together in pursuit of their dreams.",2020-12-10,7.7,202,ru,12.283
780,My Friends Act II,"The four old friends meet on the grave of the fifth of them, Perozzi, who died at the end of the first episode. Time has passed but they are still up for adventures and cruel jokes, and while they recall the one they created together with the late friend, new ones are on their way, starting right there at the cemetery.",1982-12-22,7.7,302,it,5.676
791,"tick, tick... BOOM!","On the cusp of his 30th birthday, Jonathon Larson, a promising young theater composer, navigates love, friendship, and the pressures of life as an artist in New York City.",2021-11-11,7.7,1690,en,17.771
798,Entergalactic,Ambitious artist Jabari attempts to balance success and love when he moves into his dream Manhattan apartment and falls for his next-door neighbor.,2022-09-28,7.7,206,en,16.378
