4727,In Her Name,"In 1982, André Bamberski learns about the death of his 14 year-old daughter, Kalinka, while she was on vacation with her mother and stepfather in Germany. Convinced that Kalinka’s death was not an accident, Bamberski begins to investigate. A botched autopsy report raises his suspicions and leads him to accuse Kalinka’s stepfather, Dr Dieter Krombach, as the murderer.","","","","",""
4728,Graduation,"Romeo Aldea, a physician living in a small mountain town in Transylvania, has raised his daughter Eliza with the idea that once she turns 18, she will leave to study and live abroad. His plan is close to succeeding. Eliza has won a scholarship to study psychology in the UK. She just has to pass her final exams – a formality for such a good student. On the day before her first written exam, Eliza is assaulted in an attack that could jeopardize her entire future. Now Romeo has to make a decision. There are ways of solving the situation, but none of them using the principles he, as a father, has taught his daughter.",2016-05-20,6.7,243,ro,8.046
4734,Hush,A deaf woman is stalked by a psychotic killer in her secluded home.,2016-03-12,6.7,4154,en,15.137
4741,Paulie,"Paulie, an intelligent parrot who actually talks, relates the story of his struggle to a Russian immigrant who works as a janitor at the research institute where he is housed and neglected. Paulie's story begins many years earlier when he is given as a gift to a little girl who stutters. Eventually, he teaches the girl to speak correctly but is taken away by her father because he believes the girl cannot distinguish fantasy from reality because she believes the bird can talk. Paulie goes through a series of adventures with a pawn shop owner, an aging widow, a Mexican-American troubadour and a would be thief before being taken to the institute where he now lives",1998-04-17,6.7,389,en,11.856
4747,The Curse of Bridge Hollow,A Halloween-hating dad reluctantly teams up with his teenage daughter when an evil spirit wreaks havoc by making their town's decorations come to life.,2022-10-14,6.7,335,en,32.203
4755,Chicken Run,"Having been hopelessly repressed and facing eventual certain death at the British chicken farm where they are held, Ginger the chicken along with the help of Rocky the American rooster decide to rebel and lead their fellow chickens in a great escape from the murderous farmers Mr. and Mrs. Tweedy and their farm of doom.",2000-06-21,6.7,4294,en,43.843
4763,Broadcast News,"Basket-case network news producer Jane Craig falls for new reporter Tom Grunnick, a pretty boy who represents the trend towards entertainment news she despises. Aaron Altman, a talented but plain correspondent, carries an unrequited torch for Jane. Sparks fly between the three as the network prepares for big changes, and both the news and Jane must decide between style and substance.",1987-12-16,6.7,333,en,8.404
4768,Night of the Creeps,"In 1959, an alien experiment crashes to earth and infects a fraternity member. They freeze the body, but in the modern day, two geeks pledging a fraternity accidentally thaw the corpse, which proceeds to infect the campus with parasites that transform their hosts into killer zombies.",1986-08-21,6.7,404,en,10.836
4781,Long Shot,"Journalist Fred Flarsky reunites with his childhood crush, Charlotte Field, now one of the most influential women in the world. As she prepares to make a run for the Presidency, Charlotte hires Fred as her speechwriter — much to the dismay of her trusted advisers.",2019-05-02,6.7,2325,en,17.608
4789,The Year of Living Dangerously,"Australian journalist Guy Hamilton travels to Indonesia to cover civil strife in 1965. There—on the eve of an attempted coup—he befriends a Chinese Australian photographer with a deep connection to and vast knowledge of the Indonesian people, and also falls in love with a British national.",1982-12-17,6.7,258,en,8.318
4794,Pawn Sacrifice,American chess champion Bobby Fischer prepares for a legendary match-up against Russian Boris Spassky.,2015-09-16,6.7,798,en,8.269
4801,Exam,The final candidates for a highly desirable corporate job are locked together in an exam room and given a test so simple and confusing that tension begins to unravel.,2009-06-19,6.7,1765,en,11.943
4815,The Little Mermaid: Ariel's Beginning,"Follow Ariel's adventures before she gave up her fins for true love. When Ariel wasn't singing with her sisters, she spent time with her mother, Queen Athena. Ariel is devastated when Athena is killed by pirates, and after King Triton outlaws all singing. Along with pals Flounder and Sebastian, Ariel sets off in hopes of changing her father's decision to ban music from the kingdom.",2008-08-25,6.7,862,en,2.835
4821,Unthinkable,The government gets wind of a plot to destroy America involving a trio of nuclear weapons for which the whereabouts are unknown. It's up to a seasoned interrogator and an FBI agent to find out exactly where the nukes are.,2010-06-14,6.7,1014,en,11.705
4835,The Banana Splits Movie,"A boy named Harley and his family attend a taping of The Banana Splits TV show, which is supposed to be a fun-filled birthday for young Harley and business as usual for Rebecca, the producer of the series. But things take an unexpected turn - and the body count quickly rises. Can Harley, his mom and their new pals safely escape?",2019-09-04,6.7,210,en,15.308
4838,The Adjustment Bureau,"A man glimpses the future Fate has planned for him – and chooses to fight for his own destiny. Battling the powerful Adjustment Bureau across, under and through the streets of New York, he risks his destined greatness to be with the only woman he's ever loved.",2011-03-03,6.7,4001,en,20.676
4845,Kinky Boots,"Charles Price may have grown up with his father in the family shoe business in Northampton, central England, but he never thought that he would take his father's place. Charles has a chance encounter with the flamboyant drag queen cabaret singer Lola and everything changes.",2005-08-30,6.7,299,en,10.341
4849,Fugitives,"Coming out from jail, Lucas has decided to change his life and behave like a good citizen. But when he is taken hostage in a bank by a hare-brained robber, no cops can believe he is not part of the action.",1986-12-17,6.7,313,fr,6.349
4850,13 Going on 30,"After total humiliation at her thirteenth birthday party, Jenna Rink wants to just hide until she's thirty. With a little magic, her wish is granted, but it turns out that being thirty isn't as always as awesome as she thought it would be!",2004-04-13,6.7,4519,en,23.402
4852,The Da Vinci Code,"A murder in Paris’ Louvre Museum and cryptic clues in some of Leonardo da Vinci’s most famous paintings lead to the discovery of a religious mystery. For 2,000 years a secret society closely guards information that — should it come to light — could rock the very foundations of Christianity.",2006-05-17,6.7,8328,en,33.313
4877,Katyn,"On September 1st, 1939, Nazi Germany invades Poland, unleashing World War II. On September 17th, the Soviet Red Army crosses the border. The Polish army, unable to fight on two fronts, is defeated. Thousands of Polish men, both military and government officials, are captured by the invaders. Their fate will only be known several years later.",2007-09-21,6.7,203,pl,8.075
4879,Narc,"When the trail goes cold on a murder investigation of a policeman, an undercover narcotics officer is lured back to the force to help solve the case.",2002-01-14,6.7,433,en,8.014
4890,Sisters,"Inquisitive journalist Grace Collier is horrified when she witnesses her neighbor, fashion model Danielle Breton, violently murder a man. Panicking, she calls the police. But when the detective arrives at the scene and finds nothing amiss, Grace is forced to take matters into her own hands. Her first move is to recruit private investigator Joseph Larch, who helps her to uncover a secret about Danielle's past that has them both seeing double.",1973-03-26,6.7,297,en,7.561
4893,Up in Smoke,"\"An unemployed pot-smoking slacker and amateur drummer, Anthony Stoner ditches his strict parents and hits the road, eventually meeting kindred spirit Pedro de Pacas. While the drug-ingesting duo is soon arrested for possession of marijuana, Anthony and Pedro get released on a technicality, allowing them to continue their many misadventures and ultimately compete in a rock band contest, where they perform the raucous tune \"\"Earache My Eye.\"\"\"",1978-05-16,6.7,481,en,11.566
4904,Heaven & Earth,"Le Ly lives in a small Vietnamese village whose serenity is shattered when war breaks out. Caught between the Viet Cong and the South Vietnamese army, the village is all but destroyed. After being both brutalized and raped, Le Ly resolves to flee. She leaves for the city, surviving desperate situations, but surviving nonetheless. Eventually she meets a U.S. Marine named Steve Butler who treats her kindly and tells her he would like to be married -- maybe to her.",1993-12-24,6.7,209,en,24.069
4917,Draft Day,"At the NFL Draft, general manager Sonny Weaver has the opportunity to rebuild his team when he trades for the number one pick. He must decide what he's willing to sacrifice on a life-changing day for a few hundred young men with NFL dreams.",2014-04-11,6.7,794,en,9.532
4925,The Cooler,"Bernie works at a Las Vegas casino, where he uses his innate ability to bring about misfortune in those around him to jinx gamblers into losing. His imposing boss, Shelly Kaplow, is happy with the arrangement. But Bernie finds unexpected happiness when he begins dating attractive waitress Natalie Belisario.",2003-11-26,6.7,289,en,7.675
4939,Chopper,"The true and infamous story of Australia's notorious criminal Mark 'Chopper' Read and his years of crime, interest in violence, drugs and prostitutes.",2000-06-21,6.7,289,en,9.041
4946,Mosul,"When ISIS took their homes, families and city, one group of men fought to take it all back. Based on true events, this is the story of the Nineveh SWAT team, a renegade police unit who waged a guerrilla operation against ISIS in a desperate struggle to save their home city of Mosul.",2019-09-04,6.7,228,ar,10.071
4957,The Immortal,"After reuniting with his first mentor Bruno and receiving his latest mission, an exiled Ciro is left to fearlessly confront whatever comes his way, navigating a new chapter of gang warfare while grappling with devastating memories of loss and trauma. Weaving between his past as an orphan in Naples' cruel underworld and present as a hardened, cunning assassin with nothing left to lose, Ciro is plunged into the cold, dark depths of a world where immortality is just another form of damnation.",2019-12-05,6.7,425,it,14.461
4970,Loving,"The story of Richard and Mildred Loving, an interracial couple, whose challenge of their anti-miscegenation arrest for their marriage in Virginia led to a legal battle that would end at the US Supreme Court.",2016-11-04,6.7,842,en,10.139
4997,Another Earth,"On the night of the discovery of a duplicate Earth in the Solar system, an ambitious young student and an accomplished composer cross paths in a tragic accident.",2011-07-22,6.7,1402,en,13.21
5011,Repo Man,"A down and out young punk gets a job working with a seasoned repo man, but what awaits him in his new career is a series of outlandish adventures revolving around aliens, the CIA, and a most wanted '64 Chevy.",1984-02-20,6.7,485,en,9.154
5016,Blast from the Past,"Following a bomb scare in the 1960s that locked the Webers into their bomb shelter for 35 years, Adam now ventures forth into Los Angeles to obtain food and supplies for his family, and a non-mutant wife for himself.",1999-02-12,6.7,891,en,28.086
5020,"Me, Myself and Mum","How to become a man when your mother and your closed circle have decided otherwise? This is the challenge Guillaume took up. The film recounts Guillaume's tragicomic battle from the young age of eight, as he adopts the role of a girl then of a homosexual... until, aged 30, he meets the woman who, after his mother, will become the other woman in his life. Beyond this story of a heterosexual coming-out, the film tells the tale of an actor who never stopped loving women, maybe even a little too much.",2013-11-20,6.7,608,fr,6.579
5024,Jolt,A bouncer with an anger management problem goes on a furious and resentful rampage after the murder of a friend.,2021-07-15,6.7,1047,en,44.962
5040,Glass,"In a series of escalating encounters, former security guard David Dunn uses his supernatural abilities to track Kevin Wendell Crumb, a disturbed man who has twenty-four personalities. Meanwhile, the shadowy presence of Elijah Price emerges as an orchestrator who holds secrets critical to both men.",2019-01-16,6.7,7416,en,45.959
5060,Eye for an Eye,"Mario, an exemplary man, lives in a village on the Galician coast. In the old people’s home, where he works as a nurse, everyone appreciates him. When the best known narco in the area, Antonio Padín, recently released from prison, enters the residence, Mario tries to make Antonio feel at home.  Now, Padín's two sons, Kike and Toño, are in charge of the family business. The failure of an operation will put Kike in jail and cause them to owe a large debt to a Colombian supplier. Toño will turn to the nurse to try to convince his father to assume the debt. But Mario has his own plans.",2019-08-30,6.7,274,es,7.828
5075,Escape Room: Tournament of Champions,"Six people unwittingly find themselves locked in another series of escape rooms, slowly uncovering what they have in common to survive as they discover all the games that they've played before.",2021-07-01,6.7,1466,en,37.313
5117,"Good Luck Charlie, It's Christmas!","Teddy Duncan's middle-class family embarks on a road trip from their home in Denver to visit Mrs. Duncans Parents, the Blankenhoopers, in Palm Springs. When they find themselves stranded between Denver and Utah, they try to hitch a ride to Las Vegas with a seemingly normal older couple in a station wagon from Roswell, New Mexico. It turns out that the couple believes they are the victims of alien abduction. The Duncan's must resort to purchasing a clunker Yugo to get to Utah, have their luggage stolen in Las Vegas, and survive a zany Christmas with Grandpa and Grandma Blankenhooper.",2011-12-08,6.7,376,en,10.738
5118,Newsies,"A week in the life of the exploited, child newspaper sellers in turn-of-the-century New York. When their publisher, Joseph Pulitzer, tries to squeeze a little more profit out of their labours, they organize a strike, only to be confronted with the Pulitzer's hard-ball tactics.",1992-04-10,6.7,226,en,9.557
5129,Dalida,"\"Based on the true story of acclaimed music icon \"\"Dalida\"\" born in Cairo",who gained celebrity in the 50s,singing in French,Spanish,Arabic,Hebrew
5138,Overboard,"A spoiled, wealthy yacht owner is thrown overboard and becomes the target of revenge from his mistreated employee.",2018-04-13,6.7,1236,en,26.095
5141,Dying Young,"After she discovers that her boyfriend has betrayed her, Hilary O'Neil is looking for a new start and a new job. She begins to work as a private nurse for a young man suffering from blood cancer. Slowly, they fall in love, but they always know their love cannot last because he is destined to die.",1991-06-20,6.7,392,en,9.772
5142,Bull Durham,"\"Veteran catcher Crash Davis is brought to the minor league Durham Bulls to help their up and coming pitching prospect, \"\"Nuke\"\" Laloosh. Their relationship gets off to a rocky start and is further complicated when baseball groupie Annie Savoy sets her sights on the two men.\"",1988-06-15,6.7,479,en,9.404
5154,Fantozzi Against the Wind,"The third film in the saga of the unlucky clerk Ugo Fantozzi, played by its creator, Paolo Villaggio.",1980-11-13,6.7,473,it,7.133
5165,Wuthering Heights,"Young orphan Heathcliff is adopted by the wealthy Earnshaw family and moves into their estate, Wuthering Heights. Soon, the new resident falls for his compassionate foster sister, Cathy. The two share a remarkable bond that seems unbreakable until Cathy, feeling the pressure of social convention, suppresses her feelings and marries Edgar Linton, a man of means who befits her stature. Heathcliff vows to win her back.",1992-10-16,6.7,233,en,13.711
5169,The Night House,"Reeling from the unexpected death of her husband, Beth is left alone in the lakeside home he built for her. Soon she begins to uncover her recently deceased husband's disturbing secrets.",2021-07-15,6.7,839,en,16.646
5178,Dragon Ball Z: Dead Zone,"In order to wish for immortality and avenge his father, Garlic Jr. collects the dragon balls, kidnapping Goku's son Gohan in the process. Goku, Kami, Piccolo, and Krillin unite to rescue Gohan and save the world from being sucked into a dead zone.",1989-07-15,6.7,456,ja,31.885
5184,Damage,The life of a respected British politician at the height of his career crumbles when he becomes obsessed with his son's lover.,1992-12-02,6.7,359,en,25.977
5199,Ransom,"When a rich man's son is kidnapped, he cooperates with the police at first but then tries a unique tactic against the criminals.",1996-11-08,6.7,1586,en,16.485
5200,Athena,"Hours after the tragic death of their youngest brother in unexplained circumstances, three siblings have their lives thrown into chaos.",2022-09-09,6.7,498,fr,176.967
5201,Clouds of Sils Maria,A veteran actress comes face-to-face with an uncomfortable reflection of herself when she agrees to take part in a revival of the play that launched her career 20 years earlier.,2014-08-20,6.7,670,en,7.175
5237,Pirates of the Caribbean: Dead Men Tell No Tales,"Thrust into an all-new adventure, a down-on-his-luck Capt. Jack Sparrow feels the winds of ill-fortune blowing even more strongly when deadly ghost sailors led by his old nemesis, the evil Capt. Salazar, escape from the Devil's Triangle. Jack's only hope of survival lies in seeking out the legendary Trident of Poseidon, but to find it, he must forge an uneasy alliance with a brilliant and beautiful astronomer and a headstrong young man in the British navy.",2017-05-23,6.6,10771,en,66.454
5247,The Seventh Company Outdoors,The third part of Seventh Company adventures.,1977-12-07,6.6,225,fr,7.068
5254,22 Bullets,"Charly Matteï has turned his back on his life as an outlaw. For the last three years, he's led a peaceful life devoting himself to his wife and two children. Then, one winter morning, he's left for dead in the parking garage in Marseille's Old Port, with 22 bullets in his body. Against all the odds, he doesn't die...",2010-03-23,6.6,1068,fr,28.44
5265,Maledetto il giorno che t'ho incontrato,"Bernardo is dumped by his girlfriend, his career as a rock music critic is beginning to decline and stars to see a psychologist but in the meantime he meets the problematic and shy Camilla, who disrupts his life.",1992-01-31,6.6,209,it,5.463
5266,Empire Records,The employees of an independent music store learn about each other as they try anything to stop the store being absorbed by a large chain.,1995-09-22,6.6,586,en,14.756
5311,Midway,"This war drama depicts the U.S. and Japanese forces in the naval Battle of Midway, which became a turning point for Americans during World War II.",1976-06-18,6.6,237,en,18.876
5314,Revenge of the Bridesmaids,Two women plot revenge against the woman marrying their friend's ex-boyfriend.,2010-07-18,6.6,258,en,8.109
5316,White Men Can't Jump,"Two street basketball hustlers try to con each other, then team up for a bigger score.",1992-03-26,6.6,1094,en,14.332
5321,The Hunter,"Martin, a mercenary, is sent from Europe by an anonymous biotech company to the Tasmanian wilderness on a hunt for the last Tasmanian tiger.",2011-10-06,6.6,562,en,9.265
5332,Burn After Reading,"When a disc containing memoirs of a former CIA analyst falls into the hands of gym employees, Linda and Chad, they see a chance to make enough money for Linda to have life-changing cosmetic surgery. Predictably, events whirl out of control for the duo, and those in their orbit.",2008-09-05,6.6,4053,en,19.617
5334,Crank,"Chev Chelios, a hit man wanting to go straight, lets his latest target slip away. Then he awakes the next morning to a phone call that informs him he has been poisoned and has only an hour to live unless he keeps adrenaline coursing through his body while he searches for an antidote.",2006-08-31,6.6,3213,en,31.158
5345,Sea of Love,"Seen-it-all New York detective Frank Keller is unsettled - he has done twenty years on the force and could retire, and he hasn't come to terms with his wife leaving him for a colleague. Joining up with an officer from another part of town to investigate a series of murders linked by the lonely hearts columns he finds he is getting seriously and possibly dangerously involved with Helen, one of the main suspects.",1989-09-15,6.6,514,en,9.966
5363,Wizards of Waverly Place: The Movie,A young wizard accidentally conjures a spell that puts her family in jeopardy.,2009-08-28,6.6,1282,en,22.118
5369,Star Trek III: The Search for Spock,Admiral Kirk and his bridge crew risk their careers stealing the decommissioned Enterprise to return to the restricted Genesis planet to recover Spock's body.,1984-06-01,6.6,1141,en,11.207
5393,Keeping Mum,A pastor preoccupied with writing the perfect sermon fails to realize that his wife is having an affair and his children are up to no good.,2005-12-02,6.6,486,en,11.224
5408,Batman: The Killing Joke,"As Batman hunts for the escaped Joker, the Clown Prince of Crime attacks the Gordon family to prove a diabolical point mirroring his own fall into madness.",2016-07-24,6.6,1602,en,18.921
5411,Suicide Kings,"Carlo, a former mobster, is abducted by five privileged young men desperate to raise a $2 million ransom to save the sister of a friend. As Carlo plays mind games, however, his captors splinter -- each wondering whether one of their own had a hand in the crime.",1998-04-17,6.6,233,en,7.217
5413,R.I.P.D. 2: Rise of the Damned,"When Sheriff Roy Pulsipher finds himself in the afterlife, he joins a special police force and returns to Earth to save humanity from the undead.",2022-11-15,6.6,419,en,379.195
5427,Luckiest Girl Alive,A successful woman in New York City finds her life upended when she is forced to confront a dark truth that threatens to unravel her meticulously crafted life.,2022-09-30,6.6,628,en,33.287
5428,The Legacy of the Bones,Inspector Amaia Salazar must return to the Baztan valley in order to solve a series of suicides that seem to follow a similar pattern.,2019-12-05,6.6,357,es,15.43
5429,Freaky,"A mystical, ancient dagger causes a notorious serial killer to magically switch bodies with a 17-year-old girl.",2020-11-12,6.6,1273,en,20.77
5439,Pinocchio,"In this live-action adaptation of the beloved fairytale, old woodcarver Geppetto fashions a wooden puppet, Pinocchio, who magically comes to life. Pinocchio longs for adventure and is easily led astray, encountering magical beasts, fantastical spectacles, while making friends and foes along his journey. However, his dream is to become a real boy, which can only come true if he finally changes his ways.",2019-12-19,6.6,1386,it,21.229
5441,Footloose,"Ren MacCormack is transplanted from Boston to the small southern town of Bomont where loud music and dancing are prohibited. Not one to bow to the status quo, Ren challenges the ban, revitalizing the town and falling in love with the minister’s troubled daughter Ariel in the process.",2011-10-06,6.6,1502,en,26.858
5452,Mine,"After a failed assassination attempt, a soldier finds himself stranded in the desert. Exposed to the elements, he must survive the dangers of the desert and battle the psychological and physical toll of the treacherous conditions.",2016-10-06,6.6,1163,en,19.981
5461,The Forbidden Kingdom,"An American teenager who is obsessed with Hong Kong cinema and kung-fu classics makes an extraordinary discovery in a Chinatown pawnshop: the legendary stick weapon of the Chinese sage and warrior, the Monkey King. With the lost relic in hand, the teenager unexpectedly finds himself travelling back to ancient China to join a crew of warriors from martial arts lore on a dangerous quest to free the imprisoned Monkey King.",2008-04-18,6.6,1458,en,24.371
5473,Sliding Doors,"London publicist Helen, effortlessly slides between parallel storylines that show what happens when she does or does not catch a train back to her apartment. Love. Romantic entanglements. Deception. Trust. Friendship. Comedy. All come into focus as the two stories shift back and forth, overlap and surprisingly converge.",1998-04-23,6.6,1130,en,9.144
5490,The Longest Yard,"Pro quarter-back, Paul Crewe and former college champion and coach, Nate Scarboro are doing time in the same prison. Asked to put together a team of inmates to take on the guards, Crewe enlists the help of Scarboro to coach the inmates to victory in a football game 'fixed' to turn out quite another way.",2005-05-27,6.6,2863,en,39.866
5493,The Kid Detective,"A once-celebrated kid detective, now 31, continues to solve the same trivial mysteries between hangovers and bouts of self-pity. Until a naive client brings him his first 'adult' case, to find out who brutally murdered her boyfriend.",2020-10-16,6.6,283,en,10.934
5512,Happy-Go-Lucky,"A look at a few chapters in the life of Poppy, a cheery, colorful, North London schoolteacher whose optimism tends to exasperate those around her.",2008-04-18,6.6,369,en,9.698
5518,The End of the Affair,"On a rainy London night in 1946, novelist Maurice Bendrix has a chance meeting with Henry Miles, husband of his ex-mistress Sarah, who abruptly ended their affair two years before. Bendrix's obsession with Sarah is rekindled; he succumbs to his own jealousy and arranges to have her followed.",1999-12-03,6.6,208,en,9.131
