7552,Christmas Made to Order,"When architect and Christmas amateur Steven finds himself hosting his family for Christmas, he recruits holiday coordinator Gretchen to bring holiday joy to his home. Gretchen’s expert Christmas spirit brings Steven’s family together, but neither expected it to bring them closer to each other. After a great opportunity presents itself to Gretchen, she and Steven must decide what’s really important in life.",2018-12-23,6.2,201,en,10.903
7566,Code 46,"\"In a dystopian future, insurance fraud investigator William Gold arrives in Shanghai to investigate a forgery ring for \"\"papelles\"\"",futuristic passports that record people's identities and genetics. Gold falls for Maria Gonzalez,the woman in charge of the forgeries. After a passionate affair,Gold returns home,having named a coworker as the culprit. But when one of Gonzalez's customers is found dead,"Gold is sent back to Shanghai to complete the investigation.\""
7571,Hummingbird,"Homeless and on the run from a military court martial, a damaged ex-special forces soldier navigating London's criminal underworld seizes an opportunity to assume another man's identity, transforming into an avenging angel in the process.",2013-05-07,6.2,1482,en,27.936
7579,White Bird in a Blizzard,"In 1988, a teenage girl's life is thrown into chaos when her mother disappears.",2014-08-14,6.2,664,en,10.798
7588,I Am Number Four,"A teenage fugitive with an incredible secret races to stay one step ahead of the mysterious forces seeking destroy him in this sci-fi action thriller. With three dead and one on the run, the race to find the elusive Number Four begins. Outwardly normal teen John Smith never gets too comfortable in the same identity, and along with his guardian, Henri, he is constantly moving from town to town. With each passing day, John gains a stronger grasp on his extraordinary new powers, and his bond to the beings that share his fantastic fate grows stronger.",2011-02-18,6.2,4208,en,46.864
7589,Teen Wolf,When a shy teenager's new-found powers help him score at basketball - and with the popular girls - he has some pretty hairy decisions to make.,1985-08-23,6.2,954,en,36.312
7595,Sucker Punch,"A young girl is institutionalized by her abusive stepfather. Retreating to an alternative reality as a coping strategy, she envisions a plan which will help her escape from the mental facility.",2011-03-24,6.2,4246,en,41.294
7598,Magic Mike XXL,"Three years after Mike bowed out of the stripper life at the top of his game, he and the remaining Kings of Tampa hit the road to Myrtle Beach to put on one last blow-out performance.",2015-07-01,6.2,1602,en,52.892
7608,Extortion,A doctor desperately tries to save his wife and their 5 year old son after their vacation in the Bahamas takes an unexpected turn.,2017-01-02,6.2,233,en,11.526
7621,Ain't Them Bodies Saints,"Bob Muldoon and Ruth Guthrie, an impassioned young outlaw couple on an extended crime spree, are finally apprehended by lawmen after a shootout in the Texas hills. Although Ruth wounds a local officer, Bob takes the blame. But four years later, Bob escapes from prison and sets out to find Ruth and their daughter, born during his incarceration.",2013-07-03,6.2,375,en,10.343
7623,I Kill Giants,"Sophia, a new high school student, tries to make friends with Barbara, who tells her that “she kills giants,” protecting this way her hometown and its inhabitants, who do not understand her strange behavior.",2018-01-21,6.2,1071,en,16.171
7628,Evita,"The hit musical based on the life of Evita Duarte, a B-movie Argentinian actress who eventually became the wife of Argentinian president and dictator Juan Perón, and the most beloved and hated woman in Argentina.",1996-12-14,6.2,406,en,8.746
7632,The House by the Cemetery,"After a doctor kills his mistress and himself while researching the mysterious previous owner of his Boston home, his colleague, Dr. Norman Boyle, takes over his research and moves his family from New York City to the Boston mansion. Soon after, Boyle's young son Bob becomes plagued by visions of a young girl, who warns him of the danger within the house.",1981-08-14,6.2,314,it,13.803
7646,Ultras,An aging soccer fanatic faces down the reality of his past while struggling to give himself and a young follower very different futures.,2020-03-09,6.2,387,it,7.788
7649,Chinese Zodiac,"Asian Hawk leads a mercenary team to recover several lost artifacts from the Old Summer Palace, the bronze heads of the 12 Chinese Zodiac animals which were sacked by the French and British armies from the imperial Summer Palace in Beijing in 1860. Assisted by a Chinese student & a Parisian lady, Hawk stops at nothing to accomplish the mission.",2012-12-20,6.2,701,cn,24.639
7658,Nick of Time,"An unimpressive, every-day man is forced into a situation where he is told to kill a politician to save his kidnapped daughter.",1995-11-22,6.2,600,en,10.226
7667,Heavyweights,"\"Camp Hope is a summer retreat for overweight boys run by a kindly couple who make the campers feel comfortable with their extra pounds. But when tyrannical fitness guru Tony buys the camp, he puts the kids on a cruel regimen that goes too far. Sick of the endless weeks of \"\"all work and no play","\"\" the kids stage a coup and reclaim their summer of fun.\"",1995-02-17,6.2,316,en
7681,John Tucker Must Die,"After discovering they are all dating the same same guy, three popular students from different cliques band together for revenge, so they enlist the help of a new gal in town and conspire to break the jerk's heart, while destroying his reputation.",2006-07-27,6.2,1230,en,16.21
7693,On Chesil Beach,"In 1962 England, a young couple finds their idyllic romance colliding with issues of sexual freedom and societal pressure, leading to an awkward and fateful wedding night.",2018-01-19,6.2,322,en,9.559
7696,Knowing,A teacher opens a time capsule that has been dug up at his son's elementary school; in it are some chilling predictions -- some that have already occurred and others that are about to -- that lead him to believe his family plays a role in the events that are about to unfold.,2009-03-19,6.2,4663,en,57.886
7712,The Company You Keep,A former Weather Underground activist goes on the run from a journalist who discovers his identity.,2012-09-06,6.1,602,en,10.538
7716,Ginger Snaps Back: The Beginning,"Set in 19th Century Canada, Brigette and her sister Ginger take refuge in a Traders' Fort which later becomes under siege by some savage werewolves. And an enigmatic Indian hunter decides to help the girls, but one of the girls has been bitten by a werewolf. Brigitte and Ginger may have no one to turn to but themselves.",2004-07-10,6.1,212,en,11.047
7723,Blood Work,"Still recovering from a heart transplant, a retired FBI profiler returns to service when his own blood analysis offers clues to the identity of a serial killer.",2002-08-09,6.1,666,en,8.956
7726,This Means War,Two top CIA operatives wage an epic battle against one another after they discover they are dating the same woman.,2012-02-14,6.1,3060,en,15.078
7735,Push,"After his father, an assassin, is brutally murdered, Nick Gant vows revenge on Division, the covert government agency that dabbles in psychic warfare and experimental drugs. Hiding in Hong Kong's underworld, Nick assembles a band of rogue psychics dedicated to destroying Division. Together with Cassie, a teenage clairvoyant, Nick goes in search of a missing girl and a stolen suitcase that could be the key to accomplishing their mutual goal.",2009-02-04,6.1,2007,en,16.378
7738,Reign of Fire,"In post-apocalyptic England, an American volunteer and a British survivor team up to fight off a brood of fire-breathing dragons seeking to return to global dominance after centuries of rest underground. The Brit -- leading a clan of survivors to hunt down the King of the Dragons -- has much at stake: His mother was killed by a dragon, but his love is still alive.",2002-07-09,6.1,1934,en,16.48
7740,Silent Night,"Nell, Simon, and their boy Art are ready to welcome friends and family for what promises to be a perfect Christmas gathering. Perfect except for one thing: everyone is going to die.",2021-12-03,6.1,338,en,13.227
7742,Jumpin' Jack Flash,"Terry works for a bank, and uses computers to communicate with clients all over the world. One day, she gets a strange coded message from an unknown source. After decoding the message, Terry becomes embroiled in an espionage ring. People are killed, and Terry is chased. Throughout, she remains in contact with this mysterious person, who needs Terry's help save his life.",1986-04-23,6.1,295,en,10.556
7752,Senseless,A student gets his senses enhanced by an experimental drug. But abuse is not an option.,1998-02-20,6.1,312,en,11.237
7773,Terra Formars,"With the space program attempting to travel to Mars, 21st century scientists were tasked with warming up the planet so that humans could survive on its surface. They came up with an efficient and cost effective plan of sending cockroaches and mold to the surface so that the mold would absorb the sunlight and the insect corpses would serve as a food source for the mold.  It is now the year 2577 and the first manned ship to Mars has landed on the planet and the six crew members are ready for their mission. But what they find are giant mutated humanoid cockroaches with incredible physical strength. The crew members are easily wiped out, but not before sending a transmission back to Earth. Now, humanity will send elite warriors to exterminate the mutated bugs and claim back Mars.",2016-04-29,6.1,215,ja,13.61
7787,xXx: Return of Xander Cage,"Extreme athlete turned government operative Xander Cage comes out of self-imposed exile, thought to be long dead, and is set on a collision course with deadly alpha warrior Xiang and his team in a race to recover a sinister and seemingly unstoppable weapon known as Pandora's Box. Recruiting an all-new group of thrill-seeking cohorts, Xander finds himself enmeshed in a deadly conspiracy that points to collusion at the highest levels of world governments.",2017-01-13,6.1,8307,en,145.788
7821,Green Card,"Urban horticulturalist Brontë Mitchell has her eye on a gorgeous apartment, but the building's board will rent it only to a married couple. Georges Fauré, a waiter from France whose visa is expiring, needs to marry an American woman to stay in the country. Their marriage of convenience turns into a burden when they must live together to allay the suspicions of the immigration service, as the polar opposites grate on each other's nerves.",1990-12-23,6.1,414,en,7.684
7824,Death Wish,A mild-mannered father is transformed into a killing machine after his family is torn apart by a violent act.,2018-03-02,6.1,2284,en,29.499
7828,The One,A sheriff's deputy fights an alternate universe version of himself who grows stronger with each alternate self he kills.,2001-11-02,6.1,1347,en,24.384
7833,Body Snatchers,"When Environmental Protection Agency inspector Steve Malone travels to a remote military base in order to check for toxic materials, he brings his family along for the ride. After arriving at the base, his teenage daughter Marti befriends Jean Platt, daughter of the base's commander, General Platt. When people at the base begin acting strangely, Marti becomes convinced that they are slowly being replaced by plant-like aliens.",1993-06-09,6.1,327,en,15.834
7845,Happy New Year,Six would-be thieves enter a prestigious dance competition as a cover for their larger goal of pulling off a major heist.,2014-10-24,6.1,210,hi,8.158
7850,Jurassic Park III,"In need of funds for research, Dr. Alan Grant accepts a large sum of money to accompany Paul and Amanda Kirby on an aerial tour of the infamous Isla Sorna. It isn't long before all hell breaks loose and the stranded wayfarers must fight for survival as a host of new -- and even more deadly -- dinosaurs try to make snacks of them.",2001-07-18,6.1,6285,en,1.923
7868,Blood Ties,"Two brothers, on either side of the law, face off over organized crime in Brooklyn during the 1970s.",2013-08-22,6.1,403,en,11.698
7878,Happy Feet Two,"Mumble the penguin has a problem: his son Erik, who is reluctant to dance, encounters The Mighty Sven, a penguin who can fly! Things get worse for Mumble when the world is shaken by powerful forces, causing him to brings together the penguin nations and their allies to set things right.",2011-11-18,6.1,1379,en,29.138
7881,The Hummingbird Project,A pair of high-frequency traders go up against their old boss in an effort to make millions in a fiber-optic cable deal.,2019-03-15,6.1,255,en,10.896
7882,Goosebumps 2: Haunted Halloween,"Two boys face an onslaught from witches, monsters, ghouls and a talking dummy after they discover a mysterious book by author R. L. Stine.",2018-10-11,6.1,1289,en,24.806
7886,The Eiger Sanction,"A classical art professor and collector, who doubles as a professional assassin, is coerced out of retirement to avenge the murder of an old friend.",1975-05-21,6.1,309,en,9.909
7893,Fist Fight,"When one school teacher gets the other fired, he is challenged to an after-school fight.",2017-02-16,6.1,1122,en,13.516
7894,Fallen,"Lucinda Price is sent to a reform academy under the assumption that she has killed a boy. There, she meets two mysterious boys, Cam and Daniel, to whom she feels drawn to both. But as the love triangle unfurls, it is Daniel that Luce cannot keep herself away from, and things begin to take a darker turn when she finds out his true identity.",2016-11-10,6.1,1483,en,18.254
7897,V/H/S,"When a group of misfits is hired by an unknown third party to burglarize a desolate house and acquire one rare VHS tape, they discover more found footage than they had bargained for.",2012-07-28,6.1,1298,en,15.048
7901,Under Suspicion,"\"A lawyer is asked to come to the police station to clear up a few loose ends in his witness report of a foul murder. \"\"This will only take ten minutes\"\"",they say,but it turns out to be one loose end after another,"and the ten minutes he is away from his speech become longer and longer.\"",2000-09-24,6.1
7953,Burke & Hare,Two 19th-century opportunists become serial killers so that they can maintain their profitable business supplying cadavers to an anatomist.,2010-10-29,6.1,406,en,8.066
7954,Desierto,"A group of Mexican emigrants attempts to cross the Mexican-US border. What begins as a hopeful journey becomes a harrowing, bloody and primal fight for survival when a deranged, rifle-toting vigilante and his loyal Belgian Malinois dog chase the group of unarmed men and women through the treacherous borderland. In the harsh, unforgiving desert terrain, the odds are stacked firmly against them as they discover there’s nowhere to hide from the unrelenting, merciless killer.",2015-04-12,6.1,314,en,10.559
7963,The Land Before Time VII: The Stone of Cold Fire,"\"Littlefoot and his pals set off in search of a \"\"stone of cold fire\"\" that fell from the night sky. Since he's the only one who has seen it though",nobody really believes him. Petrie's uncle Pterano offers support only because he thinks the stone has secret powers and wants it for himself but conceals this from the rest. The young dinos must figure out the truth,"before Pterano gets the power.\"",2000-12-05,6.1,241
7992,Faces in the Crowd,"\"A horror-thriller centered on a woman living with \"\"face-blindness\"\" after surviving a serial killer's attack. As she lives with her condition",one in which facial features change each time she loses sight of them,"the killer closes in.\"",2011-10-25,6.1,426
7993,300: Rise of an Empire,"Greek general Themistocles attempts to unite all of Greece by leading the charge that will change the course of the war. Themistocles faces the massive invading Persian forces led by mortal-turned-god, Xerxes and Artemesia, the vengeful commander of the Persian navy.",2014-03-05,6.1,5848,en,45.904
7999,The Lone Ranger,"The Texas Rangers chase down a gang of outlaws led by Butch Cavendish, but the gang ambushes the Rangers, seemingly killing them all. One survivor is found, however, by an American Indian named Tonto, who nurses him back to health. The Ranger, donning a mask and riding a white stallion named Silver, teams up with Tonto to bring the unscrupulous gang and others of that ilk to justice.",2013-07-03,6.1,5377,en,32.225
8004,Let It Snow,"In a small town on Christmas Eve, a snowstorm brings together a group of young people. They soon find their friendships and love lives colliding, and come Christmas morning, nothing will be the same.",2019-11-08,6.1,1056,en,11.886
8010,In a Valley of Violence,"The story of a drifter named Paul who arrives in a small town seeking revenge on the thugs who murdered his friend. Sisters Mary Anne and Ellen, who run the town's hotel, help Paul in his quest for vengeance.",2016-10-21,6.1,498,en,24.15
8012,Bug,"In Oklahoma, Agnes, a lonely waitress living in an isolated and dilapidated roadside motel, meets Peter, a quiet and mysterious man with whom she establishes a peculiar relationship.",2006-11-11,6.1,448,en,7.164
8038,What Happens in Vegas,"During a wild vacation in Las Vegas, career woman Joy McNally and playboy Jack Fuller come to the sober realization that they have married each other after a night of drunken abandon. They are then compelled, for legal reasons, to live life as a couple for a limited period of time. At stake is a large amount of money.",2008-05-07,6.1,2687,en,21.773
8052,3 Days to Kill,"A dangerous international spy is determined to give up his high stakes life to finally build a closer relationship with his estranged wife and daughter. But first, he must complete one last mission - even if it means juggling the two toughest assignments yet: hunting down the world's most ruthless terrorist and looking after his teenage daughter for the first time in ten years, while his wife is out of town.",2014-02-14,6.1,1919,en,19.528
8055,Keeping the Faith,"Best friends since they were kids, Rabbi Jacob Schram and Father Brian Finn are dynamic and popular young men living and working on New York's Upper West Side. When Anna Reilly, once their childhood friend and now grown into a beautiful corporate executive, suddenly returns to the city, she reenters Jake and Brian's lives and hearts with a vengeance. Sparks fly and an unusual and complicated love triangle ensues.",2000-04-14,6.1,523,en,8.125
8075,Vegas Vacation,"The Griswold family hits the road again for a typically ill-fated vacation, this time to the glitzy mecca of slots and showgirls—Las Vegas.",1997-02-13,6.1,531,en,15.039
8091,Original Sin,"A young man is plunged into a life of subterfuge, deceit and mistaken identity in pursuit of a femme fatale whose heart is never quite within his grasp",2001-05-08,6.1,697,en,22.024
8109,Snitch,"Construction company owner John Matthews learns that his estranged son, Jason, has been arrested for drug trafficking. Facing an unjust prison sentence for a first time offender courtesy of mandatory minimum sentence laws, Jason has nothing to offer for leniency in good conscience. Desperately, John convinces the DEA and the opportunistic DA Joanne Keeghan to let him go undercover to help make arrests big enough to free his son in return. With the unwitting help of an ex-con employee, John enters the narcotics underworld where every move could be his last in an operation that will demand all his resources, wits and courage to survive.",2013-02-21,6.1,2117,en,15.868
8112,The Takedown,"Ousmane Diakité and François Monge are two cops with very different styles, backgrounds and careers. The unlikely pair are reunited once again for a new investigation that takes them across France. What seemed to be a simple drug deal turns out to be a much bigger criminal case wrapped in danger and unexpected comedy.",2022-05-06,6.1,376,fr,41.811
8120,Cuban Fury,"Beneath Bruce Garrett's under-confident, overweight exterior, the passionate heart of a salsa king lies dormant. Now, one woman is about to reignite his Latin fire.",2014-02-14,6.1,283,en,5.302
8129,How to Talk to Girls at Parties,"In 1970s London, a teenage outsider named Enn falls in love with a rebellious alien girl named Zan, who has come to Earth for a party. Together, they navigate the complexities of intergalactic culture and the trials of first love.",2017-10-06,6.1,325,en,9.857
8138,Werewolves Within,"When a proposed pipeline creates hostilities between residents of a small town, a newly-arrived forest ranger must keep the peace after a snowstorm confines the townspeople to an old lodge. But when a mysterious creature begins terrorizing the group, their worst tendencies and prejudices rise to the surface, and it is up to the ranger to keep the residents alive, both from each other and the monster which plagues them.",2021-06-25,6.1,390,en,30.044
8147,Kristy,"When a college girl who is alone on campus over the Thanksgiving break is targeted by a group of outcasts, she must conquer her deepest fears to outwit them and fight back.",2014-08-07,6.1,334,en,9.135
8152,Scooby-Doo,"Join the Mystery Inc. gang as they take on their biggest challenge yet! When they're invited to Spooky Island, a popular amusement park, they soon discover that the attractions aren't the only things that are spooky. Strange things are happening, and it's up to Scooby, Shaggy, Fred, Daphne, and Velma to uncover the truth behind the mysterious happenings.",2002-06-14,6.1,3877,en,57.777
8171,Cars 2,Star race car Lightning McQueen and his pal Mater head overseas to compete in the World Grand Prix race. But the road to the championship becomes rocky as Mater gets caught up in an intriguing adventure of his own: international espionage.,2011-06-11,6.0,6759,en,97.842
8180,Paranormal Activity: Tokyo Night,"Koichi takes care of his sister, who has recently returned from a trip abroad in the United States as she is not well. While caring for her, he records evidence of ghosts in their home.",2010-11-20,6.0,376,ja,20.928
8183,Dracula: Dead and Loving It,"When a lawyer shows up at the vampire's doorstep, he falls prey to his charms and joins him in his search for fresh blood. Enter Professor Van Helsing, who may be the only one able to vanquish the Count.",1995-12-22,6.0,817,en,18.379
8207,Mississippi Grind,"Gerry is a talented but down-on-his-luck gambler whose fortunes begin to change when he meets Curtis, a younger, highly charismatic poker player.  The two strike up an immediate friendship and Gerry quickly persuades his new friend to accompany him on a road trip to a legendary high stakes poker game in New Orleans. As they make their way down the Mississippi River, Gerry and Curtis manage to find themselves in just about every bar, racetrack, casino, and pool hall they can find, experiencing both incredible highs and dispiriting lows, but ultimately forging a deep and genuine bond that will stay with them long after their adventure is over.",2015-07-04,6.0,410,en,11.311
8211,Cobra,A tough-on-crime street cop must protect the only surviving witness to a strange murderous cult with far reaching plans.,1986-03-21,6.0,1462,en,29.38
8219,Wrong Turn 2: Dead End,Retired military commander Colonel Dale Murphy hosts the simulated post-apocalyptic reality show where participants are challenged to survive a remote West Virginia wasteland. But the show turns into a nightmarish showdown when each realizes they are being hunted by an inbred family of cannibals determined to make them all dinner!,2007-08-25,6.0,1143,en,57.354
8225,The Possession of Michael King,"The film tells the story of documentary filmmaker Michael King (Shane Johnson), who doesn’t believe in God or the Devil. Following the sudden death of his wife, Michael decides to make his next film about the search for the existence of the supernatural, making himself the center of the experiment – allowing demonologists, necromancers, and various practitioners of the occult to try the deepest and darkest spells and rituals they can find on him – in the hopes that when they fail, he’ll once and for all have proof that religion, spiritualism, and the paranormal are nothing more than myth. But something does happen. An evil and horrifying force has taken over Michael King. And it will not let him go.",2014-08-14,6.0,334,en,13.197
8249,Poltergeist II: The Other Side,"The Freeling family move in with Diane's mother in an effort to escape the trauma and aftermath of Carol Anne's abduction by the Beast. But the Beast is not to be put off so easily and appears in a ghostly apparition as the Reverend Kane, a religeous zealot responsible for the deaths of his many followers. His goal is simple - he wants the angelic Carol Anne.",1986-05-23,6.0,545,en,14.113
8260,The Gendarme and the Gendarmettes,"Cruchot's police office moves into a new building. They do not only get high tech equipment, but also four young female police officers to educate. All of them scramble to work with them -- and cause pure chaos while being distracted by the fine ladies. Then they get into real trouble when one after the other of their female colleagues is kidnapped.",1982-10-03,6.0,474,fr,11.297
8261,Broken Arrow,"When rogue stealth-fighter pilot Vic Deakins deliberately drops off the radar while on maneuvers, the Air Force ends up with two stolen nuclear warheads -- and Deakins's co-pilot, Riley Hale, is the military's only hope for getting them back. Traversing the deserted canyons of Utah, Hale teams with park ranger Terry Carmichael to put Deakins back in his box.",1996-02-09,6.0,1280,en,21.507
