2193,War Horse,"On the brink of the First World War, Albert's beloved horse Joey is sold to the Cavalry by his father. Against the backdrop of the Great War, Joey begins an odyssey full of danger, joy, and sorrow, and he transforms everyone he meets along the way. Meanwhile, Albert, unable to forget his equine friend, searches the battlefields of France to find Joey and bring him home.",2011-12-25,7.3,3030,en,18.484
2197,Bob le Flambeur,"In Paris, Bob Montagne is practically synonymous with gambling -- and winning. He is kind, classy and well-liked by virtually everyone in town, including police inspector Ledru. However, when Bob's luck turns sour, he begins to lose friends and makes the most desperate gamble of his life: to rob the Deauville casino during Grand Prix weekend, when the vaults are full. Unfortunately, Bob soon learns that the game is rigged and the cops are on to him.",1956-08-24,7.3,202,fr,6.967
2205,Pay It Forward,"Like some other kids, 12-year-old Trevor McKinney believed in the goodness of human nature. Like many other kids, he was determined to change the world for the better. Unlike most other kids, he succeeded.",2000-10-20,7.3,1558,en,13.43
2208,Freeheld,New Jersey car mechanic Stacie Andree and her police detective girlfriend Laurel Hester both battle to secure Hester's pension benefits after she was diagnosed with a terminal illness.,2015-10-02,7.3,580,en,9.189
2219,Lenny,"The story of acerbic 1960s comic Lenny Bruce, whose groundbreaking, no-holds-barred style and social commentary was often deemed by the establishment as too obscene for the public.",1974-11-10,7.3,209,en,8.052
2229,Citizen X,"Based on the true story of a Russian serial killer who, over many years, claimed victim to over 50 people. His victims were mostly under the age of 17. In what was then a communists state, the police investigations were hampered by bureaucracy, incompetence and those in power. The story is told from the viewpoint of the detective in charge of the case.",1995-02-25,7.3,245,en,9.723
2234,The Hidden Face,A Spanish orchestra conductor deals with the mysterious disappearance of his girlfriend.,2011-09-16,7.3,881,es,22.579
2241,The Professional,"French secret service agent Josselin Beaumont is dispatched to take down African warlord N'Jala. But when his assignment is canceled, he's shocked to learn that his government is surrendering him to local authorities. He is given a mock trial and sentenced to 20 years of hard labor. But Beaumont escapes from prison and vows not only to avenge himself against his betrayers but also to finish his original assignment.",1981-10-21,7.3,426,fr,10.75
2246,The Conjuring 2,Lorraine and Ed Warren travel to north London to help a single mother raising four children alone in a house plagued by malicious spirits.,2016-06-08,7.3,7390,en,80.529
2254,RoboCop,"In a violent, near-apocalyptic Detroit, evil corporation Omni Consumer Products wins a contract from the city government to privatize the police force. To test their crime-eradicating cyborgs, the company leads street cop Alex Murphy into an armed confrontation with crime lord Boddicker so they can use his body to support their untested RoboCop prototype. But when RoboCop learns of the company's nefarious plans, he turns on his masters.",1987-07-17,7.3,4304,en,25.14
2268,Of Mice and Men,"Two drifters, one a gentle but slow giant, try to make money working the fields during the Depression so they can fulfill their dreams.",1992-09-16,7.3,525,en,14.856
2279,Old Henry,"A widowed farmer and his son warily take in a mysterious, injured man with a satchel of cash. When a posse of men claiming to be the law come for the money, the farmer must decide who to trust. Defending a siege of his homestead, the farmer reveals a talent for gun-slinging that surprises everyone calling his true identity into question.",2021-10-01,7.3,321,en,12.845
2292,Blancanieves,"A black and white silent movie, based on the Snow White fairy tale, that is set in a romantic version of 1920s Seville and centered on a female bullfighter.",2012-09-28,7.3,207,es,8.448
2311,The Salesman,"Forced out of their apartment due to dangerous works on a neighboring building, Emad and Rana move into a new flat in the center of Tehran. An incident linked to the previous tenant will dramatically change the young couple’s life.",2016-06-24,7.3,750,fa,11.609
2322,The Gods Must Be Crazy,A Coca-Cola bottle dropped from an airplane raises havoc among a normally peaceful tribe of African bushmen who believe it to be a utensil of the gods.,1980-09-10,7.3,967,en,31.119
2329,The Public Enemy,"Two young Chicago hoodlums, Tom Powers and Matt Doyle, rise up from their poverty-stricken slum life to become petty thieves, bootleggers and cold-blooded killers. But with street notoriety and newfound wealth, the duo feels the heat from the cops and rival gangsters both. Despite his ruthless criminal reputation, Tom tries to remain connected to his family, however, gang warfare and the need for revenge eventually pull him away.",1931-04-23,7.3,272,en,11.128
2337,Only Lovers Left Alive,"A depressed musician reunites with his lover in the desolate streets of Detroit. Though their romance has endured several centuries, it is tested by the arrival of her capricious and unpredictable younger sister.",2013-12-12,7.3,1921,en,14.774
2339,Fear Street: 1978,"In 1978, two rival groups at Camp Nightwing must band together to solve a terrifying mystery when horrors from their towns' history come alive.",2021-07-08,7.3,1526,en,42.282
2361,Shéhérazade,"Zachary, 17 years old, gets out of jail. Rejected by his mother, he hangs out in the mean streets of Marseille. He falls in love with Shéhérazade, a young prostitute of whom he becomes the pimp without realizing it...",2018-09-05,7.3,219,fr,6.968
2400,Monster,"An emotionally scarred highway drifter shoots a sadistic trick who rapes her, and ultimately becomes the United States' first female serial killer.",2003-12-24,7.2,1994,en,21.189
2409,Naruto the Movie: Ninja Clash in the Land of Snow,"Naruto is thrilled when he is sent on a mission to protect his favorite actress, Yukie Fujikaze, on the set of her new movie, The Adventures of Princess Gale. But when the crew ventures out to film in the icy, foreboding Land of Snow, Yukie mysteriously flees! Naruto and his squad set off to find her... unaware that three Snow Ninja lie in wait, with a sinister purpose that will force Yukie to face her hidden past!",2004-08-21,7.2,422,ja,27.94
2422,Jane Eyre,"After a bleak childhood, Jane Eyre goes out into the world to become a governess. As she lives happily in her new position at Thornfield Hall, she meet the dark, cold, and abrupt master of the house, Mr. Rochester. Jane and her employer grow close in friendship and she soon finds herself falling in love with him. Happiness seems to have found Jane at last, but could Mr. Rochester's terrible secret be about to destroy it forever?",2011-03-11,7.2,1309,en,15.13
2448,The Wing or the Thigh?,"Charles Duchemin, a well-known gourmet and publisher of a famous restaurant guide, is waging a war against fast food entrepreneur Tri- catel to save the French art of cooking. After having agreed to appear on a talk show to show his skills in naming food and wine by taste, he is confronted with two disasters: his son wants to become a clown rather than a restaurant tester and he, the famous Charles Duchemin, has lost his taste!",1976-10-27,7.2,732,fr,11.557
2454,Spider-Man 2,"Peter Parker is going through a major identity crisis. Burned out from being Spider-Man, he decides to shelve his superhero alter ego, which leaves the city suffering in the wake of carnage left by the evil Doc Ock. In the meantime, Parker still can't act on his feelings for Mary Jane Watson, a girl he's loved since childhood. A certain anger begins to brew in his best friend Harry Osborn as well...",2004-06-25,7.2,13476,en,26.109
2457,Clue,"Clue finds six colorful dinner guests gathered at the mansion of their host, Mr. Boddy -- who turns up dead after his secret is exposed: He was blackmailing all of them. With the killer among them, the guests and Boddy's chatty butler must suss out the culprit before the body count rises.",1985-12-13,7.2,1423,en,26.064
2462,The Goldfinch,"A boy in New York is taken in by a wealthy family after his mother is killed in a bombing at the Metropolitan Museum of Art. In a rush of panic, he steals 'The Goldfinch', a painting that eventually draws him into a world of crime.",2019-09-12,7.2,748,en,18.031
2474,The Greatest Game Ever Played,"A biopic of 20-year-old Francis Ouimet who defeated his golfing idol and 1900 US Open Champion, Harry Vardon.",2005-09-30,7.2,386,en,15.424
2479,Wuthering Heights,"The Earnshaws are Yorkshire farmers during the early 19th Century. One day, Mr. Earnshaw returns from a trip to the city, bringing with him a ragged little boy called Heathcliff. Earnshaw's son, Hindley, resents the child, but Heathcliff becomes companion and soulmate to Hindley's sister, Catherine. After her parents die, Cathy and Heathcliff grow up wild and free on the moors and despite the continued enmity between Hindley and Heathcliff they're happy -- until Cathy meets Edgar Linton, the son of a wealthy neighbor.",1939-04-07,7.2,220,en,15.869
2494,Peter Pan,"Leaving the safety of their nursery behind, Wendy, Michael and John follow Peter Pan to a magical world where childhood lasts forever. But while in Neverland, the kids must face Captain Hook and foil his attempts to get rid of Peter for good.",1953-02-05,7.2,4769,en,54.204
2509,Peter Rabbit 2: The Runaway,"Peter Rabbit runs away from his human family when he learns they are going to portray him in a bad light in their book. Soon, he crosses paths with an older rabbit who ropes him into a heist.",2021-03-25,7.2,652,en,45.271
2512,The Prince of Egypt,"This is the extraordinary tale of two brothers named Moses and Ramses, one born of royal blood, and one an orphan with a secret past. Growing up the best of friends, they share a strong bond of free-spirited youth and good-natured rivalry. But the truth will ultimately set them at odds, as one becomes the ruler of the most powerful empire on earth, and the other the chosen leader of his people! Their final confrontation will forever change their lives and the world.",1998-12-16,7.2,3439,en,33.549
2535,The Player,A Hollywood studio executive is being sent death threats by a writer whose script he rejected - but which one?,1992-04-03,7.2,645,en,8.25
2551,The Bird with the Crystal Plumage,"An American writer living in Rome witnesses an attempted murder that is connected to an ongoing killing spree in the city, and conducts his own investigation despite himself and his girlfriend being targeted by the killer.",1970-02-27,7.2,622,it,10.773
2555,My Life as a Dog,"A boy, obsessed with comparing himself with those less fortunate, experiences a different life at the home of his aunt and uncle in 1959 Sweden.",1985-12-12,7.2,209,sv,10.858
2573,Upside-Down Magic,"Nory and her best friend Reina enter the Sage Academy for Magical Studies, where Nory’s unconventional powers land her in a class for those with wonky, or “upside-down,” magic. Undaunted, Nory sets out to prove that that upside-down magic can be just as powerful as right-side-up.",2020-07-31,7.2,213,en,36.028
2581,Virgin Mountain,"Like a young bird yet to find the courage to lift its wings, Fúsi (43) lives alone with his mother, where they've always lived.",2015-03-20,7.2,204,is,5.844
2586,The Embalmer,"Peppino is an aging taxidermist constantly ridiculed for being short and somewhat creepy. He meets Valerio, a handsome young man fascinated by Peppino's work. Peppino, in turn, becomes entranced by Valerio and offers him a large salary to come work as his assistant. But when Valerio meets Deborah, their fledgling romance is threatened by an insanely jealous third wheel.",2002-09-06,7.2,215,it,5.088
2607,Downton Abbey: A New Era,The Crawley family goes on a grand journey to the south of France to uncover the mystery of the dowager countess's newly inherited villa.,2022-04-27,7.2,312,en,21.485
2609,The Intern,"70-year-old widower Ben Whittaker has discovered that retirement isn't all it's cracked up to be. Seizing an opportunity to get back in the game, he becomes a senior intern at an online fashion site, founded and run by Jules Ostin.",2015-09-23,7.2,5927,en,29.48
2611,Songs from the Second Floor,"A film poem inspired by the Peruvian poet César Vallejo. A story about our need for love, our confusion, greatness and smallness and, most of all, our vulnerability. It is a story with many characters, among them a father and his mistress, his youngest son and his girlfriend. It is a film about big lies, abandonment and the eternal longing for companionship and confirmation.",2000-10-06,7.2,232,sv,8.493
2612,Black Sabbath,"\"Three short tales of supernatural horror. In “The Telephone,” a woman is plagued by threatening phone calls. In \"\"The Wurdalak",” a family is preyed upon by vampiric monsters. In “The Drop of Water,"” a deceased medium wreaks havoc on the living.\"",1963-08-17,7.2,334
2613,Set It Off,"Four black women, all of whom have suffered for lack of money and at the hands of the majority, undertake to rob banks. While initially successful, a policeman who was involved in shooting one of the women's brothers is on their trail. As the women add to the loot, their tastes and interests begin to change and their suspicions of each other increase on the way to a climactic robbery.",1996-11-06,7.2,289,en,12.909
2644,Star Trek IV: The Voyage Home,"It's the 23rd century, and a mysterious alien power is threatening Earth by evaporating the oceans and destroying the atmosphere. In a frantic attempt to save mankind, Kirk and his crew must time travel back to 1986 San Francisco where they find a world of punk, pizza and exact-change buses that are as alien as anything they've ever encountered in the far reaches of the galaxy. A thrilling, action-packed Star Trek adventure!",1986-11-26,7.2,1241,en,22.913
2665,Weekend,"A supposedly idyllic weekend trip to the countryside turns into a never-ending nightmare of traffic jams, revolution, cannibalism and murder as French bourgeois society starts to collapse under the weight of its own consumer preoccupations.",1967-12-29,7.2,225,fr,9.259
2685,Carnage,"After 11-year-old Zachary Cowan strikes his classmate across the face with a stick after an argument, the victim's parents invite Zachary's parents to their Brooklyn apartment to deal with the incident in a civilized manner.",2011-09-16,7.2,2613,en,12.831
2709,Rang De Basanti,"After a group of friends graduate from Delhi University, they listlessly haunt their old campus, until a British filmmaker casts them in a film she's making about freedom fighters under British rule. Although the group is largely apolitical, the tragic death of a friend owing to local government corruption awakens their patriotism. Inspired by the freedom fighters they represent in the film, the friends collectively decide to avenge the killing.",2006-01-26,7.2,364,hi,7.904
2723,Romanzo Criminale,"After serving prison time for a juvenile offense, Freddo gathers his old buddies Libano and Dandi and embarks on a crime spree that makes the trio the most powerful gangsters in Rome. Libano loves their new status, and seeks to spread their influence throughout the underworld, while the other two pursue more fleshly desires. For decades, their gang perpetrates extravagant crimes, until paranoia threatens to split the friends apart.",2005-09-30,7.2,588,it,8.483
2742,Pooh's Grand Adventure: The Search for Christopher Robin,"Pooh gets confused when Christopher Robin leaves him a note to say that he has gone back to school after the holidays. So Pooh, Piglet, Tigger, Eeyore and Rabbit go in search of Christopher Robin which leads to a big adventure.",1997-08-05,7.2,307,en,15.579
2746,Heartbeats,"Francis is a young gay man, Marie is a young straight woman and the two of them are best friends -- until the day the gorgeous Nicolas walks into a Montreal coffee shop. The two friends, instantly and equally infatuated, compete for Nicolas' indeterminate affections, a conflict that climaxes when the trio visit the vacation home of Nicolas' mother. The frothy comedy unfolds through narrative, fantasy sequences and confessional monologues.",2010-10-09,7.2,944,fr,10.49
2747,Adam's Rib,"When a woman attempts to kill her uncaring husband, prosecutor Adam Bonner gets the case. Unfortunately for him his wife Amanda (who happens to be a lawyer too) decides to defend the woman in court. Amanda uses everything she can to win the case and Adam gets mad about it. As a result, their perfect marriage is disturbed by everyday quarrels.",1949-11-18,7.2,241,en,10.519
2755,Bound,"Corky, a tough female ex-convict working on an apartment renovation in a Chicago building, meets a couple living next door, Caesar, a paranoid mobster, and Violet, his seductive girlfriend, who is immediately attracted to her.",1996-09-13,7.2,756,en,29.743
2768,Kiss Me Deadly,"\"One evening, Hammer gives a ride to Christina, an attractive hitchhiker on a lonely country road, who has escaped from the nearby lunatic asylum. Thugs waylay them and force his car to crash. When Hammer returns to semi-consciousness, he hears Christina being tortured until she dies. Hammer, both for vengeance and in hopes that \"\"something big\"\" is behind it all","decides to pursue the case.\"",1955-04-28,7.2,307,en
2772,The American Friend,"Tom Ripley, an American who deals in forged art, is slighted at an auction in Hamburg by picture framer Jonathan Zimmerman. When Ripley is asked by gangster Raoul Minot to kill a rival, he suggests Zimmerman, and the two, exploiting Zimmerman's terminal illness, coerce him into being a hitman.",1977-06-24,7.2,284,de,8.033
2787,The Man Without Gravity,A gravity-defying boy raised in seclusion matures into an extraordinary man -- and an international celebrity -- who longs for human connection.,2019-10-21,7.2,238,it,8.144
2797,Radio,"High school football coach, Harold Jones befriends Radio, a mentally-challenged man who becomes a student at T.L. Hanna High School in Anderson, South Carolina. Their friendship extends over several decades, where Radio transforms from a shy, tormented man into an inspiration to his community.",2003-10-24,7.2,593,en,13.202
2810,Downton Abbey,"The beloved Crawleys and their intrepid staff prepare for the most important moment of their lives. A royal visit from the King and Queen of England will unleash scandal, romance and intrigue that will leave the future of Downton hanging in the balance.",2019-09-12,7.2,972,en,17.514
2821,Searching for Bobby Fischer,A prepubescent chess prodigy refuses to harden himself in order to become a champion like the famous but unlikable Bobby Fischer.,1993-08-13,7.2,473,en,10.704
2823,Final Cut,Things go badly for a small film crew shooting a low-budget zombie movie when they are attacked by real zombies.,2022-05-18,7.2,255,fr,22.314
2832,The Chase,The escape of Bubber Reeves from prison affects the inhabitants of a small Southern town.,1966-02-18,7.1,235,en,13.921
2833,Stepmom,"Jackie is a divorced mother of two. Isabel is the career minded girlfriend of Jackie’s ex-husband Luke, forced into the role of unwelcome stepmother to their children. But when Jackie discovers she is ill, both women realise they must put aside their differences to find a common ground and celebrate life to the fullest, while they have the chance.",1998-12-25,7.1,1249,en,18.434
2834,Sophie Scholl: The Final Days,"In 1943, as Hitler continues to wage war across Europe, a group of college students mount an underground resistance movement in Munich. Dedicated expressly to the downfall of the monolithic Third Reich war machine, they call themselves the White Rose. One of its few female members, Sophie Scholl is captured during a dangerous mission to distribute pamphlets on campus with her brother Hans. Unwavering in her convictions and loyalty to the White Rose, her cross-examination by the Gestapo quickly escalates into a searing test of wills as Scholl delivers a passionate call to freedom and personal responsibility.",2005-02-13,7.1,366,de,9.131
2836,Son of Saul,"In the horror of 1944 Auschwitz, a prisoner forced to burn the corpses of his own people finds moral survival trying to save from the flames the body of a boy he takes for his son.",2015-06-11,7.1,929,hu,10.996
2838,Big,When a young boy makes a wish at a carnival machine to be big—he wakes up the following morning to find that it has been granted and his body has grown older overnight. But he is still the same 13-year-old boy inside. Now he must learn how to cope with the unfamiliar world of grown-ups including getting a job and having his first romantic encounter with a woman.,1988-06-03,7.1,3098,en,19.337
2855,The Parent Trap,"Hallie Parker and Annie James are identical twins separated at a young age because of their parents' divorce. Unknowingly to their parents, the girls are sent to the same summer camp where they meet, discover the truth about themselves, and then plot with each other to switch places.",1998-07-28,7.1,3584,en,69.061
2856,Scoob!,"In Scooby-Doo’s greatest adventure yet, see the never-before told story of how lifelong friends Scooby and Shaggy first met and how they joined forces with young detectives Fred, Velma, and Daphne to form the famous Mystery Inc. Now, with hundreds of cases solved, Scooby and the gang face their biggest, toughest mystery ever: an evil plot to unleash the ghost dog Cerberus upon the world. As they race to stop this global “dogpocalypse,” the gang discovers that Scooby has a secret legacy and an epic destiny greater than anyone ever imagined.",2020-07-08,7.1,1492,en,32.681
2862,Justice League: Gods and Monsters,"In an alternate universe, very different versions of DC's Trinity fight against the government after they are framed for an embassy bombing.",2015-06-18,7.1,492,en,23.437
2894,Troy,"In year 1250 B.C. during the late Bronze age, two emerging nations begin to clash. Paris, the Trojan prince, convinces Helen, Queen of Sparta, to leave her husband Menelaus, and sail with him back to Troy. After Menelaus finds out that his wife was taken by the Trojans, he asks his brother Agamemnom to help him get her back. Agamemnon sees this as an opportunity for power. So they set off with 1,000 ships holding 50,000 Greeks to Troy. With the help of Achilles, the Greeks are able to fight the never before defeated Trojans.",2004-05-03,7.1,9004,en,51.39
2905,After We Fell,"Just as Tessa's life begins to become unglued, nothing is what she thought it would be. Not her friends nor her family. The only person that she should be able to rely on is Hardin, who is furious when he discovers the massive secret that she's been keeping. Before Tessa makes the biggest decision of her life, everything changes because of revelations about her family.",2021-09-01,7.1,2116,en,126.887
2925,The Thief of Bagdad,"When Prince Ahmad is blinded and cast out of Bagdad by the nefarious Jaffar, he joins forces with the scrappy thief Abu to win back his royal place, as well as the heart of a beautiful princess.",1940-12-25,7.1,219,en,9.113
2934,Pi,"A mathematical genius discovers a link between numbers and reality, and thus believes he can predict the future.",1998-07-10,7.1,1902,en,17.078
2943,New Police Story,"Sent into a drunken tailspin when his entire unit is killed by a gang of thrill-seeking punks, disgraced Hong Kong police inspector Wing needs help from his new rookie partner, with a troubled past of his own, to climb out of the bottle and track down the gang and its ruthless leader.",2004-09-23,7.1,604,cn,24.237
2974,Dirty Rotten Scoundrels,"Two con men try to settle their rivalry by betting on who can be the first to swindle a young American heiress out of $50,000.",1988-12-14,7.1,700,en,12.759
2983,Kick-Ass,"Dave Lizewski is an unnoticed high school student and comic book fan who one day decides to become a super-hero, even though he has no powers, training or meaningful reason to do so.",2010-03-22,7.1,10625,en,47.139
2998,The Last Castle,A court-martialed general rallies together 1200 inmates to rise against the system that put him away.,2001-10-19,7.1,1054,en,16.222
3053,The Wild Child,"In 1798, a feral boy is discovered outside the town of Aveyron, France. Diagnosed as mentally impaired, he is relegated to an asylum. A young doctor named Jean Itard becomes convinced that the boy has normal mental capacity, but that his development was hindered by lack of contact with society. He brings the boy home and begins an arduous attempt at education over several years.",1970-02-26,7.1,254,fr,8.834
3064,Boy A,"Freed after a lengthy term in a juvenile detention center, convicted child killer Jack Burridge (Andrew Garfield) finds work as a deliveryman and begins dating co-worker Michelle (Katie Lyons). While out on the road one day, the young Englishman notices a distressed child, and, after reuniting the girl with her family, becomes a local celebrity. But, when a local newspaper unearths his past, Jack must cope with the anger of citizens who fear for the safety of their children.",2007-10-28,7.1,386,en,6.416
3077,Quo Vadis,"After fierce Roman commander Marcus Vinicius becomes infatuated with beautiful Christian hostage Lygia, he begins to question the tyrannical leadership of the despotic emperor Nero.",1951-11-08,7.1,328,en,16.339
3081,Paterson,"A week in the life of Paterson, a poet bus driver, and his wife Laura, a very creative artist, who live in Paterson, New Jersey, hometown of many famous poets and artists.",2016-11-17,7.1,1644,en,11.421
