1,The Shawshank Redemption,"Framed in the 1940s for the double murder of his wife and her lover, upstanding banker Andy Dufresne begins a new life at the Shawshank prison, where he puts his accounting skills to work for an amoral warden. During his long stretch in prison, Dufresne comes to be admired by the other inmates -- including an older prisoner named Red -- for his integrity and unquenchable sense of hope.",1994-09-23,8.7,23369,en,119.717
15,Forrest Gump,"A man with a low IQ has accomplished great things in his life and been present during significant historic events—in each case, far exceeding what anyone imagined he could do. But despite all he has achieved, his one true love eludes him.",1994-06-23,8.5,24232,en,72.304
25,Gabriel's Inferno: Part II,"Professor Gabriel Emerson finally learns the truth about Julia Mitchell's identity, but his realization comes a moment too late. Julia is done waiting for the well-respected Dante specialist to remember her and wants nothing more to do with him. Can Gabriel win back her heart before she finds love in another's arms?",2020-07-31,8.4,1463,en,17.745
36,"Josee, the Tiger and the Fish","With dreams of diving abroad, Tsuneo gets a job assisting Josee, an artist whose imagination takes her far beyond her wheelchair. But when the tide turns against them, they push each other to places they never thought possible, and inspire a love fit for a storybook.",2020-12-25,8.4,318,ja,40.441
38,Harakiri,"Down-on-his-luck veteran Tsugumo Hanshirō enters the courtyard of the prosperous House of Iyi. Unemployed, and with no family, he hopes to find a place to commit seppuku—and a worthy second to deliver the coup de grâce in his suicide ritual. The senior counselor for the Iyi clan questions the ronin’s resolve and integrity, suspecting Hanshirō of seeking charity rather than an honorable end. What follows is a pair of interlocking stories which lay bare the difference between honor and respect, and promises to examine the legendary foundations of the Samurai code.",1962-09-15,8.4,747,ja,23.346
41,Hotarubi no Mori e,"One hot summer day a little girl gets lost in an enchanted forest of the mountain god where spirits reside. A young boy appears before her, but she cannot touch him for fear of making him disappear. And so a wondrous adventure awaits...",2011-09-17,8.4,924,ja,0.6
45,The Pianist,"The true story of pianist Władysław Szpilman's experiences in Warsaw during the Nazi occupation. When the Jews of the city find themselves forced into a ghetto, Szpilman finds work playing in a café; and when his family is deported in 1942, he stays behind, works for a while as a laborer, and eventually goes into hiding in the ruins of the war-torn city.",2002-09-17,8.4,7886,en,36.707
46,Whiplash,"Under the direction of a ruthless instructor, a talented young drummer begins to pursue perfection at any cost, even his humanity.",2014-10-10,8.4,13163,en,69.378
52,Burn the Stage: The Movie,"A documentary following the worldwide famous music group BTS, as they tour the world and share their experience along with their beloved band friends and fans.",2018-11-15,8.4,393,ko,12.872
71,Back to the Future,"Eighties teenager Marty McFly is accidentally sent back in time to 1955, inadvertently disrupting his parents' first meeting and attracting his mother's romantic interest. Marty must repair the damage to history by rekindling his parents' romance and - with the help of his eccentric inventor friend Doc Brown - return to 1985.",1985-07-03,8.3,17613,en,62.82
76,BTS World Tour: Love Yourself in Seoul,Shot at the Olympic Stadium in Seoul during the BTS World Tour ‘Love Yourself’ to celebrate the seven members of the global boyband and their unprecedented international phenomenon.,2019-01-26,8.3,392,ko,13.556
101,The Lion King,"A young lion prince is cast out of his pride by his cruel uncle, who claims he killed his father. While the uncle rules with an iron paw, the prince grows up beyond the Savannah, living by a philosophy: No worries for the rest of your days. But when his past comes to haunt him, the young prince must decide his fate: Will he remain an outcast or face his demons and become what he needs to be?",1994-06-23,8.3,16281,en,112.61
114,"Miraculous World: New York, United HeroeZ",Teen Parisian superheroes Ladybug and Chat Noir visit New York on a field trip and discover that superheroes exist in the United States too.,2020-12-18,8.2,962,fr,98.177
115,Wolf Children,"After her werewolf lover unexpectedly dies in an accident, a woman must find a way to raise the son and daughter that she had with him. However, their inheritance of their father's traits prove to be a challenge for her.",2012-07-21,8.2,1978,ja,26.588
127,My Hero Academia: Heroes Rising,"Class 1-A visits Nabu Island where they finally get to do some real hero work. The place is so peaceful that it's more like a vacation … until they're attacked by a villain with an unfathomable Quirk! His power is eerily familiar, and it looks like Shigaraki had a hand in the plan. But with All Might retired and citizens' lives on the line, there's no time for questions. Deku and his friends are the next generation of heroes, and they're the island's only hope.",2019-12-20,8.2,1024,ja,85.244
129,Inglourious Basterds,"\"In Nazi-occupied France during World War II, a group of Jewish-American soldiers known as \"\"The Basterds\"\" are chosen specifically to spread fear throughout the Third Reich by scalping and brutally killing Nazis. The Basterds","lead by Lt. Aldo Raine soon cross paths with a French-Jewish teenage girl who runs a movie theater in Paris which is targeted by the soldiers.\"",2009-08-19,8.2,19866,en
166,Togo,"The untold true story set in the winter of 1925 that takes you across the treacherous terrain of the Alaskan tundra for an exhilarating and uplifting adventure that will test the strength, courage and determination of one man, Leonhard Seppala, and his lead sled dog, Togo.",2019-12-20,8.2,1707,en,32.622
169,Soul,"Joe Gardner is a middle school teacher with a love for jazz music. After a successful audition at the Half Note Club, he suddenly gets into an accident that separates his soul from his body and is transported to the You Seminar, a center in which souls develop and gain passions before being transported to a newborn child. Joe must enlist help from the other souls-in-training, like 22, a soul who has spent eons in the You Seminar, in order to get back to Earth.",2020-12-25,8.2,8880,en,76.456
171,Sansho the Bailiff,"In medieval Japan, a woman and his children journey to find the family's patriarch, who was exiled years before.",1954-03-31,8.2,301,ja,9.816
173,My Friends,"\"Four middle-aged friends in Florence organize together idle pranks (called zingarate, \"\"gypsy shenanigans\"\") in a continuous attempt to prolong childhood during their adult life.\"",1975-10-24,8.2,615,it,6.822
184,Wild Strawberries,"Crotchety retired doctor Isak Borg travels from Stockholm to Lund, Sweden, with his pregnant and unhappy daughter-in-law, Marianne, in order to receive an honorary degree from his alma mater. Along the way, they encounter a series of hitchhikers, each of whom causes the elderly doctor to muse upon the pleasures and failures of his own life. These include the vivacious young Sara, a dead ringer for the doctor's own first love.",1957-12-26,8.1,1386,sv,14.335
192,The Great War,"Italy, 1916. Oreste Jacovacci and Giovanni Busacca are called, as all the Italian youths, to serve the army in the WWI. They both try in every way to avoid serving the army.",1959-10-28,8.1,306,it,7.593
204,Innocent Voices,"A young boy, in an effort to have a normal childhood in 1980s El Salvador, is caught up in a dramatic fight for his life as he desperately tries to avoid the war which is raging all around him",2005-01-28,8.1,382,es,20.017
205,I corti,"\"I corti (\"\"shorts\"\") by Aldo",Giovanni & Giacomo was the first stage show of the comedy trio,with the participation of Marina Massironi. It was recorded live at the Teatro Nuovo in Ferrara on 28 and 29 March 1996. Produced by Agidi,"with the theatre direction of Arturo Brachetti.\"",1996-01-01,8.1
206,Red Beard,"Aspiring to an easy job as personal physician to a wealthy family, Noboru Yasumoto is disappointed when his first post after medical school takes him to a small country clinic under the gruff doctor Red Beard. Yasumoto rebels in numerous ways, but Red Beard proves a wise and patient teacher. He gradually introduces his student to the unglamorous side of the profession, ultimately assigning him to care for a prostitute rescued from a local brothel.",1965-04-03,8.1,271,ja,12.592
222,Cruella,"In 1970s London amidst the punk rock revolution, a young grifter named Estella is determined to make a name for herself with her designs. She befriends a pair of young thieves who appreciate her appetite for mischief, and together they are able to build a life for themselves on the London streets. One day, Estella’s flair for fashion catches the eye of the Baroness von Hellman, a fashion legend who is devastatingly chic and terrifyingly haute. But their relationship sets in motion a course of events and revelations that will cause Estella to embrace her wicked side and become the raucous, fashionable and revenge-bent Cruella.",2021-05-26,8.1,7980,en,103.885
229,Scooby-Doo! and KISS: Rock and Roll Mystery,"Get ready to Rock! Scooby-Doo and the Mystery Inc. Gang team up with the one and only KISS in this all-new, out-of-this-world adventure! We join the Gang at KISS World – the all-things-KISS theme park, as they investigate a series of strange hauntings. With help from KISS, they discover that the Crimson Witch has returned to summon The Destroyer from the alternate dimension of Kissteria! The evil duos ghastly plan, to destroy the earth! Can the Gang's cunning and KISS's power of rock save the day?!",2015-07-10,8.1,254,en,15.135
242,"Toto, Peppino, and the Hussy","\"Antonio, Peppino and Lucia are three brothers who live in the country near Naples. Lucia's son, Gianni, goes to Naples to study medicine, but there he knows a ballet dancer. They fall in love and, when she goes to Milan, Gianni follows her. Informed of this and afraid that their nephew will stop studying, the three Caponi brothers leave for Milan to persuade Gianni to come back and continue studying and abandon the \"\"Malafemmina\"\" (bad girl).\"",1956-08-23,8.1,300,it,6.889
243,The Passion of Joan of Arc,"A classic of the silent age, this film tells the story of the doomed but ultimately canonized 15th-century teenage warrior. On trial for claiming she'd spoken to God, Jeanne d'Arc is subjected to inhumane treatment and scare tactics at the hands of church court officials. Initially bullied into changing her story, Jeanne eventually opts for what she sees as the truth. Her punishment, a famously brutal execution, earns her perpetual martyrdom.",1928-04-21,8.1,757,fr,8.831
259,On My Skin,"The incredible true story behind the most controversial Italian court cases in recent years. Stefano Cucchi was arrested for a minor crime and mysteriously found dead during his detention. In one week's time, a family is changed forever.",2018-09-12,8.1,1775,it,8.684
277,Requiem for a Dream,The hopes and dreams of four ambitious people are shattered when their drug addictions begin spiraling out of control. A look into addiction and how it overcomes the mind and body.,2000-10-06,8.0,8699,en,11.698
278,Amadeus,"Wolfgang Amadeus Mozart is a remarkably talented young Viennese composer who unwittingly finds a fierce rival in the disciplined and determined Antonio Salieri. Resenting Mozart for both his hedonistic lifestyle and his undeniable talent, the highly religious Salieri is gradually consumed by his jealousy and becomes obsessed with Mozart's downfall, leading to a devious scheme that has dire consequences for both men.",1984-09-19,8.0,3614,en,19.31
284,Mirror,"A dying man in his forties recalls his childhood, his mother, the war and personal moments that tell of and juxtapose pivotal moments in Soviet history with daily life.",1975-03-07,8.0,763,ru,11.863
290,Love Exposure,"\"The story of a teenage boy named Yu, who falls for Yoko, a girl he runs into while working as an \"\"up-skirt\"\" photographer in an offshoot of the porn industry. His attempts to woo her are complicated by a spot of cross-dressing – which convinces Yoko that she is lesbian – dalliances with kung-fu and crime","and a constant struggle with the guilt that's a legacy of his Catholic upbringing.\"",2009-01-31,8.0,358,ja
295,In This Corner of the World,"Japan, 1943, during World War II. Young Suzu leaves her village near Hiroshima to marry and live with her in-laws in Kure, a military harbor. Her creativity to overcome deprivation quickly makes her indispensable at home. Inhabited by an ancestral wisdom, Suzu impregnates the simple gestures of everyday life with poetry and beauty. The many hardships, the loss of loved ones, the frequent air raids of the enemy, nothing alters her enthusiasm…",2016-11-12,8.0,483,ja,17.711
314,Ford v Ferrari,"American car designer Carroll Shelby and the British-born driver Ken Miles work together to battle corporate interference, the laws of physics, and their own personal demons to build a revolutionary race car for Ford Motor Company and take on the dominating race cars of Enzo Ferrari at the 24 Hours of Le Mans in France in 1966.",2019-11-13,8.0,6444,en,42.859
334,Like Stars on Earth,"Ishaan Awasthi is an eight-year-old whose world is filled with wonders that no one else seems to appreciate. Colours, fish, dogs, and kites don't seem important to the adults, who are much more interested in things like homework, marks, and neatness. Ishaan cannot seem to get anything right in class; he is then sent to boarding school, where his life changes forever.",2007-12-21,8.0,953,hi,14.185
340,My Way,"During the invasion of Normandy the photograph of a slim Korean man in German uniform was found. It transpired that the man had served as a soldier in the Japanese, Russian and German armies. His incredible story inspired director Kang Je-Gyu to create this epic war drama.",2011-12-21,8.0,309,ko,11.292
355,The Mitchells vs. the Machines,"A quirky, dysfunctional family's road trip is upended when they find themselves in the middle of the robot apocalypse and suddenly become humanity's unlikeliest last hope.",2021-04-22,8.0,2319,en,27.282
358,"Remi, Nobody's Boy","At the age of 10 years, young Rémi is snatched from his adoptive mother and entrusted to the signor Vitalis, a mysterious itinerant musician. Has its hard sides - he will learn the harsh life of acrobat and sing to win his bread. Accompanied by the faithful dog capi and of the small monkey Joli-Coeur, his long trip through France, made for meetings, friendships and mutual assistance, leads him to the secret of its origins.",2018-12-12,8.0,369,fr,11.425
369,Before Sunrise,"A young man and woman meet on a train in Europe, and wind up spending one evening together in Vienna. Unfortunately, both know that this will probably be their only night together.",1995-01-27,8.0,3477,en,21.992
378,Limelight,A fading music hall comedian tries to help a despondent ballet dancer learn to walk and to again feel confident about life.,1952-10-23,8.0,432,en,7.559
383,The Cabinet of Dr. Caligari,"Francis, a young man, recalls in his memory the horrible experiences he and his fiancée Jane recently went through. Francis and his friend Alan visit The Cabinet of Dr. Caligari, an exhibit where the mysterious doctor shows the somnambulist Cesare, and awakens him for some moments from his death-like sleep.",1920-02-27,8.0,1272,de,15.289
388,12 Years a Slave,"In the pre-Civil War United States, Solomon Northup, a free black man from upstate New York, is abducted and sold into slavery. Facing cruelty as well as unexpected kindnesses Solomon struggles not only to stay alive, but to retain his dignity. In the twelfth year of his unforgettable odyssey, Solomon’s chance meeting with a Canadian abolitionist will forever alter his life.",2013-10-18,8.0,10214,en,23.323
390,Tel chi el telùn,A comedy show.,1999-05-12,7.9,304,it,6.777
395,Operation Y and Other Shurik's Adventures,"\"The film consists of three independent parts: \"\"Workmate\"\"","\"\"Déjà vu\"\" and \"\"Operation Y\"\". The plot follows the adventures of Shurik (alternative spelling — Shourick)","the naive and nerdy Soviet student who often gets into ludicrous situations but always finds a way out very neatly.  \"\"Operation Y and Shurik's Other Adventures\"\" was a hit movie and became the leader of Soviet film distribution in 1965.\"",1965-08-16,7.9,239
398,Miracle in Cell No. 7,A story about a mentally ill man wrongfully imprisoned for murder and his relationship with his 6 year old daughter.,2013-01-23,7.9,371,ko,11.716
400,The Fabelmans,"Growing up in post-World War II era Arizona, young Sammy Fabelman aspires to become a filmmaker as he reaches adolescence, but soon discovers a shattering family secret and explores how the power of films can help him see the truth.",2022-11-11,7.9,878,en,96.145
410,Girl in the Basement,"Sara is a teen girl who is looking forward to her 18th birthday to move away from her controlling father Don. But before she could even blow out the candles, Don imprisons her in the basement of their home.",2021-02-27,7.9,470,en,56.686
426,Amarcord,"In an Italian seaside town, young Titta gets into trouble with his friends and watches various local eccentrics as they engage in often absurd behavior. Frequently clashing with his stern father and defended by his doting mother, Titta witnesses the actions of a wide range of characters, from his extended family to Fascist loyalists to sensual women, with certain moments shifting into fantastical scenarios.",1973-12-18,7.9,938,it,11.15
438,Honor Society,"Honor is an ambitious high school senior whose sole focus is getting into Harvard, assuming she can first score the coveted recommendation from her guidance counselor, Mr. Calvin. Willing to do whatever it takes, Honor concocts a Machiavellian-like plan to take down her top three student competitors, until things take a turn when she unexpectedly falls for her biggest competition, Michael.",2022-07-23,7.9,250,en,106.487
441,My Hero Academia: Two Heroes,"All Might and Deku accept an invitation to go abroad to a floating and mobile manmade city, called 'I-Island', where they research quirks as well as hero supplemental items at the special 'I-Expo' convention that is currently being held on the island. During that time, suddenly, despite an iron wall of security surrounding the island, the system is breached by a villain, and the only ones able to stop him are the students of Class 1-A.",2018-08-03,7.9,860,ja,71.362
447,Tokyo Revengers,An unemployed man learns that his ex-girlfriend was murdered. He suddenly finds himself travelling through time to his middle school years and has chance to change the future and save the girl. He aims to rise to the top of the most brutal delinquent gang.,2021-07-09,7.9,206,ja,27.04
454,Rebecca,"Story of a young woman who marries a fascinating widower only to find out that she must live in the shadow of his former wife, Rebecca, who died mysteriously several years earlier. The young wife must come to grips with the terrible secret of her handsome, cold husband, Max De Winter. She must also deal with the jealous, obsessed Mrs. Danvers, the housekeeper, who will not accept her as the mistress of the house.",1940-03-23,7.9,1459,en,15.219
455,Persepolis,"In 1970s Iran, Marjane 'Marji' Statrapi watches events through her young eyes and her idealistic family of a long dream being fulfilled of the hated Shah's defeat in the Iranian Revolution of 1979. However as Marji grows up, she witnesses first hand how the new Iran, now ruled by Islamic fundamentalists, has become a repressive tyranny on its own.",2007-06-27,7.9,1671,fr,11.887
476,Ivan's Childhood,"In WW2, twelve year old Soviet orphan Ivan Bondarev works for the Soviet army as a scout behind the German lines and strikes a friendship with three sympathetic Soviet officers.",1962-05-09,7.9,574,ru,11.245
493,Roman Holiday,"Overwhelmed by her suffocating schedule, touring European princess Ann takes off for a night while in Rome. When a sedative she took from her doctor kicks in, however, she falls asleep on a park bench and is found by an American reporter, Joe Bradley, who takes her back to his apartment for safety. At work the next morning, Joe finds out Ann's regal identity and bets his editor he can get exclusive interview with her, but romance soon gets in the way.",1953-08-26,7.9,1698,en,20.36
501,Tokyo Godfathers,"On Christmas Eve, three homeless people living on the streets of Tokyo discover a newborn baby among the trash and set out to find its parents.",2003-12-29,7.9,979,ja,13.763
502,Rio Bravo,"The sheriff of a small town in southwest Texas must keep custody of a murderer whose brother, a powerful rancher, is trying to help him escape. After a friend is killed trying to muster support for him, he and his deputies must find a way to hold out against the rancher's hired guns until the marshal arrives. In the meantime, matters are complicated by the presence of a young gunslinger - and a mysterious beauty who just came in on the last stagecoach.",1959-03-17,7.9,935,en,17.799
505,The Notebook,"An epic love story centered around an older man who reads aloud to a woman with Alzheimer's. From a faded notebook, the old man's words bring to life the story about a couple who is separated by World War II, and is then passionately reunited, seven years later, after they have taken different paths.",2004-06-25,7.9,10175,en,55.267
532,Paper Moon,"During the Great Depression, a con man finds himself saddled with a young girl—who may or may not be his daughter—and the two forge an unlikely partnership.",1973-05-09,7.9,579,en,8.761
583,Indiana Jones and the Last Crusade,"In 1938, an art collector appeals to eminent archaeologist Dr. Indiana Jones to embark on a search for the Holy Grail. Indy learns that a medieval historian has vanished while searching for it, and the missing man is his own father, Dr. Henry Jones Sr.. He sets out to rescue his father by following clues in the old man's notebook, which his father had mailed to him before he went missing. Indy arrives in Venice, where he enlists the help of a beautiful academic, Dr. Elsa Schneider, along with Marcus Brody and Sallah. Together they must stop the Nazis from recovering the power of eternal life and taking over the world!",1989-05-24,7.8,8698,en,39.937
586,"Love, Rosie","Since the moment they met at age 5, Rosie and Alex have been best friends, facing the highs and lows of growing up side by side. A fleeting shared moment, one missed opportunity, and the decisions that follow send their lives in completely different directions. As each navigates the complexities of life, love, and everything in between, they always find their way back to each other - but is it just friendship, or something more?",2014-10-16,7.8,5723,en,43.153
616,The Shadow in My Eye,"On March 21st, 1945, the British Royal Air Force set out on a mission to bomb Gestapo's headquarters in Copenhagen. The raid had fatal consequences as some of the bombers accidentally targeted a school and more than 120 people were killed, 86 of whom were children.",2021-10-28,7.8,372,da,16.83
620,The Heist of the Century,"In 2006, a group of thieves performed what is considered one of the most famous and smart bank heists in the history of Argentina. How they robbed the Rio bank is as surprising as what happened afterwards. This is their story.",2020-01-16,7.8,668,es,23.975
621,Hiroshima Mon Amour,"The deep conversation between a Japanese architect and a French actress forms the basis of this celebrated French film, considered one of the vanguard productions of the French New Wave. Set in Hiroshima after the end of World War II, the couple -- lovers turned friends -- recount, over many hours, previous romances and life experiences. The two intertwine their stories about the past with pondering the devastation wrought by the atomic bomb dropped on the city.",1959-06-10,7.8,657,fr,11.662
640,Midnight Sun,"Katie, a 17-year-old, has been sheltered since childhood and confined to her house during the day by a rare disease that makes even the smallest amount of sunlight deadly. Fate intervenes when she meets Charlie and they embark on a summer romance.",2018-03-22,7.8,3130,en,27.507
644,Brokeback Mountain,"Two modern-day cowboys meet on a shepherding job in the summer of '63, the two share a raw and powerful summer together that turns into a lifelong relationship conflict",2005-09-10,7.8,6143,en,31.284
655,Forbidden Games,"Orphaned after a Nazi air raid, Paulette, a young Parisian girl, runs into Michel, an older peasant boy, and the two quickly become close. Together, they try to make sense of the chaotic and crumbling world around them, attempting to cope with death as they create a burial ground for Paulette's deceased pet dog. Eventually, however, Paulette's stay with Michel's family is threatened by the harsh realities of wartime.",1952-05-09,7.8,255,fr,10.929
674,The Seven Deadly Sins: Cursed by Light,"\"With the help of the \"\"Dragon Sin of Wrath\"\" Meliodas and the worst rebels in history",the Seven Deadly Sins,"the \"\"Holy War\"\"",in which four races,including Humans,Goddesses
688,Deep Red,"A musician witnesses the murder of a famous psychic, and then teams up with a fiesty reporter to find the killer while evading attempts on their lives by the unseen killer bent on keeping a dark secret buried.",1975-03-07,7.8,1231,it,13.203
