14,"The Good, the Bad and the Ugly","While the Civil War rages on between the Union and the Confederacy, three men – a quiet loner, a ruthless hitman, and a Mexican bandit – comb the American Southwest in search of a strongbox containing $200,000 in stolen gold.",1966-12-23,8.5,7240,it,59.321
16,The Lord of the Rings: The Return of the King,"Aragorn is revealed as the heir to the ancient kings as he, Gandalf and the other members of the broken fellowship struggle to save Gondor from Sauron's forces. Meanwhile, Frodo and Sam take the ring closer to the heart of Mordor, the dark lord's realm.",2003-12-01,8.5,21212,en,86.323
22,Puss in Boots: The Last Wish,"Puss in Boots discovers that his passion for adventure has taken its toll: He has burned through eight of his nine lives, leaving him with only one life left. Puss sets out on an epic journey to find the mythical Last Wish and restore his nine lives.",2022-12-07,8.5,4128,en,2378.726
28,Psycho,"When larcenous real estate clerk Marion Crane goes on the lam with a wad of cash and hopes of starting a new life, she ends up at the notorious Bates Motel, where manager Norman Bates cares for his housebound mother.",1960-06-22,8.4,8808,en,34.383
47,The Lord of the Rings: The Two Towers,"Frodo and Sam are trekking to Mordor to destroy the One Ring of Power while Gimli, Legolas and Aragorn search for the orc-captured Merry and Pippin. All along, nefarious wizard Saruman awaits the Fellowship members at the Orthanc Tower in Isengard.",2002-12-18,8.4,19400,en,86.539
73,Evangelion: 3.0+1.0 Thrice Upon a Time,"In the aftermath of the Fourth Impact, stranded without their Evangelions, Shinji, Asuka and Rei find refuge in one of the rare pockets of humanity that still exist on the ruined planet Earth. There, each lives a life far different from their days as an Evangelion pilot. However, the danger to the world is far from over. A new impact is looming on the horizon—one that will prove to be the true end of Evangelion.",2021-03-08,8.3,627,ja,39.986
75,Clouds,"Young musician Zach Sobiech discovers his cancer has spread, leaving him just a few months to live. With limited time, he follows his dream and makes an album, unaware that it will soon be a viral music phenomenon.",2020-10-09,8.3,909,en,14.229
84,Life in a Year,"A 17 year old finds out that his girlfriend is dying, so he sets out to give her an entire life, in the last year she has left.",2020-11-27,8.3,1289,en,83.188
98,Klaus,"When Jesper distinguishes himself as the Postal Academy's worst student, he is sent to Smeerensburg, a small village located on an icy island above the Arctic Circle, where grumpy inhabitants barely exchange words, let alone letters. Jesper is about to give up and abandon his duty as a postman when he meets local teacher Alva and Klaus, a mysterious carpenter who lives alone in a cabin full of handmade toys.",2019-11-08,8.3,3316,en,30.31
104,A Brighter Summer Day,"A boy experiences first love, friendships and injustices growing up in 1960s Taiwan.",1991-07-27,8.3,240,zh,15.464
126,Violet Evergarden: Eternity and the Auto Memory Doll,"Isabella, the daughter of the noble York family, is enrolled in an all-girls academy to be groomed into a dame worthy of nobility. However, she has given up on her future, seeing the prestigious school as nothing more than a prison from the outside world. Her family notices her struggling in her lessons and decides to hire Violet Evergarden to personally tutor her under the guise of a handmaiden.  At first, Isabella treats Violet coldly. Violet seems to be able to do everything perfectly, leading Isabella to assume that she was born with a silver spoon. After some time, Isabella begins to realize that Violet has had her own struggles and starts to open up to her. Isabella soon reveals that she has lost contact with her beloved younger sister, whom she yearns to see again.  Having experienced the power of words through her past clientele, Violet asks if Isabella wishes to write a letter to Taylor. Will Violet be able to help Isabella convey her feelings to her long-lost sister?",2019-09-06,8.2,284,ja,28.649
128,I Want to Eat Your Pancreas,"After his classmate and crush is diagnosed with a pancreatic disease, an average high schooler sets out to make the most of her final days.",2018-09-01,8.2,1193,ja,44.918
134,The Prestige,"A mysterious story of two magicians whose intense rivalry leads them on a life-long battle for supremacy -- full of obsession, deceit and jealousy with dangerous and deadly consequences.",2006-10-19,8.2,13931,en,30.232
135,Stalker,"Near a gray and unnamed city is the Zone, a place guarded by barbed wire and soldiers, and where the normal laws of physics are victim to frequent anomalies. A stalker guides two men into the Zone, specifically to an area in which deep-seated desires are granted.",1979-05-25,8.2,1732,ru,19.824
136,8½,"Guido Anselmi, a film director, finds himself creatively barren at the peak of his career. Urged by his doctors to rest, Anselmi heads for a luxurious resort, but a sorry group gathers—his producer, staff, actors, wife, mistress, and relatives—each one begging him to get on with the show. In retreat from their dependency, he fantasizes about past women and dreams of his childhood.",1963-02-14,8.2,1949,it,13.186
151,Portrait of a Lady on Fire,"On an isolated island in Brittany at the end of the eighteenth century, a female painter is obliged to paint a wedding portrait of a young woman.",2019-06-17,8.2,2016,fr,21.677
156,Joker,"During the 1980s, a failed stand-up comedian is driven insane and turns to a life of crime and chaos in Gotham City while becoming an infamous psychopathic crime figure.",2019-10-01,8.2,22285,en,77.24
160,Taxi Driver,A mentally unstable Vietnam War veteran works as a night-time taxi driver in New York City where the perceived decadence and sleaze feed his urge for violent action.,1976-02-09,8.2,10396,en,49.83
164,Scarface,"After getting a green card in exchange for assassinating a Cuban government official, Tony Montana stakes a claim on the drug trade in Miami. Viciously murdering anyone who stands in his way, Tony eventually becomes the biggest drug lord in the state, controlling nearly all the cocaine that comes through Miami. But increased pressure from the police, wars with Colombian drug cartels and his own drug-fueled paranoia serve to fuel the flames of his eventual downfall.",1983-12-09,8.2,10098,en,80.386
182,Black Beauty,"Born free in the American West, Black Beauty is a horse rounded up and brought to Birtwick Stables, where she meets spirited teenager Jo Green. The two forge a bond that carries Beauty through the different chapters, challenges and adventures.",2020-11-27,8.1,289,en,12.211
183,Anne of Green Gables,"At the turn of the century on Prince Edward Island, Matthew Cuthbert and his sister Marilla decide to take on an orphan boy as help for their farm. But they get an unexpected jolt when they're mistakenly sent a girl instead: Anne Shirley.",1985-12-01,8.1,210,en,17.995
188,Alien,"During its return to the earth, commercial spaceship Nostromo intercepts a distress signal from a distant planet. When a three-member team of the crew discovers a chamber containing thousands of eggs on the planet, a creature inside one of the eggs attacks an explorer. The entire crew is unaware of the impending nightmare set to descend upon them when the alien parasite planted inside its unfortunate host is birthed.",1979-05-25,8.1,12556,en,59.854
195,The Invisible Guest,"Barcelona, Spain. Adrián Doria, a young and successful businessman accused of murder, meets one night with Virginia Goodman, an expert interrogation lawyer, in order to devise a defense strategy.",2017-01-06,8.1,4023,es,36.502
221,Silenced,"Based on actual events that took place at Gwangju Inhwa School for the hearing-impaired, where young deaf students were the victims of repeated sexual assaults by faculty members over a period of five years in the early 2000s.",2011-09-22,8.1,477,ko,22.67
224,Lion,"A five-year-old Indian boy gets lost on the streets of Calcutta, thousands of kilometers from home. He survives many challenges before being adopted by a couple in Australia; 25 years later, he sets out to find his lost family.",2016-11-24,8.1,5978,en,26.497
230,In the Arms of an Assassin,"Victor (William Levy) is one of the world’s most handsome  men, but he has a deep secret – he is a cold blooded assassin. Smooth talking and seductive, Victor was raised to do one thing only, which is to kill for money. When he is sent to the home of a brutal drug lord to collect payment for his most recent hit, he encounters the beautiful Sarai (Alicia Sanz), who has been forced to spend the last 9 years of her life with the drug lord.",2019-12-06,8.1,310,es,23.612
231,Prisoners,"Keller Dover faces a parent's worst nightmare when his 6-year-old daughter, Anna, and her friend go missing. The only lead is an old motorhome that had been parked on their street. The head of the investigation, Detective Loki, arrests the driver, but a lack of evidence forces Loki to release his only suspect. Dover, knowing that his daughter's life is at stake, decides that he has no choice but to take matters into his own hands.",2013-09-18,8.1,10095,en,39.026
250,Jojo Rabbit,"A World War II satire that follows a lonely German boy whose world view is turned upside down when he discovers his single mother is hiding a young Jewish girl in their attic. Aided only by his idiotic imaginary friend, Adolf Hitler, Jojo must confront his blind nationalism.",2019-10-18,8.1,8228,en,40.956
269,Nights of Cabiria,"Rome, 1957. A woman, Cabiria, is robbed and left to drown by her boyfriend, Giorgio. Rescued, she resumes her life and tries her best to find happiness in a cynical world. Even when she thinks her struggles are over and she has found happiness and contentment, things may not be what they seem.",1957-10-03,8.0,625,it,8.814
272,The Thing,"A team of American scientists investigate the empty, destroyed base of their Norwegian counterparts in Antarctica, only to discover a terrifying life force that can take the form of its prey.",1982-06-25,8.0,5858,en,40.833
283,The Red Shoes,"In this classic drama, Vicky Page is an aspiring ballerina torn between her dedication to dance and her desire to love. While her imperious instructor, Boris Lermontov, urges to her to forget anything but ballet, Vicky begins to fall for the charming young composer Julian Craster. Eventually Vicky, under great emotional stress, must choose to pursue either her art or her romance, a decision that carries serious consequences.",1948-09-06,8.0,509,en,9.321
285,The Gold Rush,"A lone prospector ventures into Alaska looking for gold. He soon gets mixed up with some burly characters, falls in love with the beautiful Georgia, and tries to win her heart with his singular charm.",1925-07-12,8.0,1326,en,11.918
298,Casino,"\"In early-1970s Las Vegas, Sam \"\"Ace\"\" Rothstein gets tapped by his bosses to head the Tangiers Casino. At first",he's a great success in the job,but over the years,problems with his loose-cannon enforcer Nicky Santoro,his ex-hustler wife Ginger,"her con-artist ex Lester Diamond and a handful of corrupt politicians put Sam in ever-increasing danger.\""
317,Paperman,An urban office worker finds that paper airplanes are instrumental in meeting a girl in ways he never expected.,2012-11-02,8.0,1566,en,7.85
323,Wish Dragon,Determined teen Din is longing to reconnect with his childhood best friend when he meets a wish-granting dragon who shows him the magic of possibilities.,2021-01-15,8.0,1065,en,59.452
324,No Manches Frida 2,Ex-con Zequi and company come back for a new adventure.,2019-03-15,8.0,759,es,60.76
335,Nobody Knows,"In a small Tokyo apartment, twelve-year-old Akira must care for his younger siblings after their mother leaves them and shows no sign of returning.",2004-08-07,8.0,399,ja,18.244
345,Tae Guk Gi: The Brotherhood of War,"When two brothers are forced to fight in the Korean War, the elder decides to take the riskiest missions if it will help shield the younger from battle.",2004-02-05,8.0,571,ko,17.46
348,On the Waterfront,"Terry Malloy dreams about being a prize fighter, while tending his pigeons and running errands at the docks for Johnny Friendly, the corrupt boss of the dockers union. Terry witnesses a murder by two of Johnny's thugs, and later meets the dead man's sister and feels responsible for his death. She introduces him to Father Barry, who tries to force him to provide information for the courts that will smash the dock racketeers.",1954-06-22,8.0,1306,en,12.302
354,Trainspotting,"Heroin addict Mark Renton stumbles through bad ideas and sobriety attempts with his unreliable friends -- Sick Boy, Begbie, Spud and Tommy. He also has an underage girlfriend, Diane, along for the ride. After cleaning up and moving from Edinburgh to London, Mark finds he can't escape the life he left behind when Begbie shows up at his front door on the lam, and a scheming Sick Boy follows.",1996-02-23,8.0,8669,en,26.828
377,Catch Me If You Can,"A true story about Frank Abagnale Jr. who, before his 19th birthday, successfully conned millions of dollars worth of checks as a Pan Am pilot, doctor, and legal prosecutor. An FBI agent makes it his mission to put him behind bars. But Frank not only eludes capture, he revels in the pursuit.",2002-12-16,8.0,13567,en,107.79
389,La Maison en Petits Cubes,La Maison en Petits Cubes tells the story of a grandfather's memories as he adds more blocks to his house to stem the flooding waters.,2008-06-10,8.0,387,ja,11.352
399,The Great Escape,"The Nazis, exasperated at the number of escapes from their prison camps by a relatively small number of Allied prisoners, relocate them to a high-security 'escape-proof' camp to sit out the remainder of the war. Undaunted, the prisoners plan one of the most ambitious escape attempts of World War II. Based on a true story.",1963-06-20,7.9,2141,en,24.441
405,The Eight Mountains,"Pietro is a boy from the city. Bruno is the last child of a forgotten mountain village. Over the years Bruno remains faithful to his mountain, while Pietro is the one who comes and goes. Their encounters introduce them to love and loss, reminding them of their origins, letting their destinies unfold, as Pietro and Bruno discover what it means to be true friends for life.",2022-12-21,7.9,205,it,8.939
406,The Sixth Sense,"Following an unexpected tragedy, a child psychologist named Malcolm Crowe meets an nine year old boy named Cole Sear, who is hiding a dark secret.",1999-08-06,7.9,10226,en,37.571
415,Blade Runner,"In the smog-choked dystopian Los Angeles of 2019, blade runner Rick Deckard is called out of retirement to terminate a quartet of replicants who have escaped to Earth seeking their creator for a way to extend their short life spans.",1982-06-25,7.9,12209,en,47.584
435,Chinatown,"Private eye Jake Gittes lives off of the murky moral climate of sunbaked, pre-World War II Southern California. Hired by a beautiful socialite to investigate her husband's extra-marital affair, Gittes is swept into a maelstrom of double dealings and deadly deceits, uncovering a web of personal and political scandals that come crashing together.",1974-06-20,7.9,3230,en,21.714
440,The Iron Giant,"In the small town of Rockwell, Maine in October 1957, a giant metal machine befriends a nine-year-old boy and ultimately finds its humanity by unselfishly saving people from their own fears and prejudices.",1999-08-06,7.9,4850,en,43.109
472,Two Women,"Widowed shopkeeper Cesira and her 13-year-old daughter Rosetta flee from the allied bombs in Rome during the second World War; they travel to the remote village where Cesira was born. During their journey and in the village and onward, the mother does everything she can to protect Rosetta. Meanwhile, a sensitive young intellectual, Michele, falls in love with Cesira.",1960-12-22,7.9,458,it,10.395
490,La La Land,"Mia, an aspiring actress, serves lattes to movie stars in between auditions and Sebastian, a jazz musician, scrapes by playing cocktail party gigs in dingy bars, but as success mounts they are faced with decisions that begin to fray the fragile fabric of their love affair, and the dreams they worked so hard to maintain in each other threaten to rip them apart.",2016-11-29,7.9,15016,en,36.008
496,Whiplash,"A ferocious, bullying music teacher teaches a dedicated student. This is the 18 minute short film that the feature film was based on.",2013-01-18,7.9,294,en,6.476
504,The Working Class Goes to Heaven,A conscientious factory worker gets his finger cut off by a machine. The accident causes him to become more involved in political and revolutionary groups.,1971-09-17,7.9,295,it,5.323
506,Scooby-Doo! and the Samurai Sword,"The Mystery Inc. gang takes a trip to Japan and finds themselves circling Asia and the Pacific in a treasure hunt, racing against the vengeful Black Samurai and his Ninja warriors to find the legendary Sword of Fate, an ancient blade fabled to possess extraordinary supernatural powers.",2009-04-07,7.9,222,en,12.132
514,No Game No Life: Zero,"\"In ancient Disboard, Riku is an angry, young warrior intent on saving humanity from the warring Exceed, the sixteen sentient species, fighting to establish the \"\"One True God\"\" amongst the Old Deus. In a lawless land",humanity's lack of magic and weak bodies have made them easy targets,leaving them on the brink of extinction. One day,hope returns to humanity when Riku finds a powerful female Ex-machina,whom he names Schwi. Exiled from her Cluster because of her research into human emotions,Schwi is convinced that humanity has only survived due to the power of these feelings. Forming an unlikely partnership in the midst of the overwhelming chaos
518,Ordet,"The three sons of devout Danish farmer Morten have widely disparate religious beliefs. Youngest son Anders shares his father's religion, but eldest son Mikkel has lost his faith, while middle child Johannes has become delusional and proclaims that he is Jesus Christ himself. When Mikkel's wife, Inger goes into a difficult childbirth, everyone's beliefs are put to the test.",1955-01-09,7.9,298,da,7.918
526,Us Again,"In a vibrant city pulsating with rhythm and movement, an elderly man and his young-at-heart wife rekindle their youthful passion for life and each other on one magical night.",2021-03-05,7.9,265,en,8.267
565,The Boy in the Striped Pyjamas,"When his family moves from their home in Berlin to a strange new house in Poland, young Bruno befriends Shmuel, a boy who lives on the other side of the fence where everyone seems to be wearing striped pajamas. Unaware of Shmuel's fate as a Jewish prisoner or the role his own Nazi father plays in his imprisonment, Bruno embarks on a dangerous journey inside the camp's walls.",2008-05-07,7.8,6266,en,41.219
576,The Best Offer,"Virgil Oldman is a world renowned antiques expert and auctioneer. An eccentric genius, he leads a solitary life, going to extreme lengths to keep his distance from the messiness of human relationships. When appointed by the beautiful but emotionally damaged Claire to oversee the valuation and sale of her family’s priceless art collection, Virgil allows himself to form an attachment to her – and soon he is engulfed by a passion which will rock his bland existence to the core.",2013-01-01,7.8,2565,en,11.468
582,Partly Cloudy,"\"Everyone knows that the stork delivers babies, but where do the storks get the babies from? The answer lies up in the stratosphere, where cloud people sculpt babies from clouds and bring them to life. Gus, a lonely and insecure grey cloud, is a master at creating \"\"dangerous\"\" babies. Crocodiles",porcupines,rams and more - Gus's beloved creations are works of art,but more than a handful for his loyal delivery stork partner,Peck. As Gus's creations become more and more rambunctious,"Peck's job gets harder and harder. How will Peck manage to handle both his hazardous cargo and his friend's fiery temperament?\""
590,Back to the Outback,"Tired of being locked in a reptile house where humans gawk at them like they are monsters, a ragtag group of Australia’s deadliest creatures plot an escape from their zoo to the Outback, a place where they’ll fit in without being judged.",2021-12-03,7.8,634,en,38.682
601,Hustle,"After discovering a once-in-a-lifetime player with a rocky past abroad, a down on his luck basketball scout takes it upon himself to bring the phenom to the States without his team's approval. Against the odds, they have one final shot to prove they have what it takes to make it in the NBA.",2022-06-03,7.8,1951,en,64.362
614,Kabhi Khushi Kabhie Gham,"Years after his father disowns his adopted brother for marrying a woman of lower social standing, a young man goes on a mission to reunite his family.",2001-12-14,7.8,461,hi,16.642
633,Vivre Sa Vie,Twelve episodic tales in the life of a Parisian woman and her slow descent into prostitution.,1962-09-20,7.8,530,fr,8.223
645,Snatch,"Unscrupulous boxing promoters, violent bookmakers, a Russian gangster, incompetent amateur robbers and supposedly Jewish jewelers fight to track down a priceless stolen diamond.",2000-09-01,7.8,7877,en,24.668
651,Who's Afraid of Virginia Woolf?,"A history professor and his wife entertain a young couple who are new to the university's faculty. As the drinks flow, secrets come to light, and the middle-aged couple unload onto their guests the full force of the bitterness, dysfunction, and animosity that defines their marriage.",1966-06-22,7.8,675,en,11.304
653,I Saw the Devil,"Kyung-Chul is a dangerous psychopath who kills for pleasure. Soo-Hyun, a top-secret agent, decides to track down the murderer himself. He promises himself that he will do everything in his power to take vengeance against the killer, even if it means that he must become a monster himself.",2010-08-12,7.8,2092,ko,16.338
657,One Hundred Steps,"\"The true story of Peppino Impastato, an activist who openly opposed the Mafia in small-town 1970s Sicily despite living just \"\"one hundred steps\"\" away from notorious Mafia boss Tano Badalamenti.\"",2000-09-01,7.8,584,it,6.997
667,The Wind Rises,"A lifelong love of flight inspires Japanese aviation engineer Jiro Horikoshi, whose storied career includes the creation of the A-6M World War II fighter plane.",2013-07-20,7.8,2461,ja,23.367
670,Notorious,"In order to help bring Nazis to justice, U.S. government agent T.R. Devlin recruits Alicia Huberman, the American daughter of a convicted German war criminal, as a spy. As they begin to fall for one another, Alicia is instructed to win the affections of Alexander Sebastian, a Nazi hiding out in Brazil. When Sebastian becomes serious about his relationship with Alicia, the stakes get higher, and Devlin must watch her slip further undercover.",1946-08-21,7.8,1316,en,14.787
679,Pirates of the Caribbean: The Curse of the Black Pearl,"Jack Sparrow, a freewheeling 18th-century pirate, quarrels with a rival pirate bent on pillaging Port Royal. When the governor's daughter is kidnapped, Sparrow decides to help the girl's love save her.",2003-07-09,7.8,18465,en,104.381
718,King Richard,"The story of how Richard Williams served as a coach to his daughters Venus and Serena, who will soon become two of the most legendary tennis players in history.",2021-11-18,7.8,1871,en,36.243
722,The Breakfast Club,"Five high school students from different walks of life endure a Saturday detention under a power-hungry principal. The disparate group includes rebel John, princess Claire, outcast Allison, brainy Brian and Andrew, the jock. Each has a chance to tell his or her story, making the others see them a little differently -- and when the day ends, they question whether school will ever be the same.",1985-02-15,7.8,7168,en,23.302
743,"I, Daniel Blake","A middle aged carpenter, who requires state welfare after injuring himself, is joined by a single mother in a similar scenario.",2016-10-21,7.7,1208,en,11.55
748,Back to the Future Part II,"Marty and Doc are at it again in this wacky sequel to the 1985 blockbuster as the time-traveling duo head to 2015 to nip some McFly family woes in the bud. But things go awry thanks to bully Biff Tannen and a pesky sports almanac. In a last-ditch attempt to set things straight, Marty finds himself bound for 1955 and face to face with his teenage parents -- again.",1989-11-22,7.7,11306,en,38.943
754,Mystic River,The lives of three men who were childhood friends are shattered when one of them has a family tragedy.,2003-01-01,7.7,5673,en,31.001
760,The Kissing Booth 2,"With college decisions looming, Elle juggles her long-distance romance with Noah, changing relationship with bestie Lee and feelings for a new classmate.",2020-07-24,7.7,4681,en,41.959
763,Big Hero 6,"A special bond develops between plus-sized inflatable robot Baymax, and prodigy Hiro Hamada, who team up with a group of friends to form a band of high-tech heroes.",2014-10-24,7.7,14257,en,98.464
789,My Mom Is a Character,"After another spat with her kids, Dona Hermínia decides to take some time off from them and hides away in her aunt's house, where she reminisces about her kids in an age when they still needed her.",2013-06-21,7.7,595,pt,5.401
799,Temple Grandin,"A biopic of Temple Grandin, an autistic woman who has become one of top scientists in humane livestock handling.",2010-02-06,7.7,343,en,11.902
820,Cléo from 5 to 7,"Agnès Varda eloquently captures Paris in the sixties with this real-time portrait of a singer set adrift in the city as she awaits test results of a biopsy. A chronicle of the minutes of one woman’s life, Cléo from 5 to 7 is a spirited mix of vivid vérité and melodrama, featuring a score by Michel Legrand and cameos by Jean-Luc Godard and Anna Karina.",1962-04-11,7.7,521,fr,14.2
