7557,Life-Size,"After her mom's death, Casey pulls away from everyone in her life, including her emotionally distant dad. With help from a magic spell, she tries to bring her mother back from the dead; instead, Casey's words accidentally awaken one of her least favorite toys: a statuesque Barbie clone named Eve. Things get worse when Casey's dad develops a crush on his daughter's living doll.",2000-03-05,6.2,343,en,12.252
7563,The Land Before Time IV: Journey Through the Mists,Littlefoot and his dinosaur pals go in search of a medicinal flower that will cure his ailing grandfather.,1996-12-10,6.2,294,en,11.6
7569,The New Mutants,"Five young mutants, just discovering their abilities while held in a secret facility against their will, fight to escape their past sins and save themselves.",2020-08-26,6.2,2947,en,43.151
7576,Songbird,"During a pandemic lockdown, Nico, a young man with rare immunity, must overcome martial law, murderous vigilantes and a powerful family to reunite with his love, Sara.",2020-12-10,6.2,604,en,22.298
7581,Tales from the Darkside: The Movie,A young boy tells three stories of horror to distract a witch who plans to eat him.,1990-05-03,6.2,300,en,9.476
7584,Red Lights,"Two investigators of paranormal hoaxes, the veteran Dr. Margaret Matheson and her young assistant, Tom Buckley, study the most varied metaphysical phenomena with the aim of proving their fraudulent origins. Simon Silver, a legendary blind psychic, reappears after an enigmatic absence of 30 years to become the greatest international challenge to both orthodox science and professional sceptics. Tom starts to develop an intense obsession with Silver, whose magnetism becomes stronger with each new manifestation of inexplicable events. As Tom gets closer to Silver, tension mounts, and his worldview is threatened to its core.",2012-03-02,6.2,1080,en,22.719
7585,A Bigger Splash,"An American couple, Paul and Marianne, spend their vacation in Italy and experience trouble when Marianne invites a former lover and his teenage daughter to visit, which leads to jealousy and dangerous sexual scenarios.",2015-11-26,6.2,660,en,11.485
7592,Untraceable,"Special Agent Jennifer Marsh works in an elite division of the FBI dedicated to fighting cybercrime. She thinks she has seen it all, until a particularly sadistic criminal arises on the Internet. This tech-savvy killer posts live feeds of his crimes on his website; the more hits the site gets, the faster the victim dies. Marsh and her team must find the elusive killer before time runs out.",2008-01-22,6.2,748,en,10.163
7593,The Edge of Love,"When the Welsh poet Dylan Thomas and his flirtatious wife Caitlin sweep into war-torn London, the last thing they expect is to bump into Dylan's childhood sweetheart Vera. Despite her joy at seeing Dylan after so many years, Vera is swept off her feet by a dashing officer, William Killick, and finds herself torn between the open adoration of her new found beau and the wily charms of the exotic Welshman.",2008-06-20,6.2,326,en,7.555
7597,Turbo,The tale of an ordinary garden snail who dreams of winning the Indy 500.,2013-07-11,6.2,2868,en,22.292
7605,Ironclad,"In the year 1215, the rebel barons of England have forced their despised King John to put his royal seal on the Magna Carta, a seminal document that upheld the rights of free men. Yet within months of pledging himself to the great charter, the King reneged on his word and assembled a mercenary army on the south coast of England with the intention of bringing the barons and the country back under his tyrannical rule. Barring his way stood the mighty Rochester castle, a place that would become the symbol of the rebel's momentous struggle for justice and freedom.",2011-03-03,6.2,635,en,11.794
7609,The Disappearance of Eleanor Rigby: Them,A New York couple's relationship is tested after the loss of their child. This film is the wide-released combination of the original two :him and :her volumes that premiered at the Cannes Film Festival.,2014-05-14,6.2,255,en,7.294
7612,The Escapist,"Frank Perry is an institutionalized convict twelve years into a life sentence without parole. When his estranged daughter falls ill, he is determined to make peace with her before it's too late. He develops an ingenious escape plan, and recruits a dysfunctional band of escapists - misfits with a mutual dislike for one other but united by their desire to escape their hell hole of an existence.",2008-06-20,6.2,204,en,9.811
7617,Wimbledon,"British tennis player Peter clutches to an embarrassingly low position on the tennis-ranking ladder. Handed a wild card for Wimbledon, he expects it to be his final bow.",2004-09-13,6.2,861,en,9.561
7619,A Very Bad Friend,"\"Mika, a little crook, took a quick tour of the prison, where he got to know \"\"Putin\"\"",a crazy and unpredictable detainee. As soon as his sentence has been served,he decides to start from scratch and start his life over again. As he prepares to marry the daughter of a wealthy businessman,"his past catches up with him: Putin arrives without warning! Mika will quickly realize that we do not easily get rid of such a ball ...\"",2019-09-04,6.2
7630,The Dictator,The heroic story of a dictator who risks his life to ensure that democracy would never come to the country he so lovingly oppressed.,2012-05-15,6.2,5177,en,31.589
7634,Nobody's Fool,"\"A woman, who gets released from prison and reunites with her sister, discovers she is in an online relationship with a man who may be \"\"catfishing\"\" her.\"",2018-10-31,6.2,261,en,9.427
7641,Frankenstein's Army,"Toward the end of World War II, Russian soldiers pushing into eastern Germany stumble across a secret Nazi lab, one that has unearthed and begun experimenting with the journal of one Dr. Victor Frankenstein. The scientists have used the legendary Frankenstein's work to assemble an army of super-soldiers stitched together from the body parts of their fallen comrades -- a desperate Hitler's last ghastly ploy to escape defeat",2013-01-24,6.2,213,en,8.421
7642,So Undercover,"When the FBI hires her to go undercover at a college sorority, Molly Morris (Miley Cyrus) must transform herself from a tough, streetwise private investigator to a refined, sophisticated university girl to help protect the daughter of a one-time Mobster. With several suspects on her list, Molly unexpectedly discovers that not everyone is who they appear to be, including herself.",2012-12-06,6.2,1046,en,17.994
7643,Le Chef,"A veteran chef faces off against his restaurant group's new CEO, who wants to the establishment to lose a star from its rating in order to bring in a younger chef who specializes in molecular gastronomy.",2012-03-07,6.2,512,fr,10.201
7656,Orgazmo,A devout Mormon living in L.A. becomes a pornographic actor after his martial arts moves impress a big-time director.,1998-07-02,6.2,354,en,9.534
7661,Wrong Cops,A group of bad cops look to dispose of a body that one of them accidentally shot.,2013-12-18,6.2,235,en,6.185
7685,Pee-wee's Big Holiday,A fateful meeting with a mysterious stranger inspires Pee-wee Herman to take his first-ever holiday.,2016-03-15,6.2,201,en,7.289
7686,Cyberbully,A woman tries to help her teenage daughter when she becomes the victim of online bullying.,2011-07-16,6.2,437,en,8.041
7695,Tramps,A young man and woman find love in an unlikely place while carrying out a shady deal.,2016-09-10,6.2,203,en,6.913
7702,The Extraordinary Adventures of Adèle Blanc-Sec,"An adventure set in the early part of the 20th century, focused on a popular novelist and her dealings with would-be suitors, the cops, monsters, and other distractions.",2010-04-09,6.1,1140,fr,18.103
7704,Dante's Peak,"Volcanologist Harry Dalton comes to the sleepy town of Dante's Peak to investigate the recent rumblings of the dormant volcano the burg is named for. Before long, his worst fears are realized when a massive eruption hits, and immediately, Harry, the mayor and the townspeople find themselves fighting for their lives amid a catastrophic nightmare.",1997-02-07,6.2,1591,en,21.601
7705,Transformers: Revenge of the Fallen,"Sam Witwicky leaves the Autobots behind for a normal life. But when his mind is filled with cryptic symbols, the Decepticons target him and he is dragged back into the Transformers' war.",2009-06-19,6.1,7547,en,24.155
7708,Krampus,"When his dysfunctional family clashes over the holidays, young Max is disillusioned and turns his back on Christmas.  Little does he know, this lack of festive spirit has unleashed the wrath of Krampus: a demonic force of ancient evil intent on punishing non-believers.",2015-11-26,6.1,1811,en,20.903
7727,First Daughter,"Samantha MacKenzie, the daughter of the president of the United States, arrives at college with a group of Secret Service agents. Samantha, however, resents their presence and decides she wants to attend school just like a normal student. Her father agrees to recall the agents but secretly assigns James, an undercover agent, to pose as a student. They fall in love, but their romance is jeopardized when Samantha learns James' true identity.",2004-09-24,6.1,768,en,13.241
7732,Saint Laurent,"1967-1976. As one of history's greatest fashion designers entered a decade of freedom, neither came out of it in one piece.",2014-09-23,6.1,260,fr,7.028
7734,Varsity Blues,"In small-town Texas, high school football is a religion, 17-year-old schoolboys carry the hopes of an entire community onto the gridiron every Friday night. When star quarterback Lance Harbor suffers an injury, the Coyotes are forced to regroup under the questionable leadership of John Moxon, a second-string quarterback with a slightly irreverent approach to the game.",1999-01-15,6.1,345,en,8.934
7737,The Producers,"After putting together another Broadway flop, down-on-his-luck producer Max Bialystock teams up with timid accountant Leo Bloom in a get-rich-quick scheme to put on the world's worst show.",2005-12-25,6.1,405,en,11.253
7745,Mark Felt: The Man Who Brought Down the White House,"\"The story of Mark Felt, who under the name \"\"Deep Throat\"\" helped journalists Bob Woodward and Carl Bernstein uncover the Watergate scandal in 1974.\"",2017-09-28,6.1,440,en,10.673
7747,The Back-Up Plan,"When Zoe tires of looking for Mr. Right, she decides to have a baby on her own. But on the day she's artificially inseminated, she meets Stan, who seems to be just who she's been searching for all her life. Now, Zoe has to figure out how to make her two life's dreams fit with each other.",2010-04-23,6.1,1272,en,11.51
7762,Anchorman 2: The Legend Continues,"With the 70s behind him, San Diego's top rated newsman, Ron Burgundy, returns to take New York's first 24-hour news channel by storm.",2013-12-18,6.1,2243,en,17.011
7765,Rising Sun,"When a prostitute is found dead in a Los Angeles skyscraper occupied by a large Japanese corporation, detectives John Connor and Web Smith are called in to investigate. Although Connor has previous experience working in Japan, cultural differences make their progress difficult until a security disc showing the murder turns up. Close scrutiny proves the disc has been doctored, and the detectives realize they're dealing with a cover-up as well.",1993-07-30,6.1,624,en,11.381
7776,The Philadelphia Experiment,"\"Based on an \"\"actual event\"\" that took place in 1943. About a US Navy Destroyer Escort that disappeared from the Philadelphia Naval Shipyard","and sent two men 40 years into the future to 1984.\"",1984-08-03,6.1,318,en
7781,CHiPS,The adventures of two California Highway Patrol motorcycle officers as they make their rounds on the freeways of Los Angeles.,2017-03-23,6.1,1121,en,20.409
7800,Choke,A sex-addicted con-man pays for his mother's hospital bills by playing on the sympathies of those who rescue him from choking to death.,2008-09-26,6.1,336,en,8.227
7805,You Kill Me,"While drying out on the West Coast, an alcoholic hit man befriends a tart-tongued woman who might just come in handy when it's time for him to return to Buffalo and settle some old scores.",2007-02-09,6.1,227,en,6.182
7806,No Limit,Roxana Aubrey decides to drop her studies and escape her life in Paris for a free diving course in the south of France. She is quickly pulled into a life that reaches new depths brought by the weight of an ocean's descent.,2022-09-09,6.1,232,fr,45.977
7829,Tolo Tolo,"Checco is a young Apulian entrepreneur dreamer who has opened a sushi restaurant in his Apulia. However, after one month, the restaurant went bankrupt and he chose to emigrate to Africa to escape from debt. Here he adapts to being a waiter in a resort in Kenya, but at the outbreak of a civil war he decides to embark on a stowaway trip on a boat for migrants to Europe and chooses to do it with his African friends. However, he would not like to return to Italy, but rather to go to Liechtenstein where banking secrecy is in force and there is a lower tax burden than in Italy.",2020-01-01,6.1,1137,it,6.322
7843,The Dark and the Wicked,"On a secluded farm in a nondescript rural town, a man is slowly dying. His family gathers to mourn, and soon a darkness grows, marked by waking nightmares and a growing sense that something evil is taking over the family.",2020-10-29,6.1,305,en,21.175
7876,Idle Hands,"Anton is a cheerful but exceedingly non-ambitious 17-year-old stoner who lives to stay buzzed, watch TV, and moon over Molly, the beautiful girl who lives next door. However, it turns out that the old cliché about idle hands being the devil's playground has a kernel of truth after all.",1999-04-30,6.1,550,en,12.352
7884,Happy End,A well-to-do French family living in Calais deal with a series of setbacks and crises while paying little attention to the grim conditions in the refugee camps within a few miles of their home.,2017-06-21,6.1,336,fr,7.363
7887,Frontier(s),"A gang of young thieves flee Paris during the violent aftermath of a political election, only to hole up at an Inn run by neo-Nazis.",2007-07-01,6.1,607,fr,9.919
7898,A Thousand Words,"Jack McCall is a fast-talking literary agent, who can close any deal, any time, any way. He has set his sights on New Age guru Dr. Sinja for his own selfish purposes. But Dr. Sinja is on to him, and Jack’s life comes unglued after a magical Bodhi tree mysteriously appears in his backyard. With every word Jack speaks, a leaf falls from the tree and he realizes that when the last leaf falls, both he and the tree are toast. Words have never failed Jack McCall, but now he’s got to stop talking and conjure up some outrageous ways to communicate or he’s a goner.",2012-03-07,6.1,1182,en,16.234
7908,Monster Trucks,"Tripp is a high school senior with a knack for building trucks who makes an incredible discovery - a gas-guzzling creature named Creech. To protect his mischievous new friend, Tripp hides Creech under the hood of his latest creation, turning it into a real-life super-powered Monster Truck. Together, this unlikely duo with a shared taste for speed team up on a wild and unforgettable journey to reunite Creech with his family.",2016-12-21,6.1,734,en,15.53
7911,The Texas Chainsaw Massacre: The Beginning,"Chrissie and her friends set out on a road trip for a final fling before one is shipped off to Vietnam. Along the way, bikers harass the foursome and cause an accident that throws Chrissie from the vehicle. The lawman who arrives on the scene kills one of the bikers and brings Chrissie's friends to the Hewitt homestead, where young Leatherface is learning the tools of terror.",2006-10-05,6.1,1512,en,32.428
7918,Grown Ups 2,"Lenny has relocated his family back to the small town where he and his friends grew up. This time around, the grown ups are the ones learning lessons from their kids on a day notoriously full of surprises—the last day of school.",2013-07-11,6.1,3712,en,91.408
7933,Allegiant,Beatrice Prior and Tobias Eaton venture into the world outside of the fence and are taken into protective custody by a mysterious agency known as the Bureau of Genetic Welfare.,2016-03-09,6.1,6047,en,29.308
7965,Angel Eyes,"A story about a seemingly unlikely couple who cross paths under life-threatening circumstances as though they are destined not only to meet but to save each other's lives. Not once, but twice.",2001-05-15,6.1,370,en,10.15
7971,The Night Before,"In New York City for their annual tradition of Christmas Eve debauchery, three lifelong best friends set out to find the Holy Grail of Christmas parties since their yearly reunion might be coming to an end.",2015-11-20,6.1,1496,en,11.235
7984,Walking with Dinosaurs,"Walking with Dinosaurs 3D is a film depicting life-like 3D dinosaur characters set in photo-real landscapes that transports audiences to the prehistoric world as it existed 70 million years ago. The film is based on the 1999 documentary television miniseries Walking with Dinosaurs, produced by the BBC. Walking with Dinosaurs 3D is being produced by Evergreen Studios, the company that produced Happy Feet, and it is was released on October 11, 2013.",2013-12-18,6.1,415,en,23.079
7986,Eye for an Eye,"It's fire and brimstone time as grieving mother Karen McCann takes justice into her own hands when a kangaroo court in Los Angeles fails to convict Robert Doob, the monster who raped and murdered her 17-year-old daughter.",1996-01-12,6.1,298,en,10.576
7988,Passengers,"After a plane crash, a young therapist, Claire, is assigned by her mentor to counsel the flight's five survivors. When they share their recollections of the incident -- which some say include an explosion that the airline claims never happened -- Claire is intrigued by Eric, the most secretive of the passengers.",2008-09-26,6.1,775,en,11.294
7989,Down with Love,"In 1962 New York City, love blossoms between a playboy journalist and a feminist advice author.",2003-05-08,6.1,619,en,12.299
7997,Hollywoodland,"When Hollywood superstar George Reeves dies in his home, private detective Louis Simo is hired to investigate his death and gets caught in a web of lies involving a big studio executive's wife.",2006-08-31,6.1,329,en,7.558
8000,The Sorcerer's Apprentice,"Balthazar Blake is a master sorcerer in modern-day Manhattan trying to defend the city from his arch-nemesis, Maxim Horvath. Balthazar can't do it alone, so he recruits Dave Stutler, a seemingly average guy who demonstrates hidden potential, as his reluctant protégé. The sorcerer gives his unwilling accomplice a crash course in the art and science of magic, and together, these unlikely partners work to stop the forces of darkness.",2010-07-13,6.1,4462,en,24.235
8003,Kill Your Friends,"In the late 1990s, a drug-addled nihilist resorts to murder to climb the ladder of the London music industry.",2015-11-06,6.1,278,en,8.586
8021,Daylight,A group of armed robbers fleeing the police head for the New Jersey Tunnel and run right into trucks transporting toxic waste. The spectacular explosion that follows results in both ends of the tunnel collapsing and the handful of people who survived the explosion are now in peril. Kit Latura is the only man with the skill and knowledge to lead the band of survivors out of the tunnel before the structure collapses.,1996-12-06,6.1,1331,en,15.344
8028,Tourist Trap,"After their car breaks down, a group of young travelers find themselves stranded at a roadside museum run by the mysterious Mr. Slausen and populated by his collection of supernatural mannequins.",1979-03-16,6.1,231,en,7.35
8029,Gerry,Two friends named Gerry become lost in the desert after taking a wrong turn. Their attempts to find their way home only lead them into further trouble.,2002-09-20,6.1,250,en,8.313
8030,Blessed Madness,A man dedicated to religion and very faithful husband suddenly finds himself single. The new shop assistant in his shop will overwhelm his life.,2018-01-11,6.1,365,it,5.364
8034,The Kid Who Would Be King,"Old-school magic meets the modern world when young Alex stumbles upon the mythical sword Excalibur. He soon unites his friends and enemies, and they become knights who join forces with the legendary wizard Merlin. Together, they must save mankind from the wicked enchantress Morgana and her army of supernatural warriors.",2019-01-16,6.1,634,en,15.842
8040,Bring It On: Worldwide #Cheersmack,"\"When Destiny, captain of three-time national champions \"\"The Rebels","\"\" is challenged to a global cheer showdown by an edgy new team called \"\"The Truth","\"\" the Cheer Goddess organizes a virtual battle for squads from all around the world. It seems like the whole world wants to take down Destiny and her team",and they just might succeed,unless Destiny can rise to the challenge,"set her ego aside and figure out who her real friends are.\""
8044,Don't Hang Up,An evening of drunken prank calls becomes a nightmare for a pair of teenagers when a mysterious stranger turns their own game against them.,2016-10-22,6.1,425,en,9.438
8048,Forsaken,"John Henry returns to his hometown in hopes of repairing his relationship with his estranged father, but a local gang is terrorizing the town. John Henry is the only one who can stop them, however he has abandoned both his gun and reputation as a fearless quick-draw killer.",2015-09-16,6.1,294,en,12.453
8067,The Paramedic,"Unable to face his new reality in a wheelchair, Ángel develops a deadly obsession with the woman who left him and unleashes a sinister revenge plot.",2020-09-16,6.1,545,es,11.126
8086,Willard,"Desperate for companionship, the repressed Willard befriends a group of rats that inhabit his late father's deteriorating mansion. In these furry creatures, Willard finds temporary refuge from daily abuse at the hands of his bedridden mother and his father's old partner, Frank. Soon it becomes clear that the brood of rodents is ready and willing to exact a vicious, deadly revenge on anyone who dares to bully their sensitive new master.",2003-03-14,6.1,266,en,5.966
8110,Hotel for Dogs,"Placed in a foster home that doesn't allow pets, 16-year-old Andi and her younger brother, Bruce, turn an abandoned hotel into a home for their dog. Soon other strays arrive, and the hotel becomes a haven for every orphaned canine in town. But the kids have to do some quick thinking to keep the cops off their tails.",2009-01-16,6.1,779,en,11.731
8128,The Secrets We Keep,"In post-World War II America, a woman, rebuilding her life in the suburbs with her husband, kidnaps her neighbor and seeks vengeance for the heinous war crimes she believes he committed against her.",2020-09-16,6.1,202,en,8.103
8136,Mars Needs Moms,"When Martians suddenly abduct his mom, mischievous Milo rushes to the rescue and discovers why all moms are so special.",2011-03-09,6.1,599,en,18.526
8155,Let Me Introduce You To Sofia,"Gabriele is a divorced dad who owns a music store and is completely focused on taking care of his 10-year-old daughter Soﬁa who spends time with both parents. One day he bumps into his old friend Mara who - for the ﬁrst time since his separation - reignites his desire to be in a relationship. There is only one problem, Mara hates children!",2018-10-31,6.1,239,it,4.602
8192,Police Academy 2: Their First Assignment,"Officer Carey Mahoney and his cohorts have finally graduated from the Police Academy and are about to hit the streets on their first assignment. Question is, are they ready to do battle with a band of graffiti-tagging terrorists? Time will tell, but don't sell short this cheerful band of doltish boys in blue.",1985-03-28,6.0,1295,en,27.086
8213,Attack on Titan II: End of the World,"Eren Yeager leaves to restore a break in the wall destroyed by a Titan. He comes under attack by the Titans and is cornered. Shikishima comes to his aid. The titans never stops attacking.  Eren is now injured and tries to protect Armin, but is swallowed by a titan. A Titan with black hair appears and begins to expel the other titans.",2015-09-01,6.0,258,ja,43.921
8221,God's Not Dead,"After he refuses to disavow his faith, a devout Christian student must prove the existence of God or else his college philosophy professor will fail him.",2014-03-21,6.0,793,en,26.441
8232,Sleepwalkers,"Charles Brady and his mother, Mary, are the last of a dying breed whose needs are not of this world.  They are Sleepwalkers - able to stay alive only by feeding on the life-force of the innocent, but destined to roam the earth, avoiding discovery while searching for their next victim.  That search takes them to the sleepy little town of Travis, Indiana, where beautiful teenager Tanya Robertson is about to become an unwilling pawn in their nightmarish fight for survival.",1992-04-10,6.0,438,en,14.061
8255,Tracers,"Wanted by the mafia, a New York City bike messenger escapes into the world of parkour after meeting a beautiful stranger.",2015-01-15,6.0,998,en,28.603
8286,XOXO,"XOXO follows six strangers whose lives collide in one frenetic, dream-chasing, hopelessly romantic night.",2016-08-26,6.0,563,en,14.183
8308,Love Is in the Air,"Antoine is a lawyer living in New York. On his way back to France for the final round of a job interview, Antoine finds himself sitting right next to his ex-girlfriend Julie. With a seven-hour flight ahead of them, they are going to have to speak to each other.",2013-04-02,6.0,369,fr,10.72
8316,Cleaner,"Single father and former cop Tom Cutler has an unusual occupation: he cleans up death scenes. But when he's called in to sterilize a wealthy suburban residence after a brutal shooting, Cutler is shocked to learn he may have unknowingly erased crucial evidence, entangling himself in a dirty criminal cover-up.",2007-09-11,6.0,690,en,11.61
