4889,X+Y,A socially awkward teenage math prodigy finds new confidence and new friendships when he lands a spot on the British squad at the International Mathematics Olympiad.,2014-03-13,6.7,492,en,12.674
4892,Ultimate Avengers 2: Rise of the Panther,"Mysterious Wakanda lies in the darkest heart of Africa, unknown to most of the world. An isolated land hidden behind closed borders, fiercely protected by its young king: Black Panther. But when brutal alien invaders attack, the threat leaves Black Panther with no option but to go against the sacred decrees of his people and ask for help from outsiders.",2006-08-08,6.7,244,en,21.663
4899,Tenacious D in The Pick of Destiny,"In Venice Beach, naive Midwesterner JB bonds with local slacker KG and they form the rock band Tenacious D. Setting out to become the world's greatest band is no easy feat, so they set out to steal what could be the answer to their prayers... a magical guitar pick housed in a rock-and-roll museum some 300 miles away.",2006-11-22,6.7,1353,en,16.963
4909,Moebius,"A wife, overwhelmed with hatred for her husband, inflicts an unspeakable wound on their son, as the family heads towards horrific destruction.",2013-09-05,6.7,201,ko,8.292
4910,Enough Said,"Eva is a divorced soon-to-be empty-nester wondering about her next act. Then she meets Marianne, the embodiment of her perfect self. Armed with a restored outlook on being middle-aged and single, Eva decides to take a chance on her new love interest Albert — a sweet, funny and like-minded man. But things get complicated when Eva discovers that Albert is in fact the dreaded ex–husband of Marianne...",2013-09-18,6.7,705,en,10.118
4914,Mission: Impossible III,"Retired from active duty to train new IMF agents, Ethan Hunt is called back into action to confront sadistic arms dealer, Owen Davian. Hunt must try to protect his girlfriend while working with his new team to complete the mission.",2006-04-25,6.7,5749,en,35.052
4918,A Late Quartet,"When the beloved cellist of a world-renowned string quartet is diagnosed with a life threatening illness, the group's future suddenly hangs in the balance as suppressed emotions, competing egos and uncontrollable passions threaten to derail years of friendship and collaboration. As they are about to play their 25th anniversary concert — quite possibly their last — only their intimate bond and the power of music can preserve their legacy.",2012-11-02,6.7,202,en,8.808
4919,Troll Hunter,"A group of students investigates a series of mysterious bear killings, but learns that there are much more dangerous things going on. They start to follow a mysterious hunter, learning that he is actually a troll hunter.",2010-10-29,6.7,1380,nb,14.829
4937,The Vanishing of Sidney Hall,"Over the course of 12 years, and three stages of life, Sidney Hall falls in love, writes the book of a generation and then disappears without a trace.",2018-03-02,6.7,216,en,8.857
4948,Mr. Morgan's Last Love,A widowed professor living in Paris develops a special relationship with a younger French woman.,2013-08-22,6.7,238,en,8.487
4951,Joseph: King of Dreams,"In this animated retelling of the story from the Bible's Book of Genesis, Joseph's gift of dream interpretation and his brilliantly colored coat inspires jealousy in his brothers.",2000-11-07,6.7,849,en,42.523
4958,Overlord,"France, June 1944. On the eve of D-Day, some American paratroopers fall behind enemy lines after their aircraft crashes while on a mission to destroy a radio tower in a small village near the beaches of Normandy. After reaching their target, the surviving paratroopers realise that, in addition to fighting the Nazi troops that patrol the village, they also must fight against something else.",2018-11-01,6.7,2501,en,23.875
4961,King of New York,A former drug lord returns from prison determined to wipe out all his competition and distribute the profits of his operations to New York's poor and lower classes in this stylish and ultra violent modern twist on Robin Hood.,1990-07-18,6.7,523,en,10.883
4963,Tag,"For one month every year, five highly competitive friends hit the ground running in a no-holds-barred game of tag they’ve been playing since the first grade. This year, the game coincides with the wedding of their only undefeated player, which should finally make him an easy target. But he knows they’re coming...and he’s ready.",2018-05-30,6.7,2727,en,22.649
4964,The Devil's Double,A chilling vision of the House of Saddam Hussein comes to life through the eyes of the man who was forced to become the double of Hussein's sadistic son.,2011-02-11,6.7,487,en,10.138
4978,Team America: World Police,"Team America World Police follows an international police force dedicated to maintaining global stability. Learning that dictator Kim Jong il is out to destroy the world, the team recruits Broadway star Gary Johnston to go undercover. With the help of Team America, Gary manages to uncover the plan to destroy the world. Will Team America be able to save it in time? It stars… Samuel L Jackson, Tim Robbins, Sean Penn, Michael Moore, Helen Hunt, Matt Damon, Susan Sarandon, George Clooney, Danny Glover, Ethan Hawke, Alec Baldwin… or does it?",2004-10-10,6.7,1595,en,12.907
4981,Chances Are,"Louie Jeffries is happily married to Corinne. On their first anniversary, Louie is killed crossing the road. Louie is reincarnated as Alex Finch, and twenty years later, fate brings Alex and Louie's daughter, Miranda, together. It's not until Alex is invited to Louie's home that he begins to remember his former life, wife and best friend. Of course, there's also the problem that he's attracted to Louie's/his own daughter.",1989-03-10,6.7,232,en,11.117
4996,Ma Rainey's Black Bottom,Tensions rise when the trailblazing Mother of the Blues and her band gather at a Chicago recording studio in 1927. Adapted from August Wilson's play.,2020-11-25,6.7,1001,en,12.712
5000,Tag,"High school student Mitsuko navigates a series of bizarre alternate realities, each ending in bloody carnage.",2015-05-11,6.7,276,ja,11.329
5004,Lethal Weapon 3,"Archetypal buddy cops Riggs and Murtaugh are back for another round of high-stakes action, this time setting their collective sights on bringing down a former Los Angeles police lieutenant turned black market weapons dealer. Lorna Cole joins as the beautiful yet hardnosed internal affairs sergeant who catches Riggs's eye.",1992-05-15,6.7,2480,en,20.645
5022,The Transporter,"Former Special Forces officer, Frank Martin will deliver anything to anyone for the right price, and his no-questions-asked policy puts him in high demand. But when he realizes his latest cargo is alive, it sets in motion a dangerous chain of events. The bound and gagged Lai is being smuggled to France by a shady American businessman, and Frank works to save her as his own illegal activities are uncovered by a French detective.",2002-10-02,6.7,4651,en,33.448
5034,The Resistance Banker,"In the occupied Netherlands during World War II, banker Walraven van Hall is asked to use his financial contacts to help the Dutch resistance. With his brother Gijs, he comes up with a risky plan to take out huge loans and use the money to finance the Resistance.",2018-03-08,6.7,209,nl,11.126
5050,Hysteria,"Two doctors in Victorian England use manual stimulation of female genitalia to cure their patients' ills, leading to the invention of the vibrator.",2011-06-06,6.7,732,en,12.962
5052,Ice Age: The Meltdown,"Diego, Manny and Sid return in this sequel to the hit animated movie Ice Age. This time around, the deep freeze is over, and the ice-covered earth is starting to melt, which will destroy the trio's cherished valley. The impending disaster prompts them to reunite and warn all the other beasts about the desperate situation.",2006-03-29,6.7,8758,en,62.596
5063,Inferno,A young man returns from Rome to his sister's satanic New York apartment house.,1980-02-07,6.7,497,it,9.611
5069,May God Save Us,"Madrid, summer 2011. Economic crisis. 15-M movement and 1.5 million pilgrims waiting for the Pope’s arrival live side by side in a Madrid that’s hotter and more chaotic than ever. In this context, detectives Velarde and Alfaro must find what seems to be a serial killer. Their against-the-clock hunt will make them realise something they’d never imagined: neither of them are so very different from the killer.",2016-10-28,6.7,372,es,9.265
5070,A Family Man,"Dane Jensen is a driven, Chicago-based headhunter, working at a cut-throat job placement firm. When Dane's boss announces his retirement, he pits Dane against Lynn Vogel, Dane's equally driven but polar-opposite rival at the firm, in a battle for control over the company.",2017-05-18,6.7,445,en,10.554
5076,Dolittle,"After losing his wife seven years earlier, the eccentric Dr. John Dolittle, famed doctor and veterinarian of Queen Victoria’s England, hermits himself away behind the high walls of Dolittle Manor with only his menagerie of exotic animals for company. But when the young queen falls gravely ill, a reluctant Dolittle is forced to set sail on an epic adventure to a mythical island in search of a cure, regaining his wit and courage as he crosses old adversaries and discovers wondrous creatures.",2020-01-02,6.7,3209,en,38.95
5084,Better Watch Out,"On a quiet suburban street tucked within a 'safe neighborhood', a babysitter must defend a twelve-year-old boy from strangers breaking into the house, only to discover that this is far from a normal home invasion.",2017-10-06,6.7,1263,en,18.6
5087,Hamlet,"Hamlet, Prince of Denmark, finds out that his uncle Claudius killed his father to obtain the throne, and plans revenge.",1990-12-19,6.7,358,en,11.313
5090,The Cellar,"When Keira Woods' daughter mysteriously vanishes in the cellar of their new house in the country, she soon discovers there is an ancient and powerful entity controlling their home that she will have to face or risk losing her family's souls forever.",2022-03-25,6.7,356,en,49.152
5113,Behind the Candelabra,"Based on the autobiographical novel, the tempestuous 6-year relationship between Liberace and his (much younger) lover, Scott Thorson, is recounted.",2013-05-26,6.7,685,en,8.723
5120,Child's Play,"A single mother gives her son a beloved doll for his birthday, only to discover that it is possessed by the soul of a serial killer.",1988-11-09,6.7,2467,en,40.97
5121,Demolition Man,"Simon Phoenix, a violent criminal cryogenically frozen in 1996, escapes during a parole hearing in 2032 in the utopia of San Angeles. Police are incapable of dealing with his violent ways and turn to his captor, who had also been cryogenically frozen after being wrongfully accused of killing 30 innocent people while apprehending Phoenix.",1993-10-08,6.7,3140,en,24.232
5152,Dumbo,"A young elephant, whose oversized ears enable him to fly, helps save a struggling circus, but when the circus plans a new venture, Dumbo and his friends discover dark secrets beneath its shiny veneer.",2019-03-27,6.7,3950,en,19.855
5159,The Hunt,"Twelve strangers wake up in a clearing. They don't know where they are—or how they got there. In the shadow of a dark internet conspiracy theory, ruthless elitists gather at a remote location to hunt humans for sport. But their master plan is about to be derailed when one of the hunted turns the tables on her pursuers.",2020-03-11,6.7,2653,en,28.667
5160,Godard Mon Amour,"In 1967, during the making of “La Chinoise,” film director Jean-Luc Godard falls in love with 19-year-old actress Anne Wiazemsky and marries her.",2017-06-24,6.7,312,fr,7.443
5162,Julia's Eyes,The story of a woman who is slowly losing her sight whilst trying to investigate the mysterious death of her twin sister.,2010-10-29,6.7,685,es,13.66
5164,Saint Maud,"Having recently found God, self-effacing young nurse Maud arrives at a plush home to care for Amanda, a hedonistic dancer left frail from a chronic illness. When a chance encounter with a former colleague throws up hints of a dark past, it becomes clear there is more to sweet Maud than meets the eye.",2020-10-09,6.7,527,en,13.442
5166,The Holiday Calendar,A talented photographer stuck in a dead-end job inherits an antique Advent calendar that may be predicting the future -- and pointing her toward love.,2018-11-02,6.7,961,en,9.566
5194,The Grand Seduction,"A small fishing village must procure a local doctor to secure a lucrative business contract. When unlikely candidate and big city doctor Paul Lewis lands in their lap for a trial residence, the townsfolk rally together to charm him into staying. As the doctor’s time in the village winds to a close, acting mayor Murray French has no choice but to pull out all the stops and begin The Grand Seduction.",2014-05-30,6.7,262,en,7.604
5203,Stoker,"After India's father dies, her Uncle Charlie, who she never knew existed, comes to live with her and her unstable mother. She comes to suspect this mysterious, charming man has ulterior motives and becomes increasingly infatuated with him.",2013-02-28,6.7,1998,en,13.422
5209,Infinitely Polar Bear,"A manic-depressive mess of a father tries to win back his wife by attempting to take full responsibility of their two young, spirited daughters, who don't make the overwhelming task any easier.",2014-01-18,6.7,334,en,7.924
5218,He's All That,"To get revenge on her ex-boyfriend, an influencer attempts to transform an unpopular classmate into prom king.",2021-08-27,6.7,1135,en,26.926
5219,Flowers in the Attic,"After the sudden death of their father, four children face cruel treatment from their ruthless grandmother.",2014-01-18,6.6,323,en,12.739
5223,Before Night Falls,"Spanning several decades, this powerful biopic offers a glimpse into the life of famed Cuban poet and novelist Reinaldo Arenas, an artist who was vilified for his homosexuality in Fidel Castro's Cuba.",2000-09-03,6.6,235,en,8.128
5235,Beautiful Girls,"During a snowy winter in the small fictional town of Knight's Ridge, Massachusetts, a group of lifelong buddies hang out, drink and struggle to connect with the women who affect their decisions, dreams and desires.",1996-02-09,6.6,303,en,9.991
5244,"As Above, So Below","When a team of explorers ventures into the catacombs that lie beneath the streets of Paris, they uncover the dark secret that lies within this city of the dead.",2014-08-14,6.6,2920,en,37.504
5262,Bring It On: All or Nothing,"A transfer student at a rough high school tries joining the cheer-leading squad and finds that she not only has to face off against the head cheerleader, but also against her former school in preparation for a cheer-off competition.",2006-08-08,6.6,698,en,1.234
5286,The Infiltrator,A U.S Customs official uncovers a massive money laundering scheme involving Pablo Escobar.,2016-07-13,6.6,1486,en,14.683
5302,The Third Murder,"Shigemori is a lawyer tasked with defending Misumi in a murder trial. Misumi has previous convictions for murder and has confessed to the crime, but evidence in the case leads to Shigemori having doubts about what really happened.",2017-09-09,6.6,206,ja,5.973
5319,Veronica Mars,"Years after walking away from her past as a teenage private eye, Veronica Mars gets pulled back to her hometown - just in time for her high school reunion - in order to help her old flame Logan Echolls, who's embroiled in a murder mystery.",2014-03-13,6.6,966,en,6.828
5327,House of Usher,"After a long journey, Philip arrives at the Usher mansion seeking his loved one, Madeline. Upon arriving, however, he discovers that Madeline and her brother Roderick Usher have been afflicted with a mysterious malady: Roderick's senses have become painfully acute, while Madeline has become catatonic. That evening, Roderick tells his guest of an old Usher family curse: any time there has been more than one Usher child, all of the siblings have gone insane and died horrible deaths. As the days wear on, the effects of the curse reach their terrifying climax.",1960-06-22,6.6,242,en,6.677
5348,Not Without My Daughter,"An American woman, trapped in Islamic Iran by her brutish husband, must find a way to escape with her daughter as well.",1991-01-11,6.6,249,en,16.134
5353,Ms .45,"A shy and mute seamstress goes insane after being attacked and raped twice in one day. She wanders the New York streets at night in a sexy black dress with her attacker's gun strapped to her garter belt, blowing away any man who tries to pick her up.",1981-04-24,6.6,269,en,11.418
5365,Tropic Thunder,"Ben Stiller, Jack Black and Robert Downey Jr. lead an ensemble cast in 'Tropic Thunder,' an action comedy about a group of self-absorbed actors who set out to make the most expensive war film. After ballooning costs force the studio to cancel the movie, the frustrated director refuses to stop shooting, leading his cast into the jungles of Southeast Asia, where they encounter real bad guys.",2008-08-09,6.6,5322,en,31.225
5380,The Perfect Secret,"Seven friends - three women and four men - meet for dinner. Everyone should put their cell phone on the table. No matter what message comes in - anyone can read it and listen to the phone calls. However, this leads to a lot of chaos.",2019-10-31,6.6,210,de,6.433
5387,Fire and Ice,"In this animated tale, a tiny village is destroyed by a surging glacier, which serves as the deadly domain for the evil Ice Lord, Nekron. The only survivor is a young warrior, Larn, who vows to avenge this act of destruction. The evil continues, however, as Nekron's palace of ice heads straight towards Fire Keep, the great fortress ruled by the good King Jarol. When Jarol's beautiful daughter, Teegra, is abducted by Nekron's sub-human ape-like creatures, Larn begins a daring search for her. What results is a tense battle between good and evil, surrounded by the mystical elements of the ancient past.",1983-03-25,6.6,217,en,11.311
5389,Phantasm,"A young boy and his friends face off against a mysterious grave robber known only as the Tall Man, who keeps a mysterious arsenal of terrible weapons with him.",1979-03-28,6.6,548,en,9.579
5418,Welcome to the Rileys,"Years after their teenage daughter’s death, Lois and Doug Riley, an upstanding Indiana couple, are frozen by estranging grief. Doug escapes to New Orleans on a business trip. Compelled by urgencies he doesn’t understand, he insinuates himself into the life of an underage hooker, becoming her platonic guardian.",2010-10-29,6.6,351,en,9.271
5444,The Wild Goose Lake,A gangster on the run sacrifices everything for his family and a woman he meets while on the lam.,2019-12-06,6.6,294,zh,8.953
5447,Gold,"Kenny Wells, a modern-day prospector, hustler, and dreamer, is desperate for a lucky break. Left with few options, Wells teams up with an equally luckless geologist to execute a grandiose, last-ditch effort: to find gold deep in the uncharted jungle of Indonesia.",2016-02-03,6.6,1417,en,11.187
5463,[REC]²,"The action continues from [REC], with the medical officer and a SWAT team outfitted with video cameras are sent into the sealed off apartment to control the situation.",2009-09-15,6.6,1734,es,15.173
5465,Blade of the Immortal,"Manji, a highly skilled samurai, becomes cursed with immortality after a legendary battle. Haunted by the brutal murder of his sister, Manji knows that only fighting evil will regain his soul. He promises to help a young girl named Rin avenge her parents, who were killed by a group of master swordsmen led by ruthless warrior Anotsu. The mission will change Manji in ways he could never imagine.",2017-04-29,6.6,448,ja,13.344
5482,Colombiana,"After witnessing her parents’ murder as a child in Bogota, Cataleya Restrepo grows up to be a stone-cold assassin. She works for her uncle as a hitman by day, but her personal time is spent engaging in vigilante murders that she hopes will lead her to her ultimate target: the mobster responsible for her parents' death.",2011-07-27,6.6,2257,en,47.379
5487,Skyfire,"\"Tianhuo Island is a beautiful paradise. It almost makes people forget that it is located in the \"\"Ring of Fire\"\"",the world-famous Pacific Rim volcanic belt. Young geologist Li Xiaomeng brings her team here to develop the first volcanic monitoring system,the Suzaku. Li Xiaomeng's father,Li Wentao,a volcanic expert who has retired for many years,rushes to the crater after learning about it
5501,Radioactive,The story of Nobel Prize winner Marie Curie and her extraordinary scientific discoveries—through the prism of her marriage to husband Pierre—and the seismic and transformative effects their discovery of radium had on the 20th century.,2020-03-11,6.6,681,en,16.546
5525,Scoop,"An American journalism student in London scoops a big story, and begins an affair with an aristocrat as the incident unfurls.",2006-07-27,6.6,1442,en,12.922
5548,Robin Hood: Men in Tights,"Robin Hood comes home after fighting in the Crusades to learn that the noble King Richard is in exile and that the despotic King John now rules England, with the help of the Sheriff of Rottingham. Robin Hood assembles a band of fellow patriots to do battle with King John and the Sheriff.",1993-07-28,6.6,1777,en,22.052
5549,Cut Off,"A coroner finds a capsule in the head of a heavily mutilated corpse, containing a phone number and single word: the name of his daughter.",2018-10-11,6.6,200,de,8.353
5556,The Entity,"Carla Moran, a hard-working single mother,  is raped in her bedroom by someone — or something — that she cannot see. Despite skeptical psychiatrists, she is repeatedly attacked by this invisible force. Could this be a case of hysteria or something more horrific?",1982-09-30,6.6,386,en,13.537
5566,Watcher,"As a serial killer stalks the city, Julia — a young actress who just moved to town with her husband — notices a mysterious stranger watching her from across the street.",2022-06-03,6.6,485,en,109.306
5570,There's Something About Mary,"For Ted, prom night went about as bad as it’s possible for any night to go. Thirteen years later, he finally gets another chance with his old prom date, only to run up against other suitors including the sleazy detective he hired to find her.",1998-07-15,6.6,4396,en,23.718
5571,Side Effects,A woman turns to prescription medication as a way of handling her anxiety concerning her husband's upcoming release from prison.,2013-02-07,6.6,2774,en,10.534
5574,Sex with Love,"In Santiago, Chile, the schoolteacher Luisa proposes a debate about sex with the parents of her students with the intention of giving classes about sex education to the youngsters.",2003-03-27,6.6,223,es,29.861
5585,Welcome to Marwen,"When a devastating attack shatters Mark Hogancamp and wipes away all memories, no one expected recovery. Putting together pieces from his old and new life, Mark meticulously creates a wondrous town named Marwen where he can heal and be heroic. As he builds an astonishing art installation — a testament to the most powerful women he knows — through his fantasy world, he draws strength to triumph in the real one.",2018-12-21,6.6,1033,en,11.296
5595,Miss Potter,"\"Beatrix Potter, the author of the beloved children's book \"\"The Tale of Peter Rabbit\"\"",struggles for love,"happiness and success.\"",2006-12-03,6.6,430
5604,Puss in Boots: The Three Diablos,"Puss in Boots is on a mission to recover the Princess' stolen ruby from the notorious French thief, Whisperer. Reluctantly accompanied by three little kittens, Three Diablos, Puss must tame them before they endanger the mission.",2012-02-07,6.6,393,en,68.535
5609,45 Years,"There is just one week until Kate Mercer's 45th wedding anniversary and the planning for the party is going well. But then a letter arrives for her husband. The body of his first love has been discovered, frozen and preserved in the icy glaciers of the Swiss Alps. By the time the party is upon them, five days later, there may not be a marriage left to celebrate.",2015-08-04,6.6,661,en,7.896
5625,Flawless,"A female executive and a night janitor conspire to commit a daring diamond heist from their mutual employer, The London Diamond Corporation.",2007-09-01,6.6,426,en,12.531
5633,Short Circuit,"After a lightning bolt zaps a robot named Number 5, the lovable machine starts to think he's human and escapes the lab. Hot on his trail is his designer, Newton, who hopes to get to Number 5 before the military does. In the meantime, a spunky animal lover mistakes the robot for an alien and takes him in, teaching her new guest about life on Earth.",1986-05-09,6.6,1262,en,16.062
5637,Sudden Impact,"When a young rape victim takes justice into her own hands and becomes a serial killer, it's up to Dirty Harry Callahan, on suspension from the SFPD, to bring her to justice.",1983-12-07,6.6,739,en,13.145
5639,A Royal Night Out,"The re-imagining of VE Day in 1945, when Princess Elizabeth and her sister, Margaret were allowed out from Buckingham Palace for the night to join in the celebrations, and encounter romance and danger.",2015-05-14,6.6,270,en,7.409
5657,Ideal Home,A couple is going through marital troubles made worse when a previously unknown grandson shows up.,2018-06-21,6.6,223,en,8.4
5664,Doodlebug,"In his squalid apartment, a man tries to squash with his shoe an insect of some kind that is moving around the room.",1997-01-01,6.6,395,en,5.751
5667,Ocean's Twelve,"Danny Ocean reunites with his old flame and the rest of his merry band of thieves in carrying out three huge heists in Rome, Paris and Amsterdam – but a Europol agent is hot on their heels.",2004-12-09,6.6,6419,en,25.641
5678,Love and Bullets,"A Camorra boss fakes his own death in order to start a new life elsewhere with his family, but a nurse happens to see him alive and well after the funeral. A hitman is promptly sent to get rid of her, only to find out that she's his first and unforgotten love. He decides to protect her, becoming himself a target.",2017-08-01,6.6,242,it,5.105
