7182,The Cheetah Girls 2,"\"Best friends Galleria, Chanel, Dorinda, and Aqua, A.K.A. the girl band \"\"The Cheetahs","\"\" get the opportunity of a lifetime when they strut their way to Barcelona",Spain,to perform in an international music festival. Along the way,"the \"\"amigas Cheetahs\"\" learn that",although their paths are not the same
7183,Friday After Next,"Craig and his cousin Day Day have finally moved out of their parents' houses and into their own crib, working nights at a local mall as security guards. When their house is robbed on Christmas Eve they set out to track down the culprit.",2002-11-22,6.3,339,en,11.534
7186,Loving Pablo,The film chronicles the rise and fall of the world's most feared drug lord Pablo Escobar and his volatile love affair with Colombia's most famous journalist Virginia Vallejo throughout a reign of terror that tore a country apart.,2017-10-12,6.3,913,es,21.962
7202,Mercury Rising,"\"Renegade FBI agent Art Jeffries protects a nine-year-old autistic boy who has cracked the government's new \"\"unbreakable\"\" code.\"",1998-04-03,6.3,1330,en,14.28
7221,Live by Night,"A group of Boston-bred gangsters set up shop in balmy Florida during the Prohibition era, facing off against the competition and the Ku Klux Klan.",2016-12-25,6.2,1174,en,13.554
7226,Falcon Rising,"Chapman is an ex-marine in Brazil's slums, battling the yakuza outfit who attacked his sister and left her for dead.",2014-09-05,6.2,298,en,15.288
7245,Bride Wars,Two best friends become rivals when their respective weddings are accidentally booked for the same day.,2009-01-09,6.2,2734,en,25.203
7248,Mama,"Guillermo del Toro presents Mama, a supernatural thriller that tells the haunting tale of two little girls who disappeared into the woods the day that their parents were killed. When they are rescued years later and begin a new life, they find that someone or something still wants to come tuck them in at night.",2013-01-17,6.2,3771,en,25.088
7251,Beauty Shop,"Far from Chicago, hairdresser Gina Norris has relocated to Atlanta with her daughter and has quickly established herself as a rare talent in her profession. But after repeatedly butting heads with her shady, over-the-top boss, Jorge, Norris sets out to create her own salon -- even snagging a few of Jorge's employees and clients. Now, Jorge will do anything to shut her down.",2005-04-22,6.2,431,en,12.362
7259,Man Down,"When a U.S. Marine returns home from Afghanistan, he finds that the place he once called home is no better than the battlefields he fought on overseas. Accompanied by his best friend, he searches desperately for the whereabouts of his estranged son and wife. In their search, the two intercept a man carrying vital information about his family.",2015-09-12,6.2,224,en,11.732
7270,Death Wish II,Paul Kersey is again a vigilante trying to find five punks who murdered his housekeeper and daughter in Los Angeles.,1982-02-20,6.2,361,en,13.36
7277,Unlocked,"After failing to apprehend the terrorist behind a Paris attack that claimed dozens of lives, CIA agent Alice Racine is forced to live in London as a caseworker. Her mentor unexpectedly calls her back into action when the CIA discovers that another attack is imminent. Alice soon learns that the classified information she's uncovered has been compromised...",2017-04-27,6.2,944,en,16.767
7302,Ride Along,"For the past two years, high-school security guard Ben has been trying to show decorated APD detective James that he's more than just a video-game junkie who's unworthy of James' sister, Angela. When Ben finally gets accepted into the academy, he thinks he's earned the seasoned policeman's respect and asks for his blessing to marry Angela. Knowing that a ride along will demonstrate if Ben has what it takes to take care of his sister, James invites him on a shift designed to scare the hell out of the trainee. But when the wild night leads them to the most notorious criminal in the city, James will find that his new partner's rapid-fire mouth is just as dangerous as the bullets speeding at it.",2014-01-07,6.2,2011,en,16.562
7308,Hannibal Rising,"The story of the early, murderous roots of the cannibalistic killer, Hannibal Lecter – from his hard-scrabble Lithuanian childhood, where he witnesses the repulsive lengths to which hungry soldiers will go to satiate themselves, through his sojourn in France, where as a med student he hones his appetite for the kill.",2007-02-06,6.2,1913,en,4.519
7323,This Is the End,"While attending a party at James Franco's house, Seth Rogen, Jay Baruchel and many other celebrities are faced with the apocalypse.",2013-06-12,6.2,5719,en,22.753
7340,The Twilight Saga: Eclipse,"Bella once again finds herself surrounded by danger as Seattle is ravaged by a string of mysterious killings and a malicious vampire continues her quest for revenge. In the midst of it all, she is forced to choose between her love for Edward and her friendship with Jacob, knowing that her decision has the potential to ignite the ageless struggle between vampire and werewolf. With her graduation quickly approaching, Bella is confronted with the most important decision of her life.",2010-06-23,6.2,7958,en,101.763
7346,Black Butterfly,"Paul is a down-on-his-luck screenwriter who picks up a drifter and offers him a place to stay. However, when the deranged stranger takes Paul hostage and forces him to write, their unhinged relationship brings buried secrets to light.",2017-05-26,6.2,468,en,9.636
7349,(T)Raumschiff Surprise - Periode 1,"Hundreds of years after humans have settled on Mars, Regulator Rogul and Lord Jens Maul, lead a force of Martians to Earth in order to conquer the planet. Queen Metaphor looks to the gay heroes aboard the spaceship Surprise -- Captain Kork, Mr. Spuck, and first engineer Schrotty",2004-07-14,6.2,431,de,9.078
7353,Rifkin's Festival,"The story of a married American couple who go to the San Sebastian Film Festival. They get caught up in the magic of the festival, the beauty and charm of Spain and the fantasy of movies. She has an affair with a brilliant French movie director, and he falls in love with a beautiful Spanish woman who lives there.",2020-10-01,6.2,370,en,7.097
7354,Midnight Special,A father and son go on the run after the dad learns his child possesses special powers.,2016-02-12,6.2,1694,en,13.095
7362,The Hangover Part III,"This time, there's no wedding. No bachelor party. What could go wrong, right? But when the Wolfpack hits the road, all bets are off.",2013-05-23,6.2,7780,en,56.752
7377,Fright Night,"A teenager suspects his new neighbour is a vampire. Unable to convince anyone, he tries to enlist the help of a self-proclaimed vampire hunter and magician.",2011-08-18,6.2,1694,en,14.602
7382,In The Mix,"A successful DJ named Darrel (Usher), managed to rescue a powerful mobster one night. In order to repay Darrell, the mobster, Frank Pacelli, gives him the task of protecting his daughter, Dolly (Chriqui)",2005-11-23,6.2,260,en,7.635
7397,American Pie 2,"After a year apart - attending different schools, meeting different people - the guys rent a beach house and vow to make this the best summer ever. As it turns out, whether that will happen or not has a lot to do with the girls. Between the wild parties, outrageous revelations and yes, a trip to band camp, they discover that times change and people change, but in the end, it's all about sticking together.",2001-08-10,6.2,4363,en,44.229
7426,The Outcasts,"After falling victim to a humiliating prank by the high school Queen Bee, best friends and world-class geeks, Mindy and Jodi, decide to get their revenge by uniting the outcasts of the school against her and her circle of friends.",2017-04-14,6.2,468,en,9.101
7437,1492: Conquest of Paradise,1492: Conquest of Paradise depicts Christopher Columbus’ discovery of The New World and his effect on the indigenous people.,1992-10-09,6.2,703,en,12.878
7439,The Upside of Anger,"After her husband runs off with his secretary, Terry Wolfmeyer is left to fend for herself -- and her four daughters. As she hits rock bottom, Terry finds a friend and drinking buddy in next-door neighbor Denny, a former baseball player. As the two grow closer, and her daughters increasingly rely on Denny, Terry starts to have reservations about where their relationship is headed.",2005-01-23,6.2,218,en,10.665
7444,Mighty Joe Young,"As a child living in Africa, Jill Young saw her mother killed while protecting wild gorillas from poachers led by Andrei Strasser. Now an adult, Jill cares for an orphaned gorilla named Joe -- who, due to a genetic anomaly, is 15 feet tall. When Gregg O'Hara arrives from California and sees the animal, he convinces Jill that Joe would be safest at his wildlife refuge. But Strasser follows them to the U.S., intent on capturing Joe for himself.",1998-12-25,6.2,710,en,11.232
7447,Billy Madison,"Billy Madison is the 27 year-old son of Bryan Madison, a very rich man who has made his living in the hotel industry. Billy stands to inherit his father's empire, but only if he can make it through all 12 grades, 2 weeks per grade, to prove that he has what it takes to run the family business.",1995-02-10,6.2,1388,en,18.817
7455,Taking Woodstock,"The story of Elliot Tiber and his family, who inadvertently played a pivotal role in making the famed Woodstock Music and Arts Festival into the happening that it was. When Elliot hears that a neighboring town has pulled the permit on a hippie music festival, he calls the producers thinking he could drum up some much-needed business for his parents' run-down motel. Three weeks later, half a million people are on their way to his neighbor’s farm in White Lake, New York, and Elliot finds himself swept up in a generation-defining experience that would change his life–and American culture–forever.",2009-08-26,6.2,369,en,12.098
7461,The Prom,"After the PTA of a conservative high school in Indiana bans same-sex couples from attending the annual prom, a gang of flamboyant Broadway stars try to boost their image by showing up to support two lesbian students.",2020-12-02,6.2,612,en,7.431
7473,Beauty and the Beast: The Enchanted Christmas,"Astonished to find the Beast has a deep-seeded hatred for the Christmas season, Belle endeavors to change his mind on the matter.",1997-11-11,6.2,881,en,22.378
7484,Addicted to Love,"Good-natured astronomer Sam is devastated when the love of his life leaves him for a suave Frenchman. He therefore does what every other normal dumpee would do — go to New York and set up home in the abandoned building opposite his ex-girlfriend's apartment, wait until she decides to leave her current lover, and then win her back.",1997-05-23,6.2,350,en,12.297
7496,Just Friends,"While visiting his hometown during Christmas, a man comes face-to-face with his old high school crush whom he was best friends with – a woman whose rejection of him turned him into a ferocious womanizer.",2005-11-23,6.2,1397,en,17.647
7519,Centurion,"Britain, A.D. 117. Quintus Dias, the sole survivor of a Pictish raid on a Roman frontier fort, marches north with General Virilus' legendary Ninth Legion, under orders to wipe the Picts from the face of the Earth and destroy their leader, Gorlacon.",2010-02-15,6.2,1218,en,16.068
7521,Candy Jar,Dueling high school debate champs who are at odds on just about everything forge ahead with ambitious plans to get into the colleges of their dreams.,2018-04-27,6.2,460,en,9.884
7522,Fuochi d'artificio,"Ottone, a professional dog sitter who's uncertain about most things in life, asks an analyst if he made the right decision love-wise while recounting the significant relationships he had with four women.",1997-10-10,6.2,208,it,6.219
7525,Final Fantasy: The Spirits Within,"Led by a strange dream, scientist Aki Ross struggles to collect the eight spirits in the hope of creating a force powerful enough to protect the planet. With the aid of the Deep Eyes Squadron and her mentor, Dr. Sid, Aki must save the Earth from its darkest hate and unleash the spirits within.",2001-07-02,6.2,1277,en,13.867
7529,Would I Lie to You? 2,"Eddie, Dov, and Yvan are back, still working in Paris' Sentier textile district, This time they're confronting the high-stakes world of large distribution after striking a deal with Eurodiscount, a European hypermarket chain.",2001-02-07,6.2,345,fr,5.211
7543,The Prince & Me,"\"A fairy tale love-story about pre-med student Paige who falls in love with a Danish Prince \"\"Eddie\"\" who refused to follow the traditions of his parents and has come to the US to quench his thirst for rebellion. Paige and Edward come from two different worlds","but there is an undeniable attraction between them.\"",2004-03-28,6.2,892,en
7559,Funny Farm,"Sportswriter Andy Farmer moves with his schoolteacher wife Elizabeth to the country in order to write a novel in relative seclusion. Of course, seclusion is the last thing the Farmers find in the small, eccentric town, where disaster awaits them at every turn.",1988-06-03,6.2,216,en,6.765
7567,Entrapment,"Two thieves, who travel in elegant circles, try to outsmart each other and, in the process, end up falling in love.",1999-04-29,6.2,1723,en,17.529
7599,Cadet Kelly,Hyperactive teenager Kelly is enrolled into a military school when her new stepfather becomes the Commandant. At first she has problems fitting in and taking orders until she tries out for the drill team.,2005-08-17,6.2,530,en,11.493
7614,Blood Father,An ex-con reunites with his estranged wayward 16-year old daughter to protect her from drug dealers who are trying to kill her.,2016-08-11,6.2,1364,en,34.879
7635,Mortal Engines,"Many thousands of years in the future, Earth’s cities roam the globe on huge wheels, devouring each other in a struggle for ever diminishing resources. On one of these massive traction cities, the old London, Tom Natsworthy has an unexpected encounter with a mysterious young woman from the wastelands who will change the course of his life forever.",2018-11-27,6.2,4063,en,33.569
7638,We Can Be Heroes,"When alien invaders capture Earth's superheroes, their kids must learn to work together to save their parents - and the planet.",2020-12-25,6.2,658,en,31.305
7640,Stretch,A hard-luck limo driver struggling to go straight and pay off a debt to his bookie takes on a job with a crazed passenger whose sought-after ledger implicates some seriously dangerous criminals.,2014-10-14,6.2,565,en,8.63
7663,After the Sunset,"An FBI agent is suspicious of two master thieves, quietly enjoying their retirement near what may - or may not - be the biggest score of their careers.",2004-11-12,6.2,644,en,16.481
7668,"Yours, Mine & Ours","Admiral Frank Beardsley returns to New London to run the Coast Guard Academy, his last stop before a probable promotion to head the Guard. A widower with eight children, he runs a loving but tight ship, with charts and salutes. The kids long for a permanent home. Helen North is a free spirit, a designer whose ten children live in loving chaos, with occasional group hugs. Helen and Frank, high school sweethearts, reconnect at a reunion, and it's love at first re-sighting. They marry on the spot. Then the problems start as two sets of kids, the free spirits and the disciplined preppies, must live together. The warring factions agree to work together to end the marriage.",2005-11-23,6.2,741,en,12.738
7675,Just Cause,A Harvard professor is lured back into the courtroom after twenty-five years to take the case of a young black man condemned to death for the horrific murder of a child.,1995-02-17,6.2,423,en,10.546
7699,The Inbetweeners 2,"Neil, Will and Simon receive an invite from Jay to join him in Australia whilst on his gap year, who promises them it’s ”the sex capital of the world”. With their lives now rather dull compared to their hedonistic school days and legendary lads holiday, it’s an offer they can’t refuse. Once again, they put growing up temporarily on-hold, and embark on a backpacking holiday of a lifetime in an awful car, inspired by Peter Andre’s ‘Mysterious Girl’. Will soon finds himself battling with the lads to do something cultural, whilst they focus their attention on drinking, girls, and annoying fellow travelers.",2014-08-06,6.1,422,en,6.852
7706,Conquest of the Planet of the Apes,"In a futuristic world that has embraced ape slavery, a chimpanzee named Caesar resurfaces after almost twenty years of hiding from the authorities, and prepares for a revolt against humanity.",1972-06-29,6.1,756,en,14.994
7711,Palo Alto,"Shy, sensitive April is the class virgin, torn between an illicit flirtation with her soccer coach Mr. B and an unrequited crush on sweet stoner Teddy. Emily, meanwhile, offers sexual favors to every boy to cross her path — including both Teddy and his best friend Fred, a live wire without filters or boundaries. As one high school party bleeds into the next — and April and Teddy struggle to admit their mutual affection — Fred's escalating recklessness starts to spiral into chaos.",2013-12-29,6.1,785,en,11.485
7783,Earthquake,"Various interconnected people struggle to survive when an earthquake of unimaginable magnitude hits Los Angeles, California.",1974-01-01,6.1,266,en,11.183
7784,Harlem Nights,"'Sugar' Ray is the owner of an illegal casino and must contend with the pressure of vicious gangsters and corrupt police who want to see him go out of business. In the world of organised crime and police corruption in the 1920s, any dastardly trick is fair.",1989-11-17,6.1,257,en,11.653
7799,Paper Towns,"Quentin Jacobsen has spent a lifetime loving the magnificently adventurous Margo Roth Spiegelman from afar. So when she cracks open a window and climbs back into his life-dressed like a ninja and summoning him for an ingenious campaign of revenge-he follows. After their all-nighter ends and a new day breaks, Q arrives at school to discover that Margo, always an enigma, has now become a mystery. But Q soon learns that there are clues-and they're for him. Urged down a disconnected path, the closer he gets, the less Q sees of the girl he thought he knew.",2015-06-18,6.1,4804,en,13.737
7801,Session 9,Tensions rise within an asbestos cleaning crew as they work in an abandoned mental hospital with a horrific past that seems to be coming back.,2001-08-10,6.1,767,en,9.451
7803,Dick Tracy,The comic strip detective finds his life vastly complicated when Breathless Mahoney makes advances towards him while he is trying to battle Big Boy Caprice's united mob.,1990-04-05,6.1,798,en,10.697
7810,Don't Tell Mom the Babysitter's Dead,"Sue Ellen Crandell is a teenager eagerly awaiting her mother's summer-long absence. While the babysitter looks after her rambunctious younger siblings, Sue Ellen can party and have fun. But then the babysitter abruptly dies, leaving the Crandells short on cash. Sue Ellen finds a sweet job in fashion by lying about her age and experience on her résumé. But, while her siblings run wild, she discovers the downside of adulthood",1991-06-07,6.1,350,en,12.072
7817,Carrie,"Carrie White is a lonely and painfully shy teenage girl with telekinetic powers who is slowly pushed to the edge of insanity by frequent bullying from both classmates at her school, and her own religious, but abusive, mother.",2002-11-04,6.1,401,en,26.394
7818,The Weather Man,"A Chicago weather man, separated from his wife and children, debates whether professional and personal success are mutually exclusive.",2005-10-20,6.1,833,en,9.272
7827,Night at the Museum: Battle of the Smithsonian,"Hapless museum night watchman Larry Daley must help his living, breathing exhibit friends out of a pickle now that they've been transferred to the archives at the Smithsonian Institution. Larry's (mis)adventures this time include close encounters with Amelia Earhart, Abe Lincoln and Ivan the Terrible.",2009-05-20,6.1,6186,en,31.284
7837,My Life in Ruins,"A Greek tour guide named Georgia attempts to recapture her kefi (Greek for mojo) by guiding a ragtag group of tourists around Greece and showing them the beauty of her native land. Along the way, she manages to open their eyes to the wonders of an exotic foreign land while beginning to see the world through a new set of eyes in the process.",2009-06-05,6.1,354,en,11.453
7841,Last Night,"The story follows a married couple, apart for a night while the husband takes a business trip with a colleague to whom he's attracted. While he's resisting temptation, his wife encounters her past love.",2010-11-05,6.1,665,en,10.774
7847,Beauty and the Beast,"Forced to face the cruel side of life, a devastated, bankrupt merchant chances upon the enchanted castle of a hideous creature, the mere sight of it chills the bone to the marrow. There, a fate worse than death awaits the poor father-of-six, who, after plucking a sweet-scented rose from the repulsive master's verdant garden, must do the impossible: permit his compassionate daughter, Belle, to take his place and pay for the sins of her parent. Now, an impenetrable mystery shrouds the haunted mansion, and, as repugnance gradually turns into affection, only true love could break the spell.",2014-02-12,6.1,1870,fr,24.47
7855,Happiness Never Comes Alone,"Sacha is a real seducer, a man with no ties or emotional or professional. Charlotte is a modern and independent woman, but barely has time to care for their three children. While Sacha and Charlotte are, at first glance, two incompatible beings, when they meet soon discover that they are quite complementary and need each other.",2012-06-27,6.1,393,fr,8.202
7857,BASEketball,"Two losers from Milwaukee, Coop and Remer, invent a new game playing basketball, using baseball rules. When the game becomes a huge success, they, along with a billionaire's help, form the Professional Baseketball League where everyone gets the same pay and no team can change cities. Theirs is the only team standing in the way of major rule changes that the owner of a rival team wants to institute.",1998-07-28,6.1,470,en,8.546
7859,Fatale,"After a one-night stand, a successful married man finds himself entangled and tricked in a female detective's latest investigation murder scheme.",2020-12-18,6.1,259,en,20.215
7861,Anywhere but Here,"Single mother Adele August is bad with money, and even worse when it comes to making decisions. Her straight-laced daughter, Ann, is a successful high school student with Ivy League aspirations. When Adele decides to pack up and move the two of them from the Midwest to Beverly Hills, Calif., to pursue her dreams of Hollywood success, Ann grows frustrated with her mother's irresponsible and impulsive ways.",1999-11-12,6.1,232,en,10.728
7866,The Lodge,"When a father is forced to abruptly depart for work, he leaves his children, Aidan and Mia, at their holiday home in the care of his new girlfriend, Grace. Isolated and alone, a blizzard traps them inside the lodge as terrifying events summon specters from Grace's dark past.",2020-01-16,6.1,1022,en,17.781
7895,Jack Ryan: Shadow Recruit,"Jack Ryan, as a young covert CIA analyst, uncovers a Russian plot to crash the U.S. economy with a terrorist attack.",2014-01-15,6.1,2561,en,30.218
7903,Double Lover,"Chloé, a fragile young woman, falls in love with her psychoanalyst, Paul. A few months later she moves in with him, but soon discovers that her lover is concealing a part of his identity.",2017-05-26,6.1,461,fr,10.142
7904,The Ledge,A thriller in which a battle of philosophies between a fundamentalist Christian and an atheist escalates into a lethal battle of wills.,2011-05-06,6.1,300,en,9.417
7913,The Souvenir,"A shy but ambitious film student falls into an intense, emotionally fraught relationship with a charismatic but untrustworthy older man.",2019-05-17,6.1,209,en,9.478
7921,TMNT,"After the defeat of their old arch nemesis, The Shredder, the Turtles have grown apart as a family. Struggling to keep them together, their rat sensei, Splinter, becomes worried when strange things begin to brew in New York City.",2007-03-23,6.1,937,en,19.151
7946,Cinderella II: Dreams Come True,"As a newly crowned princess, Cinderella quickly learns that life at the Palace - and her royal responsibilities - are more challenging than she had imagined. In three heartwarming tales, Cinderella calls on her animal friends and her Fairy Godmother to help as she brings her own grace and charm to her regal role and discovers that being true to yourself is the best way to make your dreams come true.",2002-02-23,6.1,1257,en,54.112
7959,Hard Target 2,"Forced into a deadly cat-and-mouse game, a disgraced mixed martial arts fighter is hunted through the jungles of Southeast Asia.",2016-07-14,6.1,200,en,21.263
7966,American Son,Time passes and tension mounts in a Florida police station as an estranged interracial couple awaits news of their missing teenage son.,2019-09-12,6.1,202,en,9.38
7968,Meander,"After getting a car ride from an unknown man, Lisa wakes up in a tube. On her arm is strapped a bracelet with a countdown. She quickly understands that every 8 minutes, fire burns an occupied section. She has no choice but to crawl into safe sections to survive. To know why she’s there and how to get out, Lisa will have to face the memories of her dead daughter…",2021-05-26,6.1,344,fr,31.202
7969,Newness,"In contemporary Los Angeles, two millennials navigating a social media–driven hookup culture begin a relationship that pushes both emotional and physical boundaries.",2017-11-03,6.1,552,en,18.549
8002,Chappaquiddick,"Ted Kennedy's life and political career become derailed in the aftermath of a fatal car accident in 1969 that claims the life of a young campaign strategist, Mary Jo Kopechne.",2018-04-06,6.1,227,en,7.953
